date,datetime,desc,img,link,media,title
1 month ago,2020-12-02 12:23:44.572790,"Another front-runner, Moderna, said on Monday that its vaccine, which uses similar technology, was 94.5 percent effective and that the company also expected ...","data:image/gif;base64,R0lGODlhAQABAIAAAP///////yH5BAEKAAEALAAAAAABAAEAAAICTAEAOw==",https://www.nytimes.com/2020/11/20/health/pfizer-covid-vaccine.html,The New York Times,Pfizer Applies for Emergency F.D.A. Approval for Covid-19 Vaccine
th · 1 month ago,2020-12-02 12:23:44.646586,"Moderna has said that its vaccine needs to be frozen too, but only at minus 20 Celsius, more like a regular freezer. Since there will be limited vaccine doses at first, ...","data:image/gif;base64,R0lGODlhAQABAIAAAP///////yH5BAEKAAEALAAAAAABAAEAAAICTAEAOw==",https://www.npr.org/sections/health-shots/2020/11/17/935563377/why-does-pfizers-covid-19-vaccine-need-to-be-kept-colder-than-antarctica,NPR,Why Moderna And Pfizer Vaccines Have Different Cold Storage Requirements : Shots - Health News
1 month ago,2020-12-02 12:23:44.648582,"The subject: preliminary data from Moderna's phase 3 trial of a Covid-19 vaccine, which found that the vaccine was about 95% effective at preventing the illness.","data:image/gif;base64,R0lGODlhAQABAIAAAP///////yH5BAEKAAEALAAAAAABAAEAAAICTAEAOw==",https://www.forbes.com/sites/leahrosenbaum/2020/11/16/moderna-ceo-covid-19-vaccines-fantastic-results-mean-it-could-be-ready-next-month/,Forbes,Moderna CEO: Covid-19 Vaccine's 'Fantastic' Results Mean It Could Be Ready Next Month
1 month ago,2020-12-02 12:23:44.651567,How do the Pfizer-BioNTech and Moderna vaccines work? The first vaccine authorized in the United States was developed by pharmaceutical giant Pfizer and ...,"data:image/gif;base64,R0lGODlhAQABAIAAAP///////yH5BAEKAAEALAAAAAABAAEAAAICTAEAOw==",https://www.washingtonpost.com/health/interactive/2020/covid-vaccines-what-you-need-to-know/,Washington Post,"Your questions about coronavirus vaccines, answered"
1 month ago,2020-12-02 12:23:44.653607,"The Moderna vaccine reduced the risk of Covid-19 infection by 94.5%. There were 95 cases of infection among patients in the company's 30,000-patient study.","data:image/gif;base64,R0lGODlhAQABAIAAAP///////yH5BAEKAAEALAAAAAABAAEAAAICTAEAOw==",https://www.statnews.com/2020/11/16/modernas-covid-19-vaccine-is-strongly-effective-early-look-at-data-show/,STAT,"Moderna's Covid-19 vaccine is strongly effective, early look at ..."
1 month ago,2020-12-02 12:23:44.655528,"Moderna, the biotech company that last week announced the results of its COVID-19 vaccine, will apply with the Food and Drug Administration for an emergency ...","data:image/gif;base64,R0lGODlhAQABAIAAAP///////yH5BAEKAAEALAAAAAABAAEAAAICTAEAOw==",https://www.businessinsider.com/moderna-emergency-use-authorization-vaccine-2020-11,Business Insider,Slaoui: Moderna to seek an emergency use authorization for vaccine - Business Insider
1 month ago,2020-12-02 12:23:44.657601,Biotech company Moderna applied Monday for an emergency use authorization from the U.S. Food and Drug Administration after receiving more good news ...,"data:image/gif;base64,R0lGODlhAQABAIAAAP///////yH5BAEKAAEALAAAAAABAAEAAAICTAEAOw==",https://www.usatoday.com/story/news/health/2020/11/30/moderna-emergency-fda-authorization-covid-19-vaccine-pfizer/6376336002/,USA TODAY,Moderna becomes second company to request emergency FDA authorization for COVID-19 vaccine candidate
1 month ago,2020-12-02 12:23:44.658595,"The biotech company Moderna Inc. said Monday that its experimental vaccine was 94.5% effective in preventing disease, according to an analysis of its clinical ...","data:image/gif;base64,R0lGODlhAQABAIAAAP///////yH5BAEKAAEALAAAAAABAAEAAAICTAEAOw==",https://www.npr.org/sections/health-shots/2020/11/16/935239294/modernas-covid-19-vaccine-shines-in-clinical-trial,NPR,"Moderna's Coronavirus Vaccine Nearly 95% Effective, Analysis Finds : Shots - Health News"
1 month ago,2020-12-02 12:23:44.660592,Moderna has said it could potentially produce 1bn doses of the vaccine by the end of 2021 and is applying for Emergency Use Authorization (EUA) with the US ...,"data:image/gif;base64,R0lGODlhAQABAIAAAP///////yH5BAEKAAEALAAAAAABAAEAAAICTAEAOw==",https://www.theguardian.com/music/2020/nov/17/dolly-parton-partly-funded-moderna-covid-vaccine-research,The Guardian,Dolly Parton partly funded Moderna Covid vaccine research
1 month ago,2020-12-02 12:23:44.662583,Pharmaceutical firms Pfizer and Moderna declared recently that their vaccine candidates have shown success in late-stage trials. Moderna claimed that its ...,"data:image/gif;base64,R0lGODlhAQABAIAAAP///////yH5BAEKAAEALAAAAAABAAEAAAICTAEAOw==",https://www.livemint.com/science/news/india-s-covaxin-to-pfizer-oxford-moderna-latest-updates-about-covid-vaccines-11605841209031.html,Livemint,"India's Covaxin to Pfizer, Oxford, Moderna: Latest updates about Covid vaccines"
1 month ago,2020-12-02 12:23:47.146675,Moderna's COVID-19 Vaccine Is 94.5% Effective. Here's What That Really Means. Getty Images/AFP.,"data:image/gif;base64,R0lGODlhAQABAIAAAP///////yH5BAEKAAEALAAAAAABAAEAAAICTAEAOw==",https://time.com/5912491/moderna-covid-19-vaccine-effectiveness/,TIME,Moderna’s COVID-19 Vaccine Is 94.5% Effective. Here’s What That Really Means
1 month ago,2020-12-02 12:23:47.148656,"With Moderna now, this is the sixth contract we have with a pharmaceutical company for our COVID-19 vaccine portfolio. We are working on yet another one.","data:image/gif;base64,R0lGODlhAQABAIAAAP///////yH5BAEKAAEALAAAAAABAAEAAAICTAEAOw==",https://ec.europa.eu/commission/presscorner/detail/en/statement_20_2199,,Statement by the President on Moderna
1 month ago,2020-12-02 12:23:47.152622,The European Union has agreed a deal with Moderna for up to 160 million doses of its mRNA COVID-19 vaccine candidate. The agreement covers a supply of ...,"data:image/gif;base64,R0lGODlhAQABAIAAAP///////yH5BAEKAAEALAAAAAABAAEAAAICTAEAOw==",https://www.biopharma-reporter.com/Article/2020/11/24/Europe-makes-deal-with-Moderna-for-160-million-doses-of-COVID-19-vaccine,BioPharma-Reporter.com,Europe makes deal with Moderna for 160 million doses of ...
1 month ago,2020-12-02 12:23:47.156613,The deal with Moderna is the sixth supply deal the EU has negotiated with vaccine makers to secure COVID-19 shots. joel saget/Agence France-Presse/Getty ...,"data:image/gif;base64,R0lGODlhAQABAIAAAP///////yH5BAEKAAEALAAAAAABAAEAAAICTAEAOw==",https://www.marketwatch.com/story/eu-strikes-deal-with-moderna-to-supply-up-to-160-million-vaccine-shots-11606226926,MarketWatch,EU strikes deal with Moderna to supply up to 160 million COVID vaccine shots
1 month ago,2020-12-02 12:23:47.158629,"BioNTech SE and Moderna Inc. could receive conditional European Union marketing authorization for their Covid-19 vaccines in the second half of next month, ...","data:image/gif;base64,R0lGODlhAQABAIAAAP///////yH5BAEKAAEALAAAAAABAAEAAAICTAEAOw==",https://www.bloomberg.com/news/articles/2020-11-20/eu-could-approve-biontech-moderna-vaccines-in-december,Bloomberg,"EU Could Approve BioNTech, Moderna Vaccines in December"
1 month ago,2020-12-02 12:23:47.160623,"The scientists randomly assigned volunteers to get either the Moderna vaccine or a placebo. The trial was blinded, meaning that neither the volunteers nor the ...","data:image/gif;base64,R0lGODlhAQABAIAAAP///////yH5BAEKAAEALAAAAAABAAEAAAICTAEAOw==",https://www.nytimes.com/live/2020/moderna-covid-19-vaccine,The New York Times,"Moderna's Covid-19 Vaccine, Explained"
1 month ago,2020-12-02 12:23:47.162621,"""Then when I found out that it was the Moderna trial, a new technology, one that has never been approved for a human vaccine before, I got sort of excited.","data:image/gif;base64,R0lGODlhAQABAIAAAP///////yH5BAEKAAEALAAAAAABAAEAAAICTAEAOw==",https://www.npr.org/sections/coronavirus-live-updates/2020/11/20/937097365/what-it-was-like-to-participate-in-the-clinical-trial-for-modernas-covid-19-vacc,NPR,What It Was Like To Participate In The Clinical Trial For ...
1 month ago,2020-12-02 12:23:47.163615,Wall Street was buoyed to record highs after Moderna said preliminary phase three trial data shows its coronavirus vaccine is more than 94% effective in ...,"data:image/gif;base64,R0lGODlhAQABAIAAAP///////yH5BAEKAAEALAAAAAABAAEAAAICTAEAOw==",https://www.cnbc.com/2020/11/17/asia-pacific-markets-moderna-vaccine-oil-and-currencies.html,CNBC,Airline stocks jump as vaccine hopes again lift markets; Asia-Pacific shares mixed
1 month ago,2020-12-02 12:23:47.165610,"More pointedly, Moderna has firmly planted itself in the general public's psyche due to its Covid-19 vaccine candidate mRNA-1273. The company reported interim ...","data:image/gif;base64,R0lGODlhAQABAIAAAP///////yH5BAEKAAEALAAAAAABAAEAAAICTAEAOw==",https://finance.yahoo.com/news/moderna-firing-cylinders-analyst-boosts-010546657.html,Yahoo Finance,Moderna Is Firing on All Cylinders; Analyst Boosts Price Target
1 month ago,2020-12-02 12:23:47.170577,"FRANKFURT (Reuters) - Moderna will charge governments between $25 and $37 per dose of its COVID-19 vaccine candidate, depending on the amount ...","data:image/gif;base64,R0lGODlhAQABAIAAAP///////yH5BAEKAAEALAAAAAABAAEAAAICTAEAOw==",https://www.reuters.com/article/uk-health-coronavirus-moderna-eu/moderna-to-charge-25-37-for-covid-19-vaccine-ceo-tells-paper-idUKKBN2810WK,Reuters,Moderna to charge $25-$37 for COVID-19 vaccine: CEO tells paper
1 month ago,2020-12-02 12:23:49.302393,"Tal Zaks, chief medical officer at Moderna, about its coronavirus vaccine, which is said to be nearly 95% effective, according to clinical trial data. MARY LOUISE ...","data:image/gif;base64,R0lGODlhAQABAIAAAP///////yH5BAEKAAEALAAAAAABAAEAAAICTAEAOw==",https://www.npr.org/2020/11/16/935475346/chief-medical-officer-on-moderna-coronavirus-vaccine-said-to-be-nearly-95-effect,,Chief Medical Officer On Moderna Coronavirus Vaccine Said ...
1 month ago,2020-12-02 12:23:49.304387,"Moderna has seen a significant increase in the rate of case identification across sites in the last week. As a result, the Company expects the first interim analysis ...","data:image/gif;base64,R0lGODlhAQABAIAAAP///////yH5BAEKAAEALAAAAAABAAEAAAICTAEAOw==",https://www.businesswire.com/news/home/20201111005805/en/Moderna-Has-Completed-Case-Accrual-for-First-Planned-Interim-Analysis-of-its-mRNA-Vaccine-Against-COVID-19-mRNA-1273,,Moderna Has Completed Case Accrual for First Planned ...
1 month ago,2020-12-02 12:23:49.306382,"Positive data on Pfizer and Moderna's mRNA vaccine candidates have been tempered in recent weeks by concerns over shipping hurdles for the shots, both of ...","data:image/gif;base64,R0lGODlhAQABAIAAAP///////yH5BAEKAAEALAAAAAABAAEAAAICTAEAOw==",https://www.fiercepharma.com/manufacturing/airlines-rally-cold-chain-supplies-to-ship-pfizer-moderna-s-frigid-covid-19-shots,FiercePharma,"Airlines rally cold-chain supplies to ship Pfizer, Moderna's ..."
1 month ago,2020-12-02 12:23:49.308376,"Noubar Afeyan, co-founder and chairman of Moderna, says Canada is assured vaccine doses in the first batch and discussions to increase orders are ongoing.","data:image/gif;base64,R0lGODlhAQABAIAAAP///////yH5BAEKAAEALAAAAAABAAEAAAICTAEAOw==",https://www.cbc.ca/news/politics/canada-vaccine-moderna-covid-19-hadju-health-1.5821166,CBC.ca,"Canada 'not at the back of the line' for COVID-19 vaccine, Moderna chairman says"
1 month ago,2020-12-02 12:23:49.310371,"The Moderna vaccine has met its goal for 30,000 national participants. Because of this, an interim analysis of the vaccine's efficacy has been gathered, resulting ...","data:image/gif;base64,R0lGODlhAQABAIAAAP///////yH5BAEKAAEALAAAAAABAAEAAAICTAEAOw==",https://detroitisit.com/henry-ford-health-systems-moderna-vaccine/,Detroitisit,Detroitisit - The Role Henry Ford Health Systems Played in the Moderna Vaccine Trials
1 month ago,2020-12-02 12:23:49.312366,Check out the companies making headlines midday on Monday: Moderna â€” The drugmaker's stock soared more than 7% after announcing preliminary phase ...,"data:image/gif;base64,R0lGODlhAQABAIAAAP///////yH5BAEKAAEALAAAAAABAAEAAAICTAEAOw==",https://www.cnbc.com/2020/11/16/stocks-making-the-biggest-moves-midday-moderna-simon-property-bbva-virgin-galactic-more.html,CNBC,"Stocks making the biggest moves midday: Moderna, Simon Property, BBVA, Virgin Galactic & more"
1 month ago,2020-12-02 12:23:49.315358,Better Coronavirus Stock: Pfizer or Moderna? The companies might both win the coronavirus vaccine race -- but only one may dominate the market in the long ...,"data:image/gif;base64,R0lGODlhAQABAIAAAP///////yH5BAEKAAEALAAAAAABAAEAAAICTAEAOw==",https://www.fool.com/investing/2020/11/25/better-coronavirus-stock-pfizer-or-moderna/,Motley Fool,Better Coronavirus Stock: Pfizer or Moderna?
1 month ago,2020-12-02 12:23:49.317352,"There should be enough vaccine doses made by Pfizer and Moderna to inoculate roughly 20 million before the end of the year, he said. The goal is to provide ...","data:image/gif;base64,R0lGODlhAQABAIAAAP///////yH5BAEKAAEALAAAAAABAAEAAAICTAEAOw==",https://www.cnbc.com/2020/11/16/coronavirus-hhs-secretary-azar-says-fda-will-move-as-quickly-as-possible-to-ok-moderna-and-pfizers-vaccines.html,CNBC,HHS Secretary Azar says the FDA will move 'as quickly as possible' to clear Moderna and Pfizer's Covid vaccines
1 month ago,2020-12-02 12:23:49.320347,"""Dolly Parton was one of the major funders for Moderna's coronavirus vaccine, which has proved to be nearly 95% effective in early data,"" reads an Instagram ...","data:image/gif;base64,R0lGODlhAQABAIAAAP///////yH5BAEKAAEALAAAAAABAAEAAAICTAEAOw==",https://www.usatoday.com/story/news/factcheck/2020/11/21/fact-check-dolly-parton-donated-modernas-covid-19-vaccine-studies/6373339002/,USA TODAY,Fact check: Dolly Parton helped fund Moderna's COVID-19 vaccine research
1 month ago,2020-12-02 12:23:49.322339,Moderna is just one of the vaccines currently undergoing trials to control the spread of COVID-19. The company reported that trials had a 94.5% success rate.,"data:image/gif;base64,R0lGODlhAQABAIAAAP///////yH5BAEKAAEALAAAAAABAAEAAAICTAEAOw==",https://www.newschannel5.com/news/vanderbilt-researchers-thrilled-over-moderna-vaccine-success,NewsChannel5.com,Vanderbilt researchers thrilled over Moderna vaccine success
1 month ago,2020-12-02 12:23:51.250321,The biotechnology company Moderna on Monday reported preliminary trial data indicating its COVID-19 vaccine candidate is 94.5% effective—progress that ...,"data:image/gif;base64,R0lGODlhAQABAIAAAP///////yH5BAEKAAEALAAAAAABAAEAAAICTAEAOw==",https://www.pittwire.pitt.edu/news/pittsburgh-lends-expertise-arms-moderna-vaccine-development,UPJ Athletics,"Pittsburgh Lends Expertise, Arms to Moderna Vaccine ..."
1 month ago,2020-12-02 12:23:51.252282,"PITTSBURGH (KDKA) — Moderna found its coronavirus vaccine to be 94.5 percent effective in Phase 3 of its trials. As vaccine development continues, KDKA ...","data:image/gif;base64,R0lGODlhAQABAIAAAP///////yH5BAEKAAEALAAAAAABAAEAAAICTAEAOw==",https://pittsburgh.cbslocal.com/2020/11/17/moderna-coronavirus-vaccine-trial-experiences/,CBS Pittsburgh,COVID-19 In Pittsburgh: Doctor Taking Part In Moderna Trial Says He Believes In Safety Of Vaccines
1 month ago,2020-12-02 12:23:51.254312,"New Jersey Journalist Tells CBS2 About Her Experience Taking Part In Moderna COVID-19 Vaccine Trials. November 16, 2020 at 11:37 pm. Filed Under:Alice ...","data:image/gif;base64,R0lGODlhAQABAIAAAP///////yH5BAEKAAEALAAAAAABAAEAAAICTAEAOw==",https://newyork.cbslocal.com/2020/11/16/moderna-covid-19-vaccine-trials-lindy-washburn/,CBS New York,New Jersey Journalist Tells CBS2 About Her Experience Taking Part In Moderna COVID-19 Vaccine Trials
1 month ago,2020-12-02 12:23:51.256306,Pharmaceutical company Moderna — cofounded by a Cornell-educated medical pioneer — announced promising results in its development of a coronavirus ...,"data:image/gif;base64,R0lGODlhAQABAIAAAP///////yH5BAEKAAEALAAAAAABAAEAAAICTAEAOw==",https://cornellsun.com/2020/11/18/cornellian-founded-moderna-latest-front-runner-in-vaccine-race/,Cornell University The Cornell Daily Sun,Cornellian-Founded Moderna Latest Front-Runner in Vaccine ...
1 month ago,2020-12-02 12:23:51.258264,"Moderna released interim data from the expansion cohort of its ongoing Phase I trial of its mRNA personalized cancer vaccine, mRNA-4157. The product is being ...","data:image/gif;base64,R0lGODlhAQABAIAAAP///////yH5BAEKAAEALAAAAAABAAEAAAICTAEAOw==",https://www.biospace.com/article/moderna-s-personalized-cancer-vaccine-shows-promise-in-early-stage-trial/,BioSpace,Moderna's Personalized Cancer Vaccine Shows Promise in ...
1 month ago,2020-12-02 12:23:51.260259,The vaccines 'do not show that they prevent you from potentially carrying this virus . . . and infecting others.' Moderna chief medical officer: Vaccinated adults could ...,"data:image/gif;base64,R0lGODlhAQABAIAAAP///////yH5BAEKAAEALAAAAAABAAEAAAICTAEAOw==",https://www.fastcompany.com/90579773/moderna-chief-medical-officer-vaccinated-adults-could-still-infect-the-unvaccinated-with-covid,Fast Company,Moderna chief medical officer: Vaccinated adults could still ...
1 month ago,2020-12-02 12:23:51.262253,(Reuters) - European shares ended at a more-than-eight-month high on Monday as positive data from Moderna Inc's COVID-19 vaccine boosted investor ...,"data:image/gif;base64,R0lGODlhAQABAIAAAP///////yH5BAEKAAEALAAAAAABAAEAAAICTAEAOw==",https://in.reuters.com/article/us-europe-stocks/european-shares-end-at-over-eight-month-high-on-moderna-vaccine-optimism-idINKBN27W0SS,Reuters India,European shares end at over eight-month high on Moderna vaccine optimism
1 month ago,2020-12-02 12:23:51.263250,But the chances for Moderna to win a Food and Drug Administration EUA should now be very good. Success for the experimental vaccine could also bode well for ...,"data:image/gif;base64,R0lGODlhAQABAIAAAP///////yH5BAEKAAEALAAAAAABAAEAAAICTAEAOw==",https://www.fool.com/investing/2020/11/18/could-moderna-become-the-biggest-vaccine-company-i/,Motley Fool,Could Moderna Become the Biggest Vaccine Company in the World Within 4 Years?
1 month ago,2020-12-02 12:23:51.265245,"Moderna recently announced that its vaccine was found to be 94.5% effective at preventing coronavirus transmission in a late-stage trial with 30,000 participants.","data:image/gif;base64,R0lGODlhAQABAIAAAP///////yH5BAEKAAEALAAAAAABAAEAAAICTAEAOw==",https://www.businessinsider.com/moderna-ceo-vaccines-are-not-silver-bullet-must-wear-masks-2020-11,Business Insider,"Moderna CEO: Vaccines aren't a 'silver bullet,' people must wear masks - Business Insider"
1 month ago,2020-12-02 12:23:51.267279,"Moderna's MRNA, -5.99% announcement is the latest piece of upbeat news on the COVID-19 vaccine front, after Pfizer Inc. and BioNTech SE disclosed last week ...","data:image/gif;base64,R0lGODlhAQABAIAAAP///////yH5BAEKAAEALAAAAAABAAEAAAICTAEAOw==",https://www.marketwatch.com/story/zoom-peloton-netflix-stocks-among-stay-home-names-declining-after-upbeat-moderna-vaccine-announcement-11605533459,MarketWatch,"Zoom, Peloton, Netflix stocks among stay-home names declining after upbeat Moderna vaccine announcement"
1 month ago,2020-12-02 12:23:52.393198,"Moderna, whose vaccine requires two doses per person, has said it remains on track to produce between 500 million and 1 billion doses annually by 2021, while ...","data:image/gif;base64,R0lGODlhAQABAIAAAP///////yH5BAEKAAEALAAAAAABAAEAAAICTAEAOw==",https://www.reuters.com/article/us-health-coronavirus-lonza-moderna-idUSKBN27W1N0,Reuters,Lonza aims to make ingredients for 400 million doses of Moderna's COVID vaccine annually
1 month ago,2020-12-02 12:23:52.395192,"Moderna, which was founded in 2010 and is lossmaking, will hope its promising Covid-19 vaccine has vindicated its bet on messenger ribonucleic acid (mRNA), ...","data:image/gif;base64,R0lGODlhAQABAIAAAP///////yH5BAEKAAEALAAAAAABAAEAAAICTAEAOw==",https://www.ft.com/content/0cf071a2-b6a6-49ac-b921-f3ecd30267b2,Financial Times,Moderna's Covid vaccine offers vindication of its ...
1 month ago,2020-12-02 12:23:52.397187,"PARIS (Reuters) - Sweden's Recipharm will produce doses of Moderna's COVID-19 vaccine candidate in central France, the company said on Wednesday, ...","data:image/gif;base64,R0lGODlhAQABAIAAAP///////yH5BAEKAAEALAAAAAABAAEAAAICTAEAOw==",https://www.reuters.com/article/us-health-coronavirus-france-vaccine-idUSKBN2850YS,Reuters,Recipharm to produce some of Moderna's COVID-19 vaccine in France
1 month ago,2020-12-02 12:23:52.399183,Moderna said last week its vaccine was 94.5% effective in preventing COVID-19 - based on interim data from a late-stage trial - and that it would soon apply for ...,"data:image/gif;base64,R0lGODlhAQABAIAAAP///////yH5BAEKAAEALAAAAAABAAEAAAICTAEAOw==",https://www.reuters.com/article/us-health-coronavirus-moderna-recipharm-idUSKBN2840RU,Reuters,Sweden's Recipharm signs deal to package Moderna's COVID-19 vaccine
1 month ago,2020-12-02 12:23:52.400179,Moderna announces vaccine trials show high effectiveness; reaction from Gov. Tate Reeves on 'Fox &amp; Friends.' Moderna CEO Stephane Bancel on Monday ...,"data:image/gif;base64,R0lGODlhAQABAIAAAP///////yH5BAEKAAEALAAAAAABAAEAAAICTAEAOw==",https://www.foxnews.com/health/moderna-coronavirus-vaccine-side-effects,Fox News,What are Moderna’s coronavirus vaccine side effects?
1 month ago,2020-12-02 12:23:52.402138,Moderna Inc. climbed as much as 10% hitting a record high on Wednesday while investors await the final analysis of its Covid-19 shots. That final look at the ...,"data:image/gif;base64,R0lGODlhAQABAIAAAP///////yH5BAEKAAEALAAAAAABAAEAAAICTAEAOw==",https://www.bloomberg.com/news/articles/2020-11-25/moderna-soars-to-record-ahead-of-final-covid-vaccine-analysis,Bloomberg,Moderna Soars to Record Ahead of Final Covid Vaccine ...
"Nov 4, 2020",2020-11-04 00:00:00.000000,From a glance at early design sketches it is clear to that Ferraris have inspired the Moderna's design. The traditional tubular steel chassis will be used with the ...,"data:image/gif;base64,R0lGODlhAQABAIAAAP///////yH5BAEKAAEALAAAAAABAAEAAAICTAEAOw==",https://gtspirit.com/2020/11/04/gto-engineering-unveil-60s-inspired-v12-moderna/,GTspirit,GTO Engineering Unveils '60s Inspired V12 'Moderna'
1 month ago,2020-12-02 12:23:52.406163,Ashish Jha had to say about the Moderna COVID-19 vaccine news. “I think we're still some ways away from something that will be the new normal.” coronavirus ...,"data:image/gif;base64,R0lGODlhAQABAIAAAP///////yH5BAEKAAEALAAAAAABAAEAAAICTAEAOw==",https://www.boston.com/news/coronavirus/2020/11/16/ashish-jha-moderna-coronavirus-vaccine,Boston.com,Watch: What Dr. Ashish Jha had to say about the Moderna COVID-19 vaccine news
1 month ago,2020-12-02 12:23:52.408160,"Shares of Moderna Inc. dropped Tuesday, to pull back from the previous session's record close, after BMO Capital analyst George Farmer recommended “taking ...","data:image/gif;base64,R0lGODlhAQABAIAAAP///////yH5BAEKAAEALAAAAAABAAEAAAICTAEAOw==",https://www.marketwatch.com/story/moderna-stock-drops-after-bmo-analyst-recommends-taking-profit-11605629710,MarketWatch,Moderna stock drops after BMO analyst recommends taking profit
1 month ago,2020-12-02 12:23:52.410153,"NOVEMBER 16: Moderna COVID vaccine recipient Yasir Batalvi in the North End on November 16, 2020 in Boston , Massachusetts. (Staff Photo By Matt Stone/ ...","data:image/gif;base64,R0lGODlhAQABAIAAAP///////yH5BAEKAAEALAAAAAABAAEAAAICTAEAOw==",https://www.bostonherald.com/2020/11/16/boston-resident-on-being-a-moderna-covid-vaccine-trial-participant-i-see-it-as-civic-duty/,Boston Herald,Boston resident on being a Moderna coronavirus vaccine trial participant: ‘I see it as civic duty’
1 month ago,2020-12-02 12:23:53.682455,"After all, Moderna remains quite risky, with no products on the market yet. If you're a more risk-averse investor seeking exposure in the COVID-19 vaccine race, ...","data:image/gif;base64,R0lGODlhAQABAIAAAP///////yH5BAEKAAEALAAAAAABAAEAAAICTAEAOw==",https://www.fool.com/investing/2020/11/12/forget-moderna-this-is-a-stronger-coronavirus-stoc/,Motley Fool,Forget Moderna: This Is a Stronger Coronavirus Stock
1 month ago,2020-12-02 12:23:53.684449,Moderna definitely enjoys something of a head start over Novavax in this race. While Novavax has a phase 3 clinical study for its experimental COVID-19 vaccine ...,"data:image/gif;base64,R0lGODlhAQABAIAAAP///////yH5BAEKAAEALAAAAAABAAEAAAICTAEAOw==",https://www.fool.com/investing/2020/11/21/better-coronavirus-stock-moderna-or-novavax/,Motley Fool,Better Coronavirus Stock: Moderna or Novavax?
"Nov 4, 2020",2020-11-04 00:00:00.000000,Moderna expects to be able to produce around 20 million doses of mRNA-1273 by the end of this year. The biotech anticipates that its international manufacturing ...,"data:image/gif;base64,R0lGODlhAQABAIAAAP///////yH5BAEKAAEALAAAAAABAAEAAAICTAEAOw==",https://www.fool.com/investing/2020/11/04/3-big-advantages-novavax-has-over-moderna/,Motley Fool,3 Big Advantages Novavax Has Over Moderna
1 month ago,2020-12-02 12:23:53.688442,"Recovery stocks like airlines, cruise companies, and oil drillers all rallied on hopes for the vaccines from Pfizer, Moderna, and others (see the latest in the chart ...","data:image/gif;base64,R0lGODlhAQABAIAAAP///////yH5BAEKAAEALAAAAAABAAEAAAICTAEAOw==",https://www.investopedia.com/u-s-markets-rally-on-positive-vaccine-news-from-moderna-5087864,Investopedia,US Markets Rally on Positive Vaccine News From Moderna
1 month ago,2020-12-02 12:23:53.689436,"Moderna and the EU finalized a deal Tuesday to supply 160 million doses of the Boston biotech's mRNA-based COVID-19 shot, bringing the bloc's overall ...","data:image/gif;base64,R0lGODlhAQABAIAAAP///////yH5BAEKAAEALAAAAAABAAEAAAICTAEAOw==",https://www.fiercepharma.com/manufacturing/moderna-eu-clinch-supply-deal-for-160m-doses-mrna-based-coronavirus-vaccine,FiercePharma,"Moderna, EU clinch supply deal for 160M doses of mRNA ..."
