date,datetime,desc,img,link,media,title
1 month ago,2020-12-02 12:23:53.691430,DETROIT – News that the Moderna COVID-19 vaccine is nearly 95 percent effective has given hope that the pandemic will end sooner. “We are manufacturing ...,"data:image/gif;base64,R0lGODlhAQABAIAAAP///////yH5BAEKAAEALAAAAAABAAEAAAICTAEAOw==",https://www.clickondetroit.com/news/local/2020/11/16/how-henry-ford-hospital-played-key-role-in-moderna-vaccine-study/,WDIV ClickOnDetroit,How Henry Ford Hospital played key role in Moderna vaccine ...
1 month ago,2020-12-02 12:23:53.693426,"U.S. stocks jump after Moderna vaccine breakthrough — Here's what experts say to watch. Published Mon, Nov 16 20204:03 PM EST. Keris Lahiff ...","data:image/gif;base64,R0lGODlhAQABAIAAAP///////yH5BAEKAAEALAAAAAABAAEAAAICTAEAOw==",https://www.cnbc.com/2020/11/16/stock-market-today-moderna-covid-vaccine-experts-on-what-to-watch.html,CNBC,U.S. stocks jump after Moderna vaccine breakthrough — Here's what experts say to watch
"Nov 2, 2020",2020-11-02 00:00:00.000000,Takeda will import and distribute 50 million doses of the mRNA-1273 vaccine candidate under an agreement with Moderna and Government of Japan. Doctor in ...,"data:image/gif;base64,R0lGODlhAQABAIAAAP///////yH5BAEKAAEALAAAAAABAAEAAAICTAEAOw==",https://www.europeanpharmaceuticalreview.com/news/132173/takeda-to-supply-japan-with-modernas-covid-19-vaccine/,European Pharmaceutical Review,Takeda to supply Japan with Moderna's COVID-19 vaccine
1 month ago,2020-12-02 12:23:53.696421,"Some 700 of Moderna's 30,000 volunteers to test the vaccine are from the Metro Detroit area. The tests with either the real experimental vaccine or a placebo were ...","data:image/gif;base64,R0lGODlhAQABAIAAAP///////yH5BAEKAAEALAAAAAABAAEAAAICTAEAOw==",https://www.abc12.com/2020/11/17/michigan-hospital-helped-test-modernas-covid-19-vaccine/,ABC 12 News,Michigan hospital helped test Moderna's COVID-19 vaccine
1 month ago,2020-12-02 12:23:53.698412,The recent high efficacy rates of the both Moderna and Pfizer's coronavirus vaccines has sparked hope and also highlighted the potential success of mRNA ...,"data:image/gif;base64,R0lGODlhAQABAIAAAP///////yH5BAEKAAEALAAAAAABAAEAAAICTAEAOw==",https://www.bostonherald.com/2020/11/20/pfizer-and-moderna-vaccines-showing-potential-success-of-mrna-platform-a-first/,Boston Herald,Pfizer and Moderna vaccines showing potential success of mRNA platform – a first
1 month ago,2020-12-02 12:23:54.928824,"Some 700 of Moderna's 30,000 volunteers to test the vaccine are from the Metro Detroit area. The tests with either the real experimental vaccine or a placebo were ...","data:image/gif;base64,R0lGODlhAQABAIAAAP///////yH5BAEKAAEALAAAAAABAAEAAAICTAEAOw==",https://www.abc12.com/2020/11/17/michigan-hospital-helped-test-modernas-covid-19-vaccine/,ABC 12 News,Michigan hospital helped test Moderna's COVID-19 vaccine
1 month ago,2020-12-02 12:23:54.930819,The recent high efficacy rates of the both Moderna and Pfizer's coronavirus vaccines has sparked hope and also highlighted the potential success of mRNA ...,"data:image/gif;base64,R0lGODlhAQABAIAAAP///////yH5BAEKAAEALAAAAAABAAEAAAICTAEAOw==",https://www.bostonherald.com/2020/11/20/pfizer-and-moderna-vaccines-showing-potential-success-of-mrna-platform-a-first/,Boston Herald,Pfizer and Moderna vaccines showing potential success of mRNA platform – a first
1 month ago,2020-12-02 12:23:54.932814,"In an exclusive interview with FRANCE 24, Noubar Afeyan, the co-founder and chairman of Moderna, discussed his biotech firm's Covid-19 vaccine, which ...","data:image/gif;base64,R0lGODlhAQABAIAAAP///////yH5BAEKAAEALAAAAAABAAEAAAICTAEAOw==",https://www.france24.com/en/tv-shows/the-interview/20201120-exclusive-moderna-covid-19-vaccine-has-been-made-rapidly-but-thoroughly-chairman-says,FRANCE 24,"The Interview - Exclusive: Moderna Covid-19 vaccine has been made 'rapidly but thoroughly', chairman says"
1 month ago,2020-12-02 12:23:54.934808,Moderna's COVID-19 vaccine candidate sparks market rally after achieving 94.5% efficacy in late-stage trial and requires only standard refrigeration · Biotech says ...,"data:image/gif;base64,R0lGODlhAQABAIAAAP///////yH5BAEKAAEALAAAAAABAAEAAAICTAEAOw==",https://www.marketwatch.com/story/modernas-covid-19-vaccine-candidate-achieves-945-efficacy-in-late-stage-trial-sparking-market-rally-2020-11-16,MarketWatch,Moderna’s COVID-19 vaccine candidate sparks market rally after achieving 94.5% efficacy in late-stage trial and requires only standard refrigeration
1 month ago,2020-12-02 12:23:54.937801,Moderna (NASDAQ:MRNA) announced today that its COVID-19 vaccine candidate will have a longer shelf life at refrigerator temperatures than previously ...,"data:image/gif;base64,R0lGODlhAQABAIAAAP///////yH5BAEKAAEALAAAAAABAAEAAAICTAEAOw==",https://www.fool.com/investing/2020/11/16/new-shelf-life-data-for-modernas-coronavirus-vacci/,Motley Fool,New Shelf-Life Data for Moderna's Coronavirus Vaccine Gives It an Edge
1 month ago,2020-12-02 12:23:54.939795,"Moderna, which is up 8% on the news, is held by around 2,300 active and index funds globally, of which around 100 are domiciled in the UK. 97.36 USD +7.97 ...","data:image/gif;base64,R0lGODlhAQABAIAAAP///////yH5BAEKAAEALAAAAAABAAEAAAICTAEAOw==",http://citywire.co.uk/new-model-adviser/the-uk-fund-managers-boosted-by-moderna-vaccine-breakthrough/a1426346,Citywire Financial Publishers,The UK fund managers boosted by Moderna vaccine ...
1 month ago,2020-12-02 12:23:54.941790,"Following is the unofficial transcript of a CNBC interview with Moderna CEO Stephane Bancel on CNBC's “Squawk Box” (M-F, 6AM-9AM ET) today, Monday, ...","data:image/gif;base64,R0lGODlhAQABAIAAAP///////yH5BAEKAAEALAAAAAABAAEAAAICTAEAOw==",https://www.cnbc.com/2020/11/30/first-on-cnbc-cnbc-transcript-moderna-ceo-stephane-bancel-speaks-with-cnbcs-squawk-box-today.html,CNBC,First on CNBC: CNBC Transcript: Moderna CEO Stephane Bancel Speaks with CNBC’s “Squawk Box” Today
1 month ago,2020-12-02 12:23:54.943785,"If all stays on course, Pfizer and Moderna may be the first two market entrants with vaccines, using the non-traditional mRNA technology. But in order for at least ...","data:image/gif;base64,R0lGODlhAQABAIAAAP///////yH5BAEKAAEALAAAAAABAAEAAAICTAEAOw==",https://www.jdsupra.com/legalnews/covid-19-vaccine-leader-moderna-not-81369/,JD Supra,COVID-19 Vaccine Leader Moderna “Not Aware of Any Significant Intellectual Property Impediments” in Development of its Vaccine Despite Mixed Results at PTAB
1 month ago,2020-12-02 12:23:54.945779,Moderna developed its vaccine in collaboration with the National Institute of Allergy and Infectious Diseases. The analysis of the study showed 95 confirmed ...,"data:image/gif;base64,R0lGODlhAQABAIAAAP///////yH5BAEKAAEALAAAAAABAAEAAAICTAEAOw==",http://thedialog.org/featured/philadelphia-father-john-fields-was-first-volunteer-in-moderna-coronavirus-vaccine-trial-at-penn/,The Dialog,Philadelphia Father John Fields was first volunteer in ...
1 month ago,2020-12-02 12:23:54.947774,"Moderna shares jumped on Thursday after the company said it was closer to revealing results from its Covid-19 vaccine trial. The Cambridge, Mass., company ...","data:image/gif;base64,R0lGODlhAQABAIAAAP///////yH5BAEKAAEALAAAAAABAAEAAAICTAEAOw==",https://www.barrons.com/articles/moderna-stock-jumps-because-its-covid-vaccine-is-on-the-heels-of-pfizer-51605212038,Barron's,Moderna Stock Jumps Because Its Covid Vaccine Is on the Heels of Pfizer
1 month ago,2020-12-02 12:23:56.059570,"Moderna's interim analysis was based on 95 infections among trial participants, who received either a placebo or the vaccine. Of those, only five infections ...","data:image/gif;base64,R0lGODlhAQABAIAAAP///////yH5BAEKAAEALAAAAAABAAEAAAICTAEAOw==",https://www.nbcnews.com/health/health-news/covid-19-vaccine-candidate-94-5-percent-effective-moderna-says-n1247888,NBC News,"'Truly striking': Covid-19 vaccine candidate 94.5 percent effective, Moderna says"
1 month ago,2020-12-02 12:23:56.061565,"The Moderna vaccine, whose remarkable effectiveness in a late-stage trial was announced Monday morning, emerged directly out of a partnership between ...","data:image/gif;base64,R0lGODlhAQABAIAAAP///////yH5BAEKAAEALAAAAAABAAEAAAICTAEAOw==",https://www.scientificamerican.com/article/for-billion-dollar-covid-vaccines-basic-government-funded-science-laid-the-groundwork/,Scientific American,"For Billion-Dollar COVID Vaccines, Basic Government-Funded ..."
1 month ago,2020-12-02 12:23:56.063560,"Of the 30,000 volunteers nationwide for the late-stage trials for the Moderna vaccine, nearly 350 were part of the study conducted at George Washington ...","data:image/gif;base64,R0lGODlhAQABAIAAAP///////yH5BAEKAAEALAAAAAABAAEAAAICTAEAOw==",https://dcist.com/story/20/11/16/locals-helping-researchers-discover-effective-covid-19-vaccine/,,DC Volunteers Help Researchers Studying Moderna COVID ...
1 month ago,2020-12-02 12:23:56.065554,The EU joins a host of other countries that have put in contingent orders for Moderna's coronavirus vaccine. The U.S. is among those expecting to get mRNA-1273 ...,"data:image/gif;base64,R0lGODlhAQABAIAAAP///////yH5BAEKAAEALAAAAAABAAEAAAICTAEAOw==",https://www.fool.com/investing/2020/11/25/moderna-appian-lead-nasdaq-to-record-highs/,Motley Fool,"Moderna, Appian Lead Nasdaq to Record Highs"
1 month ago,2020-12-02 12:23:56.066551,"Just within the last few days, we learned of Moderna's success. That vaccine trial is being led by researchers at Vanderbilt University. Though Pfizer made ...","data:image/gif;base64,R0lGODlhAQABAIAAAP///////yH5BAEKAAEALAAAAAABAAEAAAICTAEAOw==",https://www.wate.com/news/top-stories/vanderbilt-researcher-explains-whats-in-the-moderna-vaccine-you-might-get/,WATE 6 On Your Side,Vanderbilt researcher explains what’s in the Moderna vaccine you might get
1 month ago,2020-12-02 12:23:56.068582,"Moderna's vaccine uses a technique called “messenger RNA,” which stimulates the body to create an immune response. Researchers at Penn have been working ...","data:image/gif;base64,R0lGODlhAQABAIAAAP///////yH5BAEKAAEALAAAAAABAAEAAAICTAEAOw==",https://philadelphia.cbslocal.com/2020/11/16/moderna-coronavirus-vaccine-uses-method-developed-largely-by-university-of-pennsylvania-researchers-doctor-says/,CBS Philly,"Moderna Coronavirus Vaccine Uses Method ‘Developed Largely’ By University Of Pennsylvania Researchers, Doctor Says"
1 month ago,2020-12-02 12:23:56.070543,Emory University researchers involved in the Moderna vaccine study were excited by Monday's announcement that their work will soon be submitted to federal ...,"data:image/gif;base64,R0lGODlhAQABAIAAAP///////yH5BAEKAAEALAAAAAABAAEAAAICTAEAOw==",https://www.ajc.com/education/moderna-vaccine-was-tested-in-study-based-at-emory-university/OVGZJN3XAJBRLDYBMHZRYOTJNM/,Atlanta Journal Constitution,Moderna COVID-19 vaccine was tested in study based at Emory University
1 month ago,2020-12-02 12:23:56.073600,"Self-interest nudged me to join Moderna's Covid-19 vaccine trial. Here's how it's going. By John Yang. November 19, 2020. Reprints.","data:image/gif;base64,R0lGODlhAQABAIAAAP///////yH5BAEKAAEALAAAAAABAAEAAAICTAEAOw==",https://www.statnews.com/2020/11/19/self-interest-nudged-me-to-join-moderna-covid-19-vaccine-trial/,STAT,Self-interest nudged me to join Moderna's Covid-19 vaccine trial
1 month ago,2020-12-02 12:23:56.075604,"Benzinga's Bulls And Bears Of The Week: Moderna, Palantir, Tesla And More. by Nelson Hem 3 min read. a month ago ...","data:image/gif;base64,R0lGODlhAQABAIAAAP///////yH5BAEKAAEALAAAAAABAAEAAAICTAEAOw==",https://www.benzinga.com/trading-ideas/long-ideas/20/11/18476480/benzingas-bulls-and-bears-of-the-week-moderna-palantir-tesla-and-more,Benzinga,"Benzinga's Bulls And Bears Of The Week: Moderna, Palantir ..."
1 month ago,2020-12-02 12:23:56.076600,"Moderna's vaccine has not yet received regulatory approval in the United States or Canada. However, Canada's federal government has contracted with the ...","data:image/gif;base64,R0lGODlhAQABAIAAAP///////yH5BAEKAAEALAAAAAABAAEAAAICTAEAOw==",https://www.cbc.ca/radio/checkup/will-you-get-the-covid-19-vaccine-shot-1.5808894/using-mrna-to-develop-vaccines-wasn-t-on-my-radar-says-moderna-co-founder-1.5812186,CBC.ca,"Using mRNA to develop vaccines wasn't 'on my radar,' says Moderna co-founder"
1 month ago,2020-12-02 12:23:56.536772,The cinema chain's stock rose as much as 21 per cent after US biotechnology company Moderna announced that early data suggested that its Covid-19 vaccine is ...,"data:image/gif;base64,R0lGODlhAQABAIAAAP///////yH5BAEKAAEALAAAAAABAAEAAAICTAEAOw==",https://www.cityam.com/cineworld-shares-soar-on-moderna-coronavirus-vaccine-breakthrough/,City A.M.,Cineworld shares soar on Moderna coronavirus vaccine breakthrough
1 month ago,2020-12-02 12:23:56.538767,Subsequent announcements by Moderna and a Russian research team are bolstering the first glimpses of what may be the end game for a pandemic that has ...,"data:image/gif;base64,R0lGODlhAQABAIAAAP///////yH5BAEKAAEALAAAAAABAAEAAAICTAEAOw==",http://angusreid.org/canada-covid-19-vaccine/,Angus Reid Institute,"Pfizer, Moderna & Meh: Highly effective COVID-19 vaccines ..."
1 month ago,2020-12-02 12:23:56.540762,"Moderna said its vaccine appears to be 94.5% effective, according to preliminary data from an ongoing study. A week ago, competitor Pfizer Inc. announced its ...","data:image/gif;base64,R0lGODlhAQABAIAAAP///////yH5BAEKAAEALAAAAAABAAEAAAICTAEAOw==",https://apnews.com/article/2nd-virus-vaccine-success-us-tests-5575a8a8ca3825a9bf39a5d234aba07b,Associated Press,2nd virus vaccine shows striking success in US tests
1 month ago,2020-12-02 12:23:56.542756,"Crucial data on Moderna's blockbuster Covid jab was released under embargo before the results were made public, sparking debate over how vaccine trial ...","data:image/gif;base64,R0lGODlhAQABAIAAAP///////yH5BAEKAAEALAAAAAABAAEAAAICTAEAOw==",https://www.telegraph.co.uk/business/2020/11/16/moderna-covid-vaccine-almost-95pc-effective/,Telegraph.co.uk,Moderna briefed out market-moving Covid jab data before general release
1 month ago,2020-12-02 12:23:56.544751,"The mRNA-1273 vaccine candidate was co-developed by the Cambridge, Massachusetts-based biotechnology company Moderna, Inc., and the National ...","data:image/gif;base64,R0lGODlhAQABAIAAAP///////yH5BAEKAAEALAAAAAABAAEAAAICTAEAOw==",https://www.nih.gov/news-events/news-releases/promising-interim-results-clinical-trial-nih-moderna-covid-19-vaccine,National Institutes of Health,Promising Interim Results from Clinical Trial of NIH-Moderna ...
1 month ago,2020-12-02 12:23:56.545748,Moderna Inc. said Monday it was asking U.S. and European regulators to allow emergency use of its COVID-19 vaccine as new study results confirm the shots ...,"data:image/gif;base64,R0lGODlhAQABAIAAAP///////yH5BAEKAAEALAAAAAABAAEAAAICTAEAOw==",https://apnews.com/article/moderna-asks-regulators-ok-virus-shots-a65a00cdf9725c9104886ded9052a85d,Associated Press,"Moderna asking US, European regulators to OK its virus shots"
1 month ago,2020-12-02 12:23:56.547743,(CNN) Moderna has finished accumulating data for a first analysis of its Covid-19 vaccine and expects to have an announcement on the vaccine's efficacy by the ...,"data:image/gif;base64,R0lGODlhAQABAIAAAP///////yH5BAEKAAEALAAAAAABAAEAAAICTAEAOw==",https://www.cnn.com/2020/11/11/health/moderna-vaccine-november-results/index.html,CNN,Moderna expects to know by the end of the month whether its Covid-19 vaccine works
1 month ago,2020-12-02 12:23:56.549737,"Moderna said Monday its shots provide strong protection, a dash of hope against the grim backdrop of coronavirus surges in the U.S. and around the world.","data:image/gif;base64,R0lGODlhAQABAIAAAP///////yH5BAEKAAEALAAAAAABAAEAAAICTAEAOw==",https://www.cbsnews.com/news/covid-vaccine-moderna-effective-trial/,CBS News,Moderna says its COVID-19 vaccine is 94.5% effective in late trial
1 month ago,2020-12-02 12:23:56.551732,"For the second time this month, there's promising news from a COVID-19 vaccine candidate: Moderna said Monday its shots provide strong protection, a dash of ...","data:image/gif;base64,R0lGODlhAQABAIAAAP///////yH5BAEKAAEALAAAAAABAAEAAAICTAEAOw==",https://www.wbur.org/commonhealth/2020/11/16/moderna-coronavirus-vaccine-early-trial-results-efficacy,WBUR,Moderna Coronavirus Vaccine Shows High Success In Early U.S. Tests
1 month ago,2020-12-02 12:23:56.552730,WATCH: Moderna Inc. says it has accumulated enough volunteers to allow a preliminary analysis of its Covid-19 vaccine shot.,"data:image/gif;base64,R0lGODlhAQABAIAAAP///////yH5BAEKAAEALAAAAAABAAEAAAICTAEAOw==",https://www.bloomberg.com/news/articles/2020-11-11/spotlight-to-shift-to-moderna-s-covid-vaccine-trial-in-days,Bloomberg,Moderna Poised to Take Vaccine Spotlight With Data Due
1 month ago,2020-12-02 12:23:58.646259,Moderna shares jumped about 7% in early trading on Thursday after Dr. Anthony Fauci predicted positive data from a second COVID-19 vaccine. The US ...,"data:image/gif;base64,R0lGODlhAQABAIAAAP///////yH5BAEKAAEALAAAAAABAAEAAAICTAEAOw==",https://www.businessinsider.com/moderna-stock-price-jumps-fauci-optimistic-covid-19-vaccine-data-2020-11,Business Insider,Moderna jumps 7% after Fauci says its upcoming COVID-19 ...
1 month ago,2020-12-02 12:23:58.648253,The UK government has secured five million doses of the covid-19 vaccine candidate mRNA-1273 from US biotech company Moderna after interim analysis of ...,"data:image/gif;base64,R0lGODlhAQABAIAAAP///////yH5BAEKAAEALAAAAAABAAEAAAICTAEAOw==",https://www.bmj.com/content/371/bmj.m4471,,"Covid-19: Moderna vaccine is nearly 95% effective, trial ..."
1 month ago,2020-12-02 12:23:58.650248,Moderna said Wednesday that it expects to release the first data from the late-stage trial of its coronavirus vaccine in the coming days — which could reveal ...,"data:image/gif;base64,R0lGODlhAQABAIAAAP///////yH5BAEKAAEALAAAAAABAAEAAAICTAEAOw==",https://www.politico.com/news/2020/11/11/moderna-to-reveal-covid-vaccine-data-436113,Politico,Moderna close to revealing first data on whether its vaccine works
1 month ago,2020-12-02 12:23:58.652243,"The Moderna vaccine efficacy follows early data reported last week by Pfizer, which said its candidate protected more than 90 percent of those who received it. The ...","data:image/gif;base64,R0lGODlhAQABAIAAAP///////yH5BAEKAAEALAAAAAABAAEAAAICTAEAOw==",https://georgiarecorder.com/brief/the-good-news-on-modernas-vaccine-trial-resonates-in-atlanta/,Georgia Recorder,The good news on Moderna's vaccine trial resonates in Atlanta
1 month ago,2020-12-02 12:23:58.654237,"(Reuters) - Moderna Inc MRNA.O said on Wednesday it has enough data for a first interim analysis of the late-stage trial of its experimental COVID-19 vaccine, ...","data:image/gif;base64,R0lGODlhAQABAIAAAP///////yH5BAEKAAEALAAAAAABAAEAAAICTAEAOw==",https://www.reuters.com/article/us-health-coronavirus-moderna-idUSKBN27R1SO,Reuters,Moderna closes in on release of COVID-19 vaccine data
1 month ago,2020-12-02 12:23:58.657229,In a NIH Director's Blog post released on the same day Moderna issued a press release announcing interim efficacy figures topping 94% for its vaccine ...,"data:image/gif;base64,R0lGODlhAQABAIAAAP///////yH5BAEKAAEALAAAAAABAAEAAAICTAEAOw==",https://www.raps.org/news-and-articles/news-articles/2020/11/nih-director-efficacy-for-co-developed-moderna-vac,Regulatory Focus,NIH director: Efficacy for co-developed Moderna vaccine ...
1 month ago,2020-12-02 12:23:58.659224,Moderna said Wednesday that enough people in its Phase 3 study had contracted the coronavirus for an independent panel to conduct its first “interim analysis” of ...,"data:image/gif;base64,R0lGODlhAQABAIAAAP///////yH5BAEKAAEALAAAAAABAAEAAAICTAEAOw==",https://nypost.com/2020/11/12/moderna-stock-jumps-after-key-step-toward-covid-vaccine-results/,New York Post,Moderna stock jumps after key step toward COVID-19 vaccine results
1 month ago,2020-12-02 12:23:58.661219,"Moderna's vaccine is a new type of medicine, like the one from Pfizer and its partner, BioNTech SE. Based on messenger RNA, it essentially transforms the cells of ...","data:image/gif;base64,R0lGODlhAQABAIAAAP///////yH5BAEKAAEALAAAAAABAAEAAAICTAEAOw==",https://finance.yahoo.com/news/moderna-vaccine-production-gearing-partner-050000557.html,Yahoo Finance,"Moderna Vaccine Production Is Gearing Up, Partner Lonza Says"
1 month ago,2020-12-02 12:23:58.663213,Moderna — Shares Moderna rose more than 11% in premarket trading after the drugmaker said new data confirms the vaccine is more than 94% effective in ...,"data:image/gif;base64,R0lGODlhAQABAIAAAP///////yH5BAEKAAEALAAAAAABAAEAAAICTAEAOw==",https://www.cnbc.com/2020/11/30/stocks-making-the-biggest-moves-premarket-moderna-ihs-markit-slack-more.html,CNBC,"Stocks making the biggest moves premarket: Moderna, IHS Markit, Slack & more"
1 month ago,2020-12-02 12:23:58.665208,"Moderna shares rose nearly 7% on Thursday, the day after the company announced it had collected enough data from phase three trials of its Covid-19 vaccine to ...","data:image/gif;base64,R0lGODlhAQABAIAAAP///////yH5BAEKAAEALAAAAAABAAEAAAICTAEAOw==",https://www.forbes.com/sites/giacomotognini/2020/11/12/mit-scientist-bob-langer-becomes-a-billionaire-thanks-to-moderna-stock-rally/,Forbes,MIT Scientist Bob Langer Becomes A Billionaire Thanks To Moderna Stock Rally
1 month ago,2020-12-02 12:24:00.462522,"Moderna, working with the federal government, has early results that show a 94.5% efficacy rate for its shots. It's the latest good news on the vaccine front. Earlier ...","data:image/gif;base64,R0lGODlhAQABAIAAAP///////yH5BAEKAAEALAAAAAABAAEAAAICTAEAOw==",https://www.usatoday.com/story/news/health/2020/11/16/covid-news-michigan-restrictions-scott-atlas-new-mexico/6305349002/,USA TODAY,Coronavirus live updates: California 'sounding the alarm' with widespread closures; Dr. Anthony Fauci encouraged by Moderna's vaccine news
1 month ago,2020-12-02 12:24:00.464520,"Moderna — The biotech stock rose 2% after Moderna said that it has had enough cases of Covid-19 in its vaccine candidate trial to take a look at the data, ...","data:image/gif;base64,R0lGODlhAQABAIAAAP///////yH5BAEKAAEALAAAAAABAAEAAAICTAEAOw==",https://www.cnbc.com/2020/11/11/stocks-making-the-biggest-moves-after-hours-moderna-revolve-fossil-more.html,CNBC,"Stocks making the biggest moves after hours: Moderna, Revolve, Fossil & more"
1 month ago,2020-12-02 12:24:00.466510,The Pfizer and Moderna vaccines use messenger RNA. The vaccine prompts the body to produce COVID-19's spike protein. A person's immune system then ...,"data:image/gif;base64,R0lGODlhAQABAIAAAP///////yH5BAEKAAEALAAAAAABAAEAAAICTAEAOw==",https://www.marketplace.org/2020/11/12/moderna-trial-data-start-analyzing-how-well-its-covid-19-vaccine-works/,Marketplace.org,Moderna says it can start analyzing how well its COVID-19 vaccine works
1 month ago,2020-12-02 12:24:00.468510,"The Moderna Phase III clinical trial of its mRNA vaccine is being conducted in 30,000 people, half receiving the vaccine, half a placebo. The trial guidelines call for ...","data:image/gif;base64,R0lGODlhAQABAIAAAP///////yH5BAEKAAEALAAAAAABAAEAAAICTAEAOw==",https://www.biospace.com/article/moderna-next-in-line-to-report-covid-19-vaccine-data-probably-by-end-of-the-month/,BioSpace,Moderna On Track for Early Data Readout for COVID-19 ...
1 month ago,2020-12-02 12:24:00.470504,"Moderna shares jumped 10 percent, landing the company a market capitalization around $39 billion. Even Dr. Anthony Fauci, the top U.S. infectious disease ...","data:image/gif;base64,R0lGODlhAQABAIAAAP///////yH5BAEKAAEALAAAAAABAAEAAAICTAEAOw==",https://news.crunchbase.com/news/with-flagship-behind-it-moderna-quickly-scaled-from-startup-to-world-changing-biotech/,Crunchbase News,"With Flagship Behind It, Moderna Quickly Scaled From Startup ..."
1 month ago,2020-12-02 12:24:00.472419,"Moderna said its vaccine appears to be 94.5% effective, according to data from an ongoing study across the country, including at at the University of Chicago and ...","data:image/gif;base64,R0lGODlhAQABAIAAAP///////yH5BAEKAAEALAAAAAABAAEAAAICTAEAOw==",https://chicago.suntimes.com/business/2020/11/16/21569348/moderna-coronavirus-vaccine-university-illinois-chicago-uchicago-uic,Chicago Sun-Times,Chicago researchers ‘excited’ Moderna coronavirus vaccine tested here shows early success
1 month ago,2020-12-02 12:24:00.474492,Moderna Inc. Chief Executive Officer Stephane Bancel's net worth jumped by $200 million Monday after the biotech released encouraging results of its ...,"data:image/gif;base64,R0lGODlhAQABAIAAAP///////yH5BAEKAAEALAAAAAABAAEAAAICTAEAOw==",https://www.bloomberg.com/news/articles/2020-11-16/moderna-billionaires-gain-340-million-on-vaccine-promise,Bloomberg,Moderna Billionaires Gain $410 Million on Vaccine Promise
1 month ago,2020-12-02 12:24:00.476484,"Shares of Moderna jumped nearly 15% in premarket trading. Casper Sleep (CSPR) – Casper Sleep lost 40 cents per share for the third quarter, wider than the 33 ...","data:image/gif;base64,R0lGODlhAQABAIAAAP///////yH5BAEKAAEALAAAAAABAAEAAAICTAEAOw==",https://www.cnbc.com/2020/11/16/stocks-making-the-biggest-moves-in-the-premarket-moderna-casper-sleep-uber-tapestry-more.html,CNBC,"Stocks making the biggest moves in the premarket: Moderna, Casper Sleep, Uber, Tapestry & more"
1 month ago,2020-12-02 12:24:00.477484,"Moderna has also inked a 100-million-dose supply deal with the U.S. government, with an option for up to 400 million additional doses. Japan has committed to ...","data:image/gif;base64,R0lGODlhAQABAIAAAP///////yH5BAEKAAEALAAAAAABAAEAAAICTAEAOw==",https://www.fool.com/investing/2020/11/24/moderna-set-to-sell-160-million-coronavirus-vaccin/,Motley Fool,Moderna Set to Sell 160 Million Coronavirus Vaccine Doses to EU
