date,datetime,desc,img,link,media,title
1 month ago,2020-12-02 12:24:00.479480,"Both Moderna and Pfizer are on track to seek permission for emergency use in the U.S. within weeks. Still, initial supplies will be limited and rationed.","data:image/gif;base64,R0lGODlhAQABAIAAAP///////yH5BAEKAAEALAAAAAABAAEAAAICTAEAOw==",https://www.khou.com/article/news/health/coronavirus/2nd-coronavirus-vaccine-shows-early-success/507-605115ca-e7e2-4100-ac3b-bc313dc4ee61,KHOU.com,Moderna says COVID-19 vaccine almost 95% effective
1 month ago,2020-12-02 12:24:01.670937,Both Pfizer and its German collaborator BioNTech and Moderna showed earlier this month that their candidate vaccines can protect against COVID-19 ...,"data:image/gif;base64,R0lGODlhAQABAIAAAP///////yH5BAEKAAEALAAAAAABAAEAAAICTAEAOw==",https://www.usatoday.com/story/news/health/2020/11/16/moderna-pfizer-covid-vaccine-heres-what-we-know-them/6308571002/,USA TODAY,There are now three promising COVID vaccine candidates. This is what we know about them.
1 month ago,2020-12-02 12:24:01.672897,Nova Safo: Moderna says its coronavirus vaccine is almost 95% effective and may have helped prevent severe cases of COVID-19 among those who still got ...,"data:image/gif;base64,R0lGODlhAQABAIAAAP///////yH5BAEKAAEALAAAAAABAAEAAAICTAEAOw==",https://www.marketplace.org/2020/11/16/second-coronavirus-vaccine-from-moderna-shows-promise/,Marketplace.org,"Second coronavirus vaccine, from Moderna, shows promise"
1 month ago,2020-12-02 12:24:01.674926,"Medical syringes are seen with Moderna company logo displayed on a screen in the background in this illustration photo taken in Poland on October 12, 2020.","data:image/gif;base64,R0lGODlhAQABAIAAAP///////yH5BAEKAAEALAAAAAABAAEAAAICTAEAOw==",https://www.cnbc.com/2020/11/12/stocks-making-the-biggest-moves-premarket-moderna-energizer-holdings-alibaba-nike-more.html,CNBC,"Stocks making the biggest moves premarket: Moderna, Energizer Holdings, Alibaba, Nike & more"
1 month ago,2020-12-02 12:24:01.676921,Moderna says it expects to have 20 million doses of vaccine ready to ship by the end of 2020 and up to 1 million available next year. Pfizer plans on 50 million ...,"data:image/gif;base64,R0lGODlhAQABAIAAAP///////yH5BAEKAAEALAAAAAABAAEAAAICTAEAOw==",https://www.voanews.com/covid-19-pandemic/moderna-announces-second-covid-vaccine-more-90-effective,Voice of America,Moderna Announces  Second COVID Vaccine More Than 90% Effective
1 month ago,2020-12-02 12:24:01.678955,"Moderna said its vaccine appears to be 94.5% effective, according to preliminary data from the company's still ongoing study. A week ago, competitor Pfizer Inc.","data:image/gif;base64,R0lGODlhAQABAIAAAP///////yH5BAEKAAEALAAAAAABAAEAAAICTAEAOw==",https://www.wavy.com/news/health/coronavirus/2nd-vaccine-moderna-says-its-vaccine-also-appears-to-be-around-90-effective/,WAVY.com,2nd vaccine? Moderna says its COVID-19 vaccine also appears to be around 90% effective
1 month ago,2020-12-02 12:24:01.679955,"Moderna's preliminary vaccine data offers “enormous hope,” but it will take “a major effort” to reach most Americans, according to Dr. Carlos del Rio of Emory ...","data:image/gif;base64,R0lGODlhAQABAIAAAP///////yH5BAEKAAEALAAAAAABAAEAAAICTAEAOw==",https://www.cnbc.com/2020/11/16/moderna-covid-trial-investigator-vaccinating-us-is-a-major-effort.html,CNBC,Moderna trial investigator says vaccinating U.S. against Covid will be a 'major effort'
1 month ago,2020-12-02 12:24:01.681947,"We're covering Moderna's vaccine success, trouble for the European Union's budget and monstrous robotic wolves on the Japanese island of Hokkaido.","data:image/gif;base64,R0lGODlhAQABAIAAAP///////yH5BAEKAAEALAAAAAABAAEAAAICTAEAOw==",https://www.nytimes.com/2020/11/16/briefing/moderna-vaccine-eu-budget-joe-biden.html,The New York Times,"Moderna Vaccine, E.U., Joe Biden: Your Tuesday Briefing"
1 month ago,2020-12-02 12:24:01.683943,"Moderna, a 10-year-old biotech company with billions in market valuation but no approved products, is racing forward with a vaccine of its own. Its new sprawling ...","data:image/gif;base64,R0lGODlhAQABAIAAAP///////yH5BAEKAAEALAAAAAABAAEAAAICTAEAOw==",https://www.statnews.com/2020/11/10/the-story-of-mrna-how-a-once-dismissed-idea-became-a-leading-technology-in-the-covid-vaccine-race/,STAT,The story of mRNA: From a loose idea to a tool that may help ...
1 month ago,2020-12-02 12:24:01.685940,Above: Immunologist Carl Ware of the Sanford Burnham Prebys Medical Discovery Institute gets an injection as a volunteer for of Moderna's experimental vaccine ...,"data:image/gif;base64,R0lGODlhAQABAIAAAP///////yH5BAEKAAEALAAAAAABAAEAAAICTAEAOw==",https://www.kpbs.org/news/2020/nov/16/moderna-vaccine-around-95-effective-shows-promise-/,KPBS,Moderna Vaccine Around 95% Effective Shows Promise For ...
1 month ago,2020-12-02 12:24:01.686934,"Moderna shares rose 1% after hours, following an 8.4% rise to close the regular session at $82.44. The company said the first batch of data, which is being sent to ...","data:image/gif;base64,R0lGODlhAQABAIAAAP///////yH5BAEKAAEALAAAAAABAAEAAAICTAEAOw==",https://www.marketwatch.com/story/moderna-stock-ticks-higher-as-first-set-of-covid-19-vaccine-data-is-ready-for-analysis-11605131994,MarketWatch,Moderna stock ticks higher as first set of COVID-19 vaccine data is ready for analysis
1 month ago,2020-12-02 12:24:02.786873,"Moderna mRNA vaccine development Moderna is pioneering a new class of medicines, including vaccines, that make use of messenger RNA. (Moderna via ...","data:image/gif;base64,R0lGODlhAQABAIAAAP///////yH5BAEKAAEALAAAAAABAAEAAAICTAEAOw==",https://www.geekwire.com/2020/pfizers-promising-covid-19-vaccine-trials-good-news-modernas-tests-fauci-says/,GeekWire,"Pfizer’s promising COVID-19 vaccine is good news for Moderna’s trials, Fauci says"
1 month ago,2020-12-02 12:24:02.788869,"Moderna expects to have about 20 million doses, earmarked for the U.S., by the end of 2020. Pfizer and its German partner BioNTech expect to have about 50 ...","data:image/gif;base64,R0lGODlhAQABAIAAAP///////yH5BAEKAAEALAAAAAABAAEAAAICTAEAOw==",https://baltimore.cbslocal.com/2020/11/16/2nd-covid-vaccine-by-moderna-shows-overwhelming-success-in-u-s-tests/,CBS Baltimore,‘It’s Everything I Could Have Dreamed Of’: 2nd COVID Vaccine By Moderna Shows Overwhelming Success In U.S. Tests
1 month ago,2020-12-02 12:24:02.790860,Is Moderna Stock a Buy? Should you buy Moderna stock before the company completes the phase 3 study of its coronavirus vaccine candidate?,"data:image/gif;base64,R0lGODlhAQABAIAAAP///////yH5BAEKAAEALAAAAAABAAEAAAICTAEAOw==",https://www.fool.com/investing/2020/11/10/is-moderna-stock-a-buy/,Motley Fool,Is Moderna Stock a Buy?
1 month ago,2020-12-02 12:24:02.792854,"Moderna is developing therapeutics and vaccines for infectious diseases, immuno-oncology, rare diseases, cardiovascular diseases, and autoimmune and ...","data:image/gif;base64,R0lGODlhAQABAIAAAP///////yH5BAEKAAEALAAAAAABAAEAAAICTAEAOw==",https://www.businesswire.com/news/home/20201127005540/en/Moderna-to-Present-at-Upcoming-Investor-Conferences-in-December-2020,,Moderna to Present at Upcoming Investor Conferences in ...
1 month ago,2020-12-02 12:24:02.793854,"Moderna CEO Stephane Bancel told ""Mornings with Maria"" on Monday that the FDA is expected to consider the vaccine at a Dec. 17 meeting, and that he hopes ...","data:image/gif;base64,R0lGODlhAQABAIAAAP///////yH5BAEKAAEALAAAAAABAAEAAAICTAEAOw==",https://www.foxbusiness.com/markets/moderna-coronavirus-vaccine-request-emergency-authorization,Fox Business,Moderna to request emergency authorization of coronavirus vaccine
1 month ago,2020-12-02 12:24:02.795847,"Dive Brief: The world could soon know whether Moderna's experimental coronavirus vaccine prevents people from getting sick, as the pandemic's accelerating ...","data:image/gif;base64,R0lGODlhAQABAIAAAP///////yH5BAEKAAEALAAAAAABAAEAAAICTAEAOw==",https://www.biopharmadive.com/news/moderna-coronavirus-vaccine-near-readout/588906/,,Moderna close to having results from key coronavirus vaccine ...
1 month ago,2020-12-02 12:24:02.797841,"The upside isn't just in the coronavirus vaccine, it's also in what it means for treating diseases in the future. Both Moderna (NASDAQ:MRNA) and BioNTech SE ( ...","data:image/gif;base64,R0lGODlhAQABAIAAAP///////yH5BAEKAAEALAAAAAABAAEAAAICTAEAOw==",https://www.fool.com/investing/2020/11/10/better-buy-moderna-vs-biontech/,Motley Fool,Better Buy: Moderna vs. BioNTech
1 month ago,2020-12-02 12:24:02.799836,Shares in Cambridge-based Moderna are soaring in premarket trading following positive news about its experimental COVID-19 vaccine. The company reported ...,"data:image/gif;base64,R0lGODlhAQABAIAAAP///////yH5BAEKAAEALAAAAAABAAEAAAICTAEAOw==",https://www.wbur.org/commonhealth/2020/11/16/dr-david-hamer-moderna-vaccine-trial,WBUR,"After Promising Moderna Results, A Public Health Expert ..."
1 month ago,2020-12-02 12:24:02.800833,"On Monday, Moderna (NASDAQ: MRNA) stock rallied by over 10% after the company said that its Covid-19 vaccine – which is based on messenger RNA ...","data:image/gif;base64,R0lGODlhAQABAIAAAP///////yH5BAEKAAEALAAAAAABAAEAAAICTAEAOw==",https://www.forbes.com/sites/greatspeculations/2020/11/30/whats-happening-with-moderna-stock/,Forbes,What's Happening With Moderna Stock?
"Nov 5, 2020",2020-11-05 00:00:00.000000,"Moderna , a clinical-stage biotech company, is carrying out phase 3 trials of its Covid-19 vaccine, completing enrollment of 30,000 participants. The company is ...","data:image/gif;base64,R0lGODlhAQABAIAAAP///////yH5BAEKAAEALAAAAAABAAEAAAICTAEAOw==",https://www.forbes.com/sites/greatspeculations/2020/11/05/moderna-novavax-pfizer-how-are-coronavirus-vaccine-stocks-faring/,Forbes,"Moderna, Novavax, Pfizer: How Are Coronavirus Vaccine Stocks Faring?"
1 month ago,2020-12-02 12:24:03.325111,Cambridge biotech Moderna Inc. will submit its first-ever application for drug approval today after new trial data shows its Covid-19 vaccine is 94% effective at ...,"data:image/gif;base64,R0lGODlhAQABAIAAAP///////yH5BAEKAAEALAAAAAABAAEAAAICTAEAOw==",https://www.bizjournals.com/boston/news/2020/11/30/moderna-submits-covid-vaccine-for-fda-approval.html,Boston Business Journal,FDA sets Dec. 17 review date after Moderna reports further success with Covid vaccine
1 month ago,2020-12-02 12:24:03.327103,Moderna is now on track to make 500 million to 1 billion doses annually by 2021. Tens of millions from its Portsmouth plant will be earmarked for the U.S.. 'It's ...,"data:image/gif;base64,R0lGODlhAQABAIAAAP///////yH5BAEKAAEALAAAAAABAAEAAAICTAEAOw==",https://www.newscentermaine.com/article/news/health/coronavirus/lonza-is-expected-to-make-100-million-doses-of-the-moderna-covid-19-coronavirus-vaccine-in-new-hampshire/97-b8d4246c-acb4-4d8e-9186-23abe15851c0,NewsCenterMaine.com WCSH-WLBZ,Lonza ramps up to make the Moderna COVID-19 coronavirus vaccine
1 month ago,2020-12-02 12:24:03.329109,"She is the principal investigator for the Moderna vaccine in Atlanta and said the news about the efficacy of this vaccine could not be better. ""Really just our teams ...","data:image/gif;base64,R0lGODlhAQABAIAAAP///////yH5BAEKAAEALAAAAAABAAEAAAICTAEAOw==",https://www.11alive.com/article/news/health/coronavirus/moderna-vaccine-trial-in-atlanta/85-5741c8f8-0bca-438a-9a78-9fcc5f52a21d,11Alive.com WXIA,"Local scientists, trial participants celebrate Moderna COVID-19 vaccine"
1 month ago,2020-12-02 12:24:03.331101,"On Monday, Moderna (Nasdaq: MRNA) released positive data about its Covid-19 vaccine, results that came from a clinical trial enabled by a North Carolina ...","data:image/gif;base64,R0lGODlhAQABAIAAAP///////yH5BAEKAAEALAAAAAABAAEAAAICTAEAOw==",https://www.bizjournals.com/triangle/news/2020/11/16/behind-modernas-vaccine-results-is-a-nc-contract.html,Triangle Business Journal,The NC company winning praise with Moderna's positive Covid vaccine data
1 month ago,2020-12-02 12:24:03.332102,"Moderna's messenger RNA (mRNA) vaccine has already posted outstanding results in its late-stage trial. The company, in turn, is expected to seek an Emergency ...","data:image/gif;base64,R0lGODlhAQABAIAAAP///////yH5BAEKAAEALAAAAAABAAEAAAICTAEAOw==",https://www.fool.com/investing/2020/11/27/why-moderna-and-novavax-shares-are-racing-higher-t/,Motley Fool,Why Moderna and Novavax Shares Are Racing Higher Today
1 month ago,2020-12-02 12:24:03.334095,"Moderna Inc. said Wednesday it's on track to report early data from a late-stage trial of its experimental coronavirus vaccine later this month, and could file for ...","data:image/gif;base64,R0lGODlhAQABAIAAAP///////yH5BAEKAAEALAAAAAABAAEAAAICTAEAOw==",https://www.foxbusiness.com/healthcare/moderna-may-seek-fda-authorization-for-covid-19-vaccine-in-december,Fox Business,Moderna may seek FDA authorization for COVID-19 vaccine in December
1 month ago,2020-12-02 12:24:03.336088,Moderna's shot had efficacy of 94.5% in a preliminary analysis of a large late-stage clinical trial. It follows similar positive developments in a vaccination being ...,"data:image/gif;base64,R0lGODlhAQABAIAAAP///////yH5BAEKAAEALAAAAAABAAEAAAICTAEAOw==",https://www.worldoil.com/news/2020/11/16/oil-price-climbs-above-41-as-moderna-reports-vaccine-success,WorldOil,Oil price climbs above $41 as Moderna reports vaccine success
1 month ago,2020-12-02 12:24:03.338048,Blue participated in the University of Illinois at Chicago Moderna COVID-19 vaccine trial. The South Shore resident does not know if she received a placebo or the ...,"data:image/gif;base64,R0lGODlhAQABAIAAAP///////yH5BAEKAAEALAAAAAABAAEAAAICTAEAOw==",https://chicago.cbslocal.com/2020/11/16/moderna-vaccine-chicago-covid-19/,CBS Chicago,Chicago Plays Important Role In Development Of Highly Effective Moderna Vaccine
1 month ago,2020-12-02 12:24:03.341041,Moderna has rallied more than 20% since the Pfizer news. Vaccines of both companies utilize state-of-the-art mRNA compounds. Moderna stock could test July's ...,"data:image/gif;base64,R0lGODlhAQABAIAAAP///////yH5BAEKAAEALAAAAAABAAEAAAICTAEAOw==",https://www.investopedia.com/moderna-mrna-up-20-after-pfizer-pfe-news-5087201,Investopedia,Moderna (MRNA) Up 20% After Pfizer (PFE) News
1 month ago,2020-12-02 12:24:03.344111,Moderna and Pfizer are about a month away from possible Emergency Use Authorization submissions for their investigational coronavirus vaccines.,"data:image/gif;base64,R0lGODlhAQABAIAAAP///////yH5BAEKAAEALAAAAAABAAEAAAICTAEAOw==",https://www.fool.com/investing/2020/11/08/moderna-and-pfizer-a-tale-of-two-mrna-coronavirus/,Motley Fool,Moderna and Pfizer: A Tale of Two mRNA Coronavirus Vaccine Stocks
1 month ago,2020-12-02 12:24:04.526989,"For the first time since Moderna Inc. went public, its largest shareholder is not the venture creation firm that launched the biotech company a decade ago, ...","data:image/gif;base64,R0lGODlhAQABAIAAAP///////yH5BAEKAAEALAAAAAABAAEAAAICTAEAOw==",https://www.bizjournals.com/boston/news/2020/11/19/fidelity-passes-flagship-as-modernas-largest-share.html,Boston Business Journal,"Fidelity stocks up on Moderna, surpassing Flagship as the largest shareholder"
1 month ago,2020-12-02 12:24:04.528987,"... one advantage over Pfizer and Moderna counterparts—refrigerated storage ... he expects similar figures from Moderna, the new class of mRNA shots mostly ...","data:image/gif;base64,R0lGODlhAQABAIAAAP///////yH5BAEKAAEALAAAAAABAAEAAAICTAEAOw==",https://www.fiercepharma.com/pharma/curevac-s-mrna-coronavirus-shot-holds-edge-over-pfizer-and-moderna-counterparts-refrigerated,FiercePharma,CureVac's mRNA coronavirus shot boasts one advantage ...
1 month ago,2020-12-02 12:24:04.529980,"9, when pharmaceutical company Pfizer announced early results showing its vaccine was 90% effective at preventing COVID-19. Then, on Monday, rival Moderna ...","data:image/gif;base64,R0lGODlhAQABAIAAAP///////yH5BAEKAAEALAAAAAABAAEAAAICTAEAOw==",https://www.buzzfeednews.com/article/juliareinstein/moderna-pfizer-vaccine-memes,BuzzFeed News,People Are Making Vaccine Memes About Moderna And Pfizer
1 month ago,2020-12-02 12:24:04.531976,"Moderna said Monday that the vaccine it has developed with the National Institutes of Health provides strong protection against the coronavirus. Above, a ...","data:image/gif;base64,R0lGODlhAQABAIAAAP///////yH5BAEKAAEALAAAAAABAAEAAAICTAEAOw==",https://www.latimes.com/california/story/2020-11-17/moderna-pfizer-coronavirus-vaccines-explained,Los Angeles Times,Moderna and Pfizer COVID-19 vaccines: What you need to know
1 month ago,2020-12-02 12:24:04.533970,The news from Cambridge-based Moderna is impressive. The biotech company reported Monday that the coronavirus vaccine it's developed has been found to ...,"data:image/gif;base64,R0lGODlhAQABAIAAAP///////yH5BAEKAAEALAAAAAABAAEAAAICTAEAOw==",https://www.wbur.org/commonhealth/2020/11/16/moderna-vaccine-effective-coronavirus-optimism,WBUR,There's Optimism Over Moderna Report That Vaccine Is ...
1 month ago,2020-12-02 12:24:04.535964,"Moderna said Monday its COVID-19 vaccine is proving highly effective in a major trial, a second ray of hope in the global race for a shot to tame a resurgent virus ...","data:image/gif;base64,R0lGODlhAQABAIAAAP///////yH5BAEKAAEALAAAAAABAAEAAAICTAEAOw==",https://www.chicagotribune.com/coronavirus/ct-nw-moderna-coronavirus-vaccine-20201116-im6to3by35h7xb2nhceqxmptju-story.html,Chicago Tribune,Moderna says COVID-19 vaccine proves 94.5% effective
1 month ago,2020-12-02 12:24:04.536965,Moderna — Shares of the biotech company rose 6.5% after Moderna announced that it had reached the number of Covid-19 cases needed in its phase-three ...,"data:image/gif;base64,R0lGODlhAQABAIAAAP///////yH5BAEKAAEALAAAAAABAAEAAAICTAEAOw==",https://www.cnbc.com/2020/11/12/stocks-making-the-biggest-moves-midday-moderna-fossil-salesforce-vroom-more.html,CNBC,"Stocks making the biggest moves midday: Moderna, Fossil, Salesforce, Vroom & more"
1 month ago,2020-12-02 12:24:04.538956,"Speaking with KTLA about the latest developments at Moderna, Afeyan highlighted how his journey as an immigrant has impacted his work.","data:image/gif;base64,R0lGODlhAQABAIAAAP///////yH5BAEKAAEALAAAAAABAAEAAAICTAEAOw==",https://ktla.com/news/coronavirus/moderna-chairman-grandson-of-an-armenian-genocide-survivor-speaks-about-vaccine-efforts-and-his-own-journey/,KTLA,"Moderna chairman, grandson of an Armenian genocide survivor, speaks about COVID-19 vaccine efforts and his own journey"
1 month ago,2020-12-02 12:24:04.540877,Biotech firm Moderna announced today that its coronavirus vaccine is 94.5% effective at preventing COVID-19. This news comes after the $210 billion drugmaker ...,"data:image/gif;base64,R0lGODlhAQABAIAAAP///////yH5BAEKAAEALAAAAAABAAEAAAICTAEAOw==",https://www.forbes.com/sites/greatspeculations/2020/11/16/pfizer-and-moderna-give-investors-a-shot-of-hope/,Forbes,Pfizer And Moderna Give Investors A Shot Of Hope
1 month ago,2020-12-02 12:24:04.542950,Moderna's COVID-19 vaccine introduces “mRNA-1273” molecules into the recipient via a delivery system that protects the mRNA in the bloodstream and allows for ...,"data:image/gif;base64,R0lGODlhAQABAIAAAP///////yH5BAEKAAEALAAAAAABAAEAAAICTAEAOw==",https://www.jdsupra.com/legalnews/breaking-down-moderna-s-covid-19-patent-17055/,JD Supra,Breaking Down Moderna’s COVID-19 Patent Pledge: Why Did They Do It?
1 month ago,2020-12-02 12:24:06.341361,Moderna is expected to release crucial data in coming days from a late-stage trial that will show whether its coronavirus vaccine is effective. Investors anticipate ...,"data:image/gif;base64,R0lGODlhAQABAIAAAP///////yH5BAEKAAEALAAAAAABAAEAAAICTAEAOw==",https://www.cnbc.com/2020/11/12/coronavirus-moderna-vaccine-data-is-coming-in-days-what-to-look-out-for.html,CNBC,Crucial Moderna Covid vaccine data is coming in days — here's what to look out for
1 month ago,2020-12-02 12:24:06.343382,"Cruise stocks surge after Moderna reports upbeat news its COVID-19 vaccine candidate. Published: Nov. 16, 2020 at 7:31 a.m. ET. By. Tomi Kilgore.","data:image/gif;base64,R0lGODlhAQABAIAAAP///////yH5BAEKAAEALAAAAAABAAEAAAICTAEAOw==",https://www.marketwatch.com/story/cruise-stocks-surge-after-moderna-reports-upbeat-news-its-covid-19-vaccine-candidate-2020-11-16,MarketWatch,Cruise stocks surge after Moderna reports upbeat news its COVID-19 vaccine candidate
1 month ago,2020-12-02 12:24:06.345384,"Moderna reports that their own mRNA candidate is >94% effective (point estimate), with 95 total cases in the trial to date, split 90/5 between the control group ...","data:image/gif;base64,R0lGODlhAQABAIAAAP///////yH5BAEKAAEALAAAAAABAAEAAAICTAEAOw==",https://blogs.sciencemag.org/pipeline/archives/2020/11/16/modernas-vaccine-efficacy-readout,,Moderna's Vaccine Efficacy Readout | In the Pipeline
1 month ago,2020-12-02 12:24:06.347379,Moderna (NASDAQ:MRNA) recently announced an impressive efficacy of 94.5% from a late-stage study of coronavirus vaccine candidate mRNA-1273.,"data:image/gif;base64,R0lGODlhAQABAIAAAP///////yH5BAEKAAEALAAAAAABAAEAAAICTAEAOw==",https://www.fool.com/investing/2020/11/21/is-moderna-a-good-stock-to-buy-right-now/,Motley Fool,Is Moderna a Good Stock to Buy Right Now?
1 month ago,2020-12-02 12:24:06.349376,"On Monday, Moderna announced its vaccine had a 94.5% efficacy rate — the second incredibly positive vaccine announcement in the last 10 days. Swaminathan, ...","data:image/gif;base64,R0lGODlhAQABAIAAAP///////yH5BAEKAAEALAAAAAABAAEAAAICTAEAOw==",https://www.roi-nj.com/2020/11/17/healthcare/she-was-principal-investigator-of-moderna-covid-19-vaccine-trial-in-newark-her-insights-will-inform-you/,ROI-NJ.com,She was principal investigator of Moderna COVID-19 vaccine ...
1 month ago,2020-12-02 12:24:06.351378,"Earlier this month, both Pfizer and Moderna reported Phase III trial data showing their respective messenger RNA (mRNA) vaccines were above 90% effective ...","data:image/gif;base64,R0lGODlhAQABAIAAAP///////yH5BAEKAAEALAAAAAABAAEAAAICTAEAOw==",https://bioprocessintl.com/bioprocess-insider/global-markets/mrna-vaccine-pfizers-inhouse-approach-vs-modernas-use-of-third-parties/,BioProcess Insider,mRNA vaccine: Pfizer inhouse vs Moderna thirdparties ...
1 month ago,2020-12-02 12:24:06.352366,Moderna's highly regarded COVID-19 vaccine has just hit a major threshold. The surge in coronavirus cases across Moderna vaccine trial sites in the U.S. will ...,"data:image/gif;base64,R0lGODlhAQABAIAAAP///////yH5BAEKAAEALAAAAAABAAEAAAICTAEAOw==",https://www.bostonherald.com/2020/11/11/moderna-hits-covid-19-case-goal-for-vaccine-candidate-results-imminent/,Boston Herald,"Moderna hits coronavirus case goal for vaccine candidate, results imminent"
1 month ago,2020-12-02 12:24:06.354361,"Moderna's mRNA-1273 is set to be released in a hypercompetitve coronavirus vaccine market. Even if commercialized, the vaccine could save many lives and ...","data:image/gif;base64,R0lGODlhAQABAIAAAP///////yH5BAEKAAEALAAAAAABAAEAAAICTAEAOw==",https://www.fool.com/investing/2020/11/21/whats-the-outlook-for-moderna-stock/,Motley Fool,What's the Outlook for Moderna Stock?
1 month ago,2020-12-02 12:24:06.356359,"GENEVA – The World Health Organization (WHO) welcomed a report by Moderna on Monday that its experimental vaccine had showed 94.5% efficacy, but said ...","data:image/gif;base64,R0lGODlhAQABAIAAAP///////yH5BAEKAAEALAAAAAABAAEAAAICTAEAOw==",https://www.japantimes.co.jp/news/2020/11/17/world/science-health-world/who-coronavirus-complacency-moderna-vaccine/,The Japan Times,WHO warns against COVID-19 complacency after Moderna ...
1 month ago,2020-12-02 12:24:06.358315,"Hopes are rising for the Covid jab being developed by Oxford University, after Moderna became the second company to reveal impressive results from its ...","data:image/gif;base64,R0lGODlhAQABAIAAAP///////yH5BAEKAAEALAAAAAABAAEAAAICTAEAOw==",https://www.theguardian.com/society/2020/nov/16/moderna-vaccines-effectiveness-bodes-well-for-oxfordastrazeneca-jab,The Guardian,Moderna vaccine trial's results bode well for Oxford/AstraZeneca jab
1 month ago,2020-12-02 12:24:08.311231,An SiO2 employee carries packages of vials that will be used for Moderna's COVID-19 vaccine. Sara Palczewski/.,"data:image/gif;base64,R0lGODlhAQABAIAAAP///////yH5BAEKAAEALAAAAAABAAEAAAICTAEAOw==",https://oanow.com/news/local/watch-now-auburn-made-vials-to-carry-moderna-coronavirus-vaccine-to-world/article_d9161e04-2c25-11eb-9d5f-fb9e75037914.html,Opelika Auburn News,Watch now: Auburn-made vials to carry Moderna coronavirus vaccine to world
1 month ago,2020-12-02 12:24:08.313226,Moderna's data also suggests its vaccine would reduce the risk of severe illness caused by the coronavirus. Trials for promising COVID-19 vaccines have so far ...,"data:image/gif;base64,R0lGODlhAQABAIAAAP///////yH5BAEKAAEALAAAAAABAAEAAAICTAEAOw==",https://www.usatoday.com/story/news/nation/2020/11/23/pregnant-women-excluded-pfizer-moderna-covid-19-vaccine-trials/6352679002/,USA TODAY,Pregnant women haven’t been included in promising COVID-19 vaccine trials
1 month ago,2020-12-02 12:24:08.315231,"The Cambridge-based biotechnology company Moderna announced this week it is expecting to soon reveal data about its coronavirus vaccine candidate, ...","data:image/gif;base64,R0lGODlhAQABAIAAAP///////yH5BAEKAAEALAAAAAABAAEAAAICTAEAOw==",https://www.masslive.com/coronavirus/2020/11/moderna-covid-19-vaccine-dr-anthony-fauci-expresses-optimism-as-cambridge-based-company-readies-to-reveal-data-on-phase-3-study.html,masslive.com,Moderna COVID-19 vaccine: Dr. Anthony Fauci expresses optimism as Cambridge-based company readies to reveal
