date,datetime,desc,img,link,media,title
1 month ago,2020-12-02 12:24:08.317215,"With four manufacturing lines prepped to produce 400 million doses, Lonza has congratulated Moderna on positive interim results for its mRNA vaccine against ...","data:image/gif;base64,R0lGODlhAQABAIAAAP///////yH5BAEKAAEALAAAAAABAAEAAAICTAEAOw==",https://bioprocessintl.com/bioprocess-insider/global-markets/lonza-making-400m-doses-of-covid-vaccine-and-can-scale-up-further-if-moderna-asks/,BioProcess Insider,Lonza making 400m doses of vaccine for Moderna ...
1 month ago,2020-12-02 12:24:08.319210,Moderna and rival Pfizer expect phase 3 safety readouts later this month. Pfizer this week said interim phase 3 efficacy data show its vaccine candidate was ...,"data:image/gif;base64,R0lGODlhAQABAIAAAP///////yH5BAEKAAEALAAAAAABAAEAAAICTAEAOw==",https://www.fool.com/investing/2020/11/14/what-if-moderna-doesnt-win-the-coronavirus-vaccine/,Motley Fool,What if Moderna Doesn't Win the Coronavirus Vaccine Race?
1 month ago,2020-12-02 12:24:08.320208,"HOUSTON – Last week, Pfizer said their vaccine candidate is 90% effective and Monday Moderna said theirs is 94.5% effective. Christene Kimmel was the first ...","data:image/gif;base64,R0lGODlhAQABAIAAAP///////yH5BAEKAAEALAAAAAABAAEAAAICTAEAOw==",https://www.click2houston.com/health/2020/11/17/moderna-participant-becomes-big-part-of-history-looking-forward-to-the-small-things/,KPRC Click2Houston,"Local Moderna participant becomes big part of history, looking forward to the small things"
1 month ago,2020-12-02 12:24:08.322202,"Dr. Anthony Fauci, the U.S.' top infectious disease official, has expressed optimism that early data from Moderna's Covid-19 phase 3 vaccine trials will show it to ...","data:image/gif;base64,R0lGODlhAQABAIAAAP///////yH5BAEKAAEALAAAAAABAAEAAAICTAEAOw==",https://www.forbes.com/sites/roberthart/2020/11/12/fauci-predicts-further-covid-19-vaccine-success-as-moderna-prepares-to-submit-early-findings/,Forbes,Fauci Predicts Further Covid-19 Vaccine Success As Moderna Prepares To Submit Early Findings
1 month ago,2020-12-02 12:24:08.324197,"ROI-NJ checked in with him Monday, after Moderna reported incredible efficacy results with Phase 3 of its COVID-19 vaccine trial — the second major drug ...","data:image/gif;base64,R0lGODlhAQABAIAAAP///////yH5BAEKAAEALAAAAAABAAEAAAICTAEAOw==",https://www.roi-nj.com/2020/11/17/healthcare/pfizer-moderna-both-realized-tremendous-results-why-modernas-are-much-better/,ROI-NJ.com,"Pfizer, Moderna both realized tremendous results — why Moderna's are (much) better"
1 month ago,2020-12-02 12:24:08.326157,"Moderna has said its experimental vaccine is 94.5% effective in preventing Covid-19, based on interim data from a late-stage clinical trial, becoming the second ...","data:image/gif;base64,R0lGODlhAQABAIAAAP///////yH5BAEKAAEALAAAAAABAAEAAAICTAEAOw==",https://timesofindia.indiatimes.com/home/science/moderna-to-charge-25-37-for-covid-19-vaccine-ceo/articleshow/79347920.cms,Times of India,Moderna to charge $25-$37 for Covid-19 vaccine: CEO
1 month ago,2020-12-02 12:24:08.328186,"Of the 30,000 volunteers nationwide for the late-stage trials for the Moderna vaccine, nearly 350 were part of the study conducted at George Washington ...","data:image/gif;base64,R0lGODlhAQABAIAAAP///////yH5BAEKAAEALAAAAAABAAEAAAICTAEAOw==",https://wamu.org/story/20/11/17/349-d-c-area-residents-helped-researchers-discover-important-details-about-covid-19-vaccine/,,DC Volunteers Help Researchers Studying Moderna COVID ...
1 month ago,2020-12-02 12:24:10.355892,Moderna is just behind Pfizer and its German partner BioNTech in seeking to begin vaccinations in the U.S. in December. A bicyclist stops in front of Moderna in ...,"data:image/gif;base64,R0lGODlhAQABAIAAAP///////yH5BAEKAAEALAAAAAABAAEAAAICTAEAOw==",https://www.boston.com/news/coronavirus/2020/11/30/cambridges-moderna-asking-u-s-european-regulators-to-ok-its-virus-shots,,"Cambridge’s Moderna asking U.S., European regulators to OK its virus shots"
1 month ago,2020-12-02 12:24:10.357886,"By the end of September, Balyasny Asset Management, Adage Capital Partners and Verition Fund Management had liquidated their positions in Moderna while ...","data:image/gif;base64,R0lGODlhAQABAIAAAP///////yH5BAEKAAEALAAAAAABAAEAAAICTAEAOw==",https://www.reuters.com/article/uk-usa-stocks-funds/hedge-funds-sold-moderna-biontech-shares-before-vaccine-news-idUKKBN27Y2ZU,Reuters,"Hedge funds sold Moderna, BioNtech shares before vaccine news"
1 month ago,2020-12-02 12:24:10.360879,Bearish investors are holding on to their short bets on Moderna Inc. even as the biotech's market value swelled by more than $25 billion this year on optimism its ...,"data:image/gif;base64,R0lGODlhAQABAIAAAP///////yH5BAEKAAEALAAAAAABAAEAAAICTAEAOw==",https://www.bloomberg.com/news/articles/2020-11-11/moderna-s-covid-19-shot-is-next-on-deck-after-pfizer-s-success,Bloomberg,Moderna Bears Face Possible Squeeze on Covid Vaccine Results
1 month ago,2020-12-02 12:24:10.362873,"Vaccines developed by Pfizer/BioNTech and Moderna are more than 95% effective against COVID-19, trials show. Both depend on a technology never before ...","data:image/gif;base64,R0lGODlhAQABAIAAAP///////yH5BAEKAAEALAAAAAABAAEAAAICTAEAOw==",https://www.usatoday.com/story/news/health/2020/11/23/success-pfizer-moderna-mrna-covid-19-vaccines-ushers-new-era/6311228002/,USA TODAY,Pfizer and Moderna use mRNA in their COVID-19 vaccines. This never-before-used technology could transform how science fights diseases.
1 month ago,2020-12-02 12:24:10.364868,The nice gain came after the biotech announced that the European Commission approved an agreement to secure 80 million doses of Moderna's COVID-19 ...,"data:image/gif;base64,R0lGODlhAQABAIAAAP///////yH5BAEKAAEALAAAAAABAAEAAAICTAEAOw==",https://www.fool.com/investing/2020/11/25/why-moderna-stock-is-jumping-today/,Motley Fool,Why Moderna Stock Is Jumping Today
1 month ago,2020-12-02 12:24:10.366862,"CAMBRIDGE (CBS/AP) – For the second time this month, there's promising news from a COVID-19 vaccine candidate: Moderna said Monday its shots provide ...","data:image/gif;base64,R0lGODlhAQABAIAAAP///////yH5BAEKAAEALAAAAAABAAEAAAICTAEAOw==",https://boston.cbslocal.com/2020/11/16/moderna-covid-19-vaccine-coronavirus-94-5-percent-effective/,CBS Boston,Moderna Says Its COVID-19 Vaccine Is 94.5% Effective In Early Tests
1 month ago,2020-12-02 12:24:10.368857,Moderna Announces Supply Agreement with United Kingdom Government to Supply mRNA Vaccine Against COVID-19 (mRNA-1273) if Approved for Use. mRNA- ...,"data:image/gif;base64,R0lGODlhAQABAIAAAP///////yH5BAEKAAEALAAAAAABAAEAAAICTAEAOw==",https://www.businesswire.com/news/home/20201117005857/en/Moderna-Announces-Supply-Agreement-with-United-Kingdom-Government-to-Supply-mRNA-Vaccine-Against-COVID-19-mRNA-1273-if-Approved-for-Use,,Moderna Announces Supply Agreement with United Kingdom ...
1 month ago,2020-12-02 12:24:10.370852,Jim Cramer's Biggest Worry. Jim Cramer breaks down what vaccine news out of Moderna means for Wall Street and what he's watching going forward.,"data:image/gif;base64,R0lGODlhAQABAIAAAP///////yH5BAEKAAEALAAAAAABAAEAAAICTAEAOw==",https://www.thestreet.com/jim-cramer/moderna-markets-what-watch-nov-16,TheStreet,Bullish on Moderna Vaccine News? Jim Cramer's Biggest Worry
1 month ago,2020-12-02 12:24:10.373844,"Moderna, a two-dose vaccine, recently announced each dose will go for around $32 to $37. The Pfizer vaccine, also given in two doses, is expected to cost $19.50 ...","data:image/gif;base64,R0lGODlhAQABAIAAAP///////yH5BAEKAAEALAAAAAABAAEAAAICTAEAOw==",https://www.healthline.com/health-news/how-much-will-it-cost-to-get-a-covid-19-vaccine,Healthline,How Much Will It Cost to Get a COVID-19 Vaccine?
1 month ago,2020-12-02 12:24:10.375839,"In terms of travel and leisure stocks, Morgan Stanley said even fewer shares were looking good value after yesterday's Moderna update showed that its vaccine ...","data:image/gif;base64,R0lGODlhAQABAIAAAP///////yH5BAEKAAEALAAAAAABAAEAAAICTAEAOw==",https://www.ii.co.uk/analysis-commentary/moderna-covid-cures-and-cheap-cyclical-stocks-ii514190,Interactive Investor,"Moderna, Covid cures and cheap cyclical stocks"
1 month ago,2020-12-02 12:24:12.118282,"With the promise of another coronavirus vaccine from Moderna, in addition to last week's blockbuster news from Pfizer, we were inspired to go back and do the ...","data:image/gif;base64,R0lGODlhAQABAIAAAP///////yH5BAEKAAEALAAAAAABAAEAAAICTAEAOw==",https://www.marketplace.org/shows/make-me-smart-with-kai-and-molly/would-you-take-a-coronavirus-vaccine-what-if-it-came-from-dolly-parton,Marketplace.org,Would you take a coronavirus vaccine? What if it came from Dolly Parton?
1 month ago,2020-12-02 12:24:12.120316,"Moderna's candidate is suitable for the larger “active” containers which can take 30,000 doses. The vaccine being developed by AstraZeneca and Oxford ...","data:image/gif;base64,R0lGODlhAQABAIAAAP///////yH5BAEKAAEALAAAAAABAAEAAAICTAEAOw==",https://www.reuters.com/article/us-health-coronavirus-air-france-klm-vac-idUSKBN2861IY,Reuters,'We're ready': Schiphol airport gears up for chilled vaccine cargos
"Nov 3, 2020",2020-11-03 00:00:00.000000,"Most of Novavax's key competitors—Moderna, Pfizer, Johnson & Johnson subsidiary Janssen, and AstraZeneca—had launched phase III trials by then. To make ...","data:image/gif;base64,R0lGODlhAQABAIAAAP///////yH5BAEKAAEALAAAAAABAAEAAAICTAEAOw==",https://www.sciencemag.org/news/2020/11/will-small-long-shot-us-company-end-producing-best-coronavirus-vaccine,Science Magazine,"Will a small, long-shot U.S. company end up producing the ..."
1 month ago,2020-12-02 12:24:12.123304,US-based biotechnology giant Moderna announced on Monday that its COVID-19 vaccine has shown to be 94.5 per cent effective in preventing the deadly ...,"data:image/gif;base64,R0lGODlhAQABAIAAAP///////yH5BAEKAAEALAAAAAABAAEAAAICTAEAOw==",https://www.news18.com/videos/ivideos/what-are-mrna-vaccines-by-pfizer-moderna-that-have-shown-more-than-90-efficacy-against-covid-19-3088607.html,News18,"What Are mRNA Vaccines by Pfizer, Moderna That Have Shown More Than 90% Efficacy Against COVID-19?"
1 month ago,2020-12-02 12:24:12.125298,arlene ramirez moderna vaccine. 'Bittersweet': Nurse who received Moderna vaccine describes experience. Travelers walk ... arlene ramirez moderna vaccine ...,"data:image/gif;base64,R0lGODlhAQABAIAAAP///////yH5BAEKAAEALAAAAAABAAEAAAICTAEAOw==",https://www.cnn.com/2020/11/26/health/us-coronavirus-thursday/index.html,CNN,Coronavirus hospitalizations hit another record as experts warn Thanksgiving gatherings could worsen the pandemic
"Nov 6, 2020",2020-11-06 00:00:00.000000,"Another U.S. company, Moderna Inc., also hopes to file an application with the U.S. Food and Drug Administration this month. Neither company's shot is made ...","data:image/gif;base64,R0lGODlhAQABAIAAAP///////yH5BAEKAAEALAAAAAABAAEAAAICTAEAOw==",https://www.chicagotribune.com/coronavirus/ct-life-covid-coronavirus-questions-answers-qa-cb-1023-20201106-cmmfplejbfeljgx5ojfjwqzcju-story.html,Chicago Tribune,Should Americans be concerned about coronavirus mutations?
"Nov 3, 2020",2020-11-03 00:00:00.000000,arlene ramirez moderna vaccine. 'Bittersweet': Nurse who received Moderna vaccine describes experience. coronavirus ... arlene ramirez moderna vaccine ...,"data:image/gif;base64,R0lGODlhAQABAIAAAP///////yH5BAEKAAEALAAAAAABAAEAAAICTAEAOw==",https://www.cnn.com/2020/11/03/health/covid-test-negative-contagious-wellness/index.html,CNN,Don't get a false sense of security with Covid-19 testing. Here's why you can test negative but still be infected and contagious
1 month ago,2020-12-02 12:24:12.131283,"Moderna; Novavax; Pfizer. Pfizer was first to apply to the FDA for authorization on its vaccine on November 20; Moderna is second, applying on November ...","data:image/gif;base64,R0lGODlhAQABAIAAAP///////yH5BAEKAAEALAAAAAABAAEAAAICTAEAOw==",https://dallas.culturemap.com/news/city-life/11-30-20-covid-19-vaccine-volunteers/,CultureMap Dallas,Dallas medical company seeks volunteers for COVID-19 ...
1 month ago,2020-12-02 12:24:12.133283,"... the Moderna COVID-19 vaccine's efficacy gives hopes of things returning to normal. Also, meet Nora Vargas, a Democrat who will be presententing San Diego ...","data:image/gif;base64,R0lGODlhAQABAIAAAP///////yH5BAEKAAEALAAAAAABAAEAAAICTAEAOw==",https://www.kpbs.org/podcasts/kpbs-midday-edition/2020/nov/17/some-san-diego-businesses-calling-foul-tighter-pan/,KPBS,Some San Diego Businesses Calling Foul On Tighter Pandemic Restrictions (KPBS Midday Edition)
1 month ago,2020-12-02 12:24:12.134274,The study comes hot on the heels of upbeat news this month from U.S. drugmakers Pfizer and Moderna as well as Russia that showed their experimental ...,"data:image/gif;base64,R0lGODlhAQABAIAAAP///////yH5BAEKAAEALAAAAAABAAEAAAICTAEAOw==",https://english.jagran.com/india/coronavirus-vaccine-latest-updates-chinas-coronavac-triggers-quick-immune-response-india-pins-hopes-on-these-5-vaccines-10020017,Jagran English,Coronavirus Vaccine Latest Updates: China's CoronaVac triggers quick immune response; India pins hopes on these 5 vaccines
1 month ago,2020-12-02 12:24:14.463062,"Earlier this week Moderna, Inc. announced that its experimental vaccine appears to be 94.5% effective after an interim analysis of its late-stage study.","data:image/gif;base64,R0lGODlhAQABAIAAAP///////yH5BAEKAAEALAAAAAABAAEAAAICTAEAOw==",https://www.post-gazette.com/news/health/2020/11/18/Pfizer-COVID-19-vaccine-shot-95-effective-FDA-pandemic/stories/202011180099,Pittsburgh Post-Gazette,"Pfizer: COVID-19 shot 95% effective, seeking clearance soon"
1 month ago,2020-12-02 12:24:14.465057,Read More. Coronavirus: Moderna vaccine 94.5% effective according to early trials data · What does the Moderna vaccine mean for the fight against Covid?,"data:image/gif;base64,R0lGODlhAQABAIAAAP///////yH5BAEKAAEALAAAAAABAAEAAAICTAEAOw==",https://www.irishtimes.com/business/health-pharma/pfizer-s-upjohn-spin-off-completes-merger-with-mylan-to-form-viatris-1.4410897,The Irish Times,Pfizer’s Upjohn spin-off completes merger with Mylan to form Viatris
1 month ago,2020-12-02 12:24:14.467056,"Well, Moderna this week announced their interim results, and looking at their results, it looks as though the vaccine is greater than 94% effective. So, it really ...","data:image/gif;base64,R0lGODlhAQABAIAAAP///////yH5BAEKAAEALAAAAAABAAEAAAICTAEAOw==",https://www.ama-assn.org/delivering-care/public-health/mira-irons-md-discusses-new-cases-and-promising-news-about-vaccines,American Medical Association,"Mira Irons, MD, discusses new cases and promising news ..."
1 month ago,2020-12-02 12:24:14.469046,It means a decision on whether the vaccine can be used will come early. The Oxford vaccine has - like those of Pfizer and Moderna - arrived in record time to a ...,"data:image/gif;base64,R0lGODlhAQABAIAAAP///////yH5BAEKAAEALAAAAAABAAEAAAICTAEAOw==",https://www.bbc.com/news/health-55041371,BBC News,Oxford vaccine: How did they make it so quickly?
1 month ago,2020-12-02 12:24:14.470043,... Moderna's COVID-19 vaccine https://abcnews.go.com/GMA/Culture/dolly-partons-vanderbilt-donation-supported-modernas-covid-19/story?id=74255411.,"data:image/gif;base64,R0lGODlhAQABAIAAAP///////yH5BAEKAAEALAAAAAABAAEAAAICTAEAOw==",https://www.abc.net.au/radionational/programs/stop-everything/aunty-donna-pete-evans/12900010,,"Celebrity chefs go Nazi, Aunty Donna goes Netflix"
1 month ago,2020-12-02 12:24:14.472032,O'Toole said the Trudeau government only turned its attention to pre-ordering tens of millions of vaccine doses from companies such as Pfizer and Moderna in ...,"data:image/gif;base64,R0lGODlhAQABAIAAAP///////yH5BAEKAAEALAAAAAABAAEAAAICTAEAOw==",https://www.theoutlook.ca/pm-put-all-vaccine-eggs-in-one-china-basket-didn-t-consider-other-options-o-toole-1.24247415,,"PM put all vaccine 'eggs' in one China basket, didn't consider ..."
1 month ago,2020-12-02 12:24:14.474033,Oshkosh man arrested on suspicion of 4th OWI during New Year's stop · U.S. Clears Moderna Vaccine for COVID-19 · Police arrest pharmacist accused of ...,"data:image/gif;base64,R0lGODlhAQABAIAAAP///////yH5BAEKAAEALAAAAAABAAEAAAICTAEAOw==",https://www.wbay.com/2020/11/18/carnival-cancels-all-us-cruises-through-jan-31/,WBAY,Carnival cancels all US cruises through Jan. 31
1 month ago,2020-12-02 12:24:14.475029,"This time by Moderna, 95% effective,"" Trump tweeted. ""For those great 'historians', please remember that these great discoveries, which will end the China ...","data:image/gif;base64,R0lGODlhAQABAIAAAP///////yH5BAEKAAEALAAAAAABAAEAAAICTAEAOw==",https://www.usatoday.com/story/news/politics/elections/2020/11/16/election-2020-live-updates-trump-biden-atlas-whitmer/6308427002/,USA TODAY,Election 2020 live updates: Biden warns more may die from COVID without transition cooperation
1 month ago,2020-12-02 12:24:14.477029,Indications from Europe are that the Pfizer and Moderna vaccines are at the top of the queue to be approved. It is understood this is informing the work of the task ...,"data:image/gif;base64,R0lGODlhAQABAIAAAP///////yH5BAEKAAEALAAAAAABAAEAAAICTAEAOw==",https://www.rte.ie/news/coronavirus/2020/1128/1181092-covid-vaccine-ireland/,RTE.ie,Harris urges cross-party support for Covid-19 vaccine
1 month ago,2020-12-02 12:24:14.480018,"The Pfizer and Moderna vaccines also each require two doses, meaning people will have to go back for a second shot after three and four weeks, respectively, to ...","data:image/gif;base64,R0lGODlhAQABAIAAAP///////yH5BAEKAAEALAAAAAABAAEAAAICTAEAOw==",https://www.wect.com/2020/11/24/keep-mask-vaccine-wont-end-us-crisis-right-away/,WECT,Keep the mask: A vaccine won't end the US crisis right away
1 month ago,2020-12-02 12:24:15.706676,"Three vaccines - Pfizer-BioNTech, Sputnik and Moderna - have already reported good preliminary data from phase three trials, bringing hope that an end to the ...","data:image/gif;base64,R0lGODlhAQABAIAAAP///////yH5BAEKAAEALAAAAAABAAEAAAICTAEAOw==",https://middle-east-online.com/en/abu-dhabi%E2%80%99s-%E2%80%9Chope-consortium%E2%80%9D-deliver-billions-covid-19-vaccines-worldwide,Middle East Online,Abu Dhabi's “Hope Consortium” to deliver billions of COVID ...
1 month ago,2020-12-02 12:24:15.709669,"Pfizer last week asked the U.S. Food and Drug Administration for emergency authorization to begin distributing its vaccine, and Moderna is expected to do the ...","data:image/gif;base64,R0lGODlhAQABAIAAAP///////yH5BAEKAAEALAAAAAABAAEAAAICTAEAOw==",https://www.abc27.com/news/health/coronavirus/how-long-will-you-have-to-wear-a-mask-heres-what-the-experts-say/,ABC27,How long will you have to wear a mask? Here’s what the experts say
1 month ago,2020-12-02 12:24:15.711663,Governor DeSantis announces Moderna vaccine distribution to all Florida counties · New laws take effect New Year's Day · Joe Clark dies at 82 · Gainesville ...,"data:image/gif;base64,R0lGODlhAQABAIAAAP///////yH5BAEKAAEALAAAAAABAAEAAAICTAEAOw==",https://www.wcjb.com/2020/11/26/marion-county-boys-girls-club-dealing-with-their-second-burglary-of-the-year/,WCJB,Marion County Boys & Girls Club dealing with their second ...
1 month ago,2020-12-02 12:24:15.713702,"Although Moderna's vaccine does cause side effects like sore arms, fatigue, muscle aches, and chills, these were temporary. “It's a very exciting two weeks,” Barry ...","data:image/gif;base64,R0lGODlhAQABAIAAAP///////yH5BAEKAAEALAAAAAABAAEAAAICTAEAOw==",https://www.healthline.com/health-news/should-you-say-something-if-you-see-someone-not-wearing-a-mask,Healthline,Should You Say Something If You See Someone Not Wearing ...
1 month ago,2020-12-02 12:24:15.716650,"... DoH can't plan for people ignoring strategy, after DUP criticism; No shortage of flu vaccine in Northern Ireland, confirms Robin Swann; US-led Moderna Covid ...","data:image/gif;base64,R0lGODlhAQABAIAAAP///////yH5BAEKAAEALAAAAAABAAEAAAICTAEAOw==",https://www.belfasttelegraph.co.uk/news/northern-ireland/coronavirus-northern-ireland-we-need-to-get-a-grip-of-this-virus-says-oneill-after-14-deaths-and-331-new-cases-reported-39751955.html,Belfast Telegraph,"Coronavirus Northern Ireland: 'We need to get a grip of this virus', says O'Neill after 14 deaths and 331 new cases reported"
1 month ago,2020-12-02 12:24:15.718645,One hundred doses of the Moderna vaccine were given out at the Madison County Health Department on New Year's Eve. The county's public health director ...,"data:image/gif;base64,R0lGODlhAQABAIAAAP///////yH5BAEKAAEALAAAAAABAAEAAAICTAEAOw==",https://spectrumlocalnews.com/nys/watertown/coronavirus/2020/11/19/coronavirus-updates-cny,Spectrum News,Coronavirus: Latest Updates and Numbers From Across CNY
1 month ago,2020-12-02 12:24:15.720639,Moderna jumped 16.4% and Pfizer rose 1.9%. The two companies earlier this month released results showing their covid-19 vaccine candidates were highly ...,"data:image/gif;base64,R0lGODlhAQABAIAAAP///////yH5BAEKAAEALAAAAAABAAEAAAICTAEAOw==",https://www.arkansasonline.com/news/2020/nov/27/stocks-rise-wall-street-sp-500-hits-record-high/,Arkansas Online,Stocks rise on Wall Street as S&P 500 hits record high
1 month ago,2020-12-02 12:24:15.722634,Moderna said it would ask U.S. and European regulators Monday to allow emergency use of its COVID-19 vaccine. Its shares jumped 20.2 percent Monday.,"data:image/gif;base64,R0lGODlhAQABAIAAAP///////yH5BAEKAAEALAAAAAABAAEAAAICTAEAOw==",https://www.toledoblade.com/business/stock-market/2020/11/30/Stocks-slip-but-S-P-500-still-logs-best-month-since-April/stories/20201130123,Toledo Blade,"Stocks slip, but S&P 500 still logs best month since April"
1 month ago,2020-12-02 12:24:15.724629,Moderna chairman: We don't need deep-freeze conditions for vaccine ... Moderna chairman: We don't need deep-freeze conditions for vaccine ...,"data:image/gif;base64,R0lGODlhAQABAIAAAP///////yH5BAEKAAEALAAAAAABAAEAAAICTAEAOw==",https://www.cnn.com/2020/11/23/investing/joe-biden-ceos/index.html,CNN,Corporate America is ready for a Biden presidency
1 month ago,2020-12-02 12:24:15.727621,All rights reserved. Advertisement. Most Read. U.S. Clears Moderna Vaccine for COVID-19 · Police arrest pharmacist accused of intentionally spoiling COVID-19 ...,"data:image/gif;base64,R0lGODlhAQABAIAAAP///////yH5BAEKAAEALAAAAAABAAEAAAICTAEAOw==",https://www.weau.com/2020/11/25/substitute-teacher-accused-of-body-slamming-fla-high-school-student/,WEAU,Substitute teacher accused of body-slamming Fla. high school ...
1 month ago,2020-12-02 12:24:17.132646,Oshkosh man arrested on suspicion of 4th OWI during New Year's stop · U.S. Clears Moderna Vaccine for COVID-19 · Police arrest pharmacist accused of ...,"data:image/gif;base64,R0lGODlhAQABAIAAAP///////yH5BAEKAAEALAAAAAABAAEAAAICTAEAOw==",https://www.wbay.com/2020/11/10/rain-storms-ending-then-very-windy/,WBAY,"RAIN, STORMS ENDING... THEN VERY WINDY"
1 month ago,2020-12-02 12:24:17.134641,"U.S. clears Moderna vaccine for COVID-19, 2nd shot in arsenal. The sign · Moderna COVID-19 vaccine begins rollout as U.S. races to broaden injection ...","data:image/gif;base64,R0lGODlhAQABAIAAAP///////yH5BAEKAAEALAAAAAABAAEAAAICTAEAOw==",https://www.cp24.com/world/typhoon-ravaged-philippine-region-braces-for-new-storm-1.5183817?cache=yes%3FclipId%3D64268,CP24 Toronto's Breaking News,Typhoon-ravaged Philippine region braces for new storm
1 month ago,2020-12-02 12:24:17.136636,... maps and charts show the spread of the coronavirus and COVID-19 in Missouri and Illinois. Photos: Nursing home residents receive first Moderna vaccines.,"data:image/gif;base64,R0lGODlhAQABAIAAAP///////yH5BAEKAAEALAAAAAABAAEAAAICTAEAOw==",https://www.stltoday.com/lifestyles/health-med-fit/coronavirus/st-louis-area-coronavirus-recommendations-and-requirements/collection_7270e58b-5dde-5af1-a67c-cea8ca9260d9.html,STLtoday.com,St. Louis-area coronavirus recommendations and requirements | Coronavirus
1 month ago,2020-12-02 12:24:17.138630,"Ontario to receive 53,000 Moderna COVID-19 vaccine doses by end of December · FILE - In this Monday, May 18, 2020, file photo, a sign ...","data:image/gif;base64,R0lGODlhAQABAIAAAP///////yH5BAEKAAEALAAAAAABAAEAAAICTAEAOw==",https://www.cp24.com/news/canadians-gaining-weight-due-to-covid-19-driven-inactivity-stress-eating-poll-1.5201938,CP24 Toronto's Breaking News,"Coronavirus pandemic is making Canadians fat, new poll suggests"
1 month ago,2020-12-02 12:24:17.140625,"Earlier this week, pharmaceutical company Moderna published its preliminary phase-three results for its COVID-19 vaccination, which shows close to 95% ...","data:image/gif;base64,R0lGODlhAQABAIAAAP///////yH5BAEKAAEALAAAAAABAAEAAAICTAEAOw==",https://extra.ie/2020/11/20/news/irish-news/christmas-nursing-home-visits,Extra.ie,HSE chief expects Christmas visits to nursing homes ‘regardless’ of the COVID threat level
1 month ago,2020-12-02 12:24:17.141622,"Plus: the efficacy of Moderna's coronavirus vaccine, the latest on the Tokyo Games and Monocle's Chiara Rimella rounds up the week's best cultural stories.","data:image/gif;base64,R0lGODlhAQABAIAAAP///////yH5BAEKAAEALAAAAAABAAEAAAICTAEAOw==",https://monocle.com/radio/shows/the-briefing/2358/,Monocle,"Tuesday 17 November, The Briefing 2358 - Radio"
1 month ago,2020-12-02 12:24:17.143617,"... been fueling viral posts for weeks, after the good news about Pfizer and Moderna's potentially world-saving vaccines. The twin announcements from the Mass.","data:image/gif;base64,R0lGODlhAQABAIAAAP///////yH5BAEKAAEALAAAAAABAAEAAAICTAEAOw==",https://www.bostonmagazine.com/news/2020/11/25/boston-most-viral-city/,Boston magazine,"Why Everyone Is So Obsessed with Boston, America's Most ..."
