date,datetime,desc,img,link,media,title
1 week ago,2020-12-26 12:25:27.281518,"READING, Ohio (WKRC) - Some local firefighters received their first doses of Moderna's COVID-19 vaccine. The Reading Fire Department stepped up to get ...","data:image/gif;base64,R0lGODlhAQABAIAAAP///////yH5BAEKAAEALAAAAAABAAEAAAICTAEAOw==",https://local12.com/news/local/reading-firefighters-receive-first-dose-of-moderna-vaccine-cincinnati,WKRC TV Cincinnati,Reading firefighters receive first dose of Moderna vaccine
3 days ago,2020-12-30 12:25:27.283513,CALGARY -- Alberta residents in long-term continuing care facilities will begin receiving the Moderna COVID-19 vaccine on Wednesday. The first inoculations ...,"data:image/gif;base64,R0lGODlhAQABAIAAAP///////yH5BAEKAAEALAAAAAABAAEAAAICTAEAOw==",https://calgary.ctvnews.ca/alberta-continuing-care-residents-to-begin-receiving-moderna-covid-19-vaccine-wednesday-1.5248267,CTV Toronto,Alberta continuing care residents to begin receiving Moderna ...
3 days ago,2020-12-30 12:25:27.284510,"Recipharm and Moderna Finalize Agreement for Aseptic Drug Product Manufacturing and Fill-Finish for Supply to Countries Outside the U.S.. December 30, 2020 ...","data:image/gif;base64,R0lGODlhAQABAIAAAP///////yH5BAEKAAEALAAAAAABAAEAAAICTAEAOw==",https://www.businesswire.com/news/home/20201230005278/en/Recipharm-and-Moderna-Finalize-Agreement-for-Aseptic-Drug-Product-Manufacturing-and-Fill-Finish-for-Supply-to-Countries-Outside-the-U.S.,,Recipharm and Moderna Finalize Agreement for Aseptic Drug ...
2 weeks ago,2020-12-19 12:25:27.285508,"North Carolina health officials say up to 175,000 doses of the Moderna COVID-19 vaccine could be shipped to the state as early as Monday. This video file cannot ...","data:image/gif;base64,R0lGODlhAQABAIAAAP///////yH5BAEKAAEALAAAAAABAAEAAAICTAEAOw==",https://www.wcnc.com/article/news/health/coronavirus/moderna-vaccine-coronavirus-charlotte-hospitals/275-4cfa6c74-071f-4907-bf7b-185d3221f650,WCNC.com,Charlotte hospital among the first in the region to receive Moderna coronavirus vaccine
1 week ago,2020-12-26 12:25:27.287502,"San Diego County Reports 3,252 New COVID Cases as Moderna Vaccine Arrives. Posted by Chris Jennewein on December 21, 2020 in Tech | 383 Views. | 1 ...","data:image/gif;base64,R0lGODlhAQABAIAAAP///////yH5BAEKAAEALAAAAAABAAEAAAICTAEAOw==",https://timesofsandiego.com/tech/2020/12/21/san-diego-county-reports-3252-new-covid-cases-as-moderna-vaccine-arrives/,Times of San Diego,"San Diego County Reports 3,252 New COVID Cases as Moderna Vaccine Arrives"
2 days ago,2020-12-31 12:25:27.288501,Moderna's vaccine must be kept frozen for shipment and storage. The temperature problems underscore how the U.S. has faced obstacles in its effort to get 20 ...,"data:image/gif;base64,R0lGODlhAQABAIAAAP///////yH5BAEKAAEALAAAAAABAAEAAAICTAEAOw==",https://www.dallasnews.com/business/health-care/2020/12/30/temperature-snag-with-moderna-vaccine-delays-additional-shipments-to-texas/,The Dallas Morning News,Temperature snag with Moderna vaccine delays additional shipments to Texas
1 week ago,2020-12-26 12:25:28.310574,"That chemical — present in both the Pfizer and Moderna COVID-19 vaccines — can be associated with allergic reactions, added Director Peter Marks. “We just ...","data:image/gif;base64,R0lGODlhAQABAIAAAP///////yH5BAEKAAEALAAAAAABAAEAAAICTAEAOw==",https://www.bostonherald.com/2020/12/25/coronavirus-vaccine-allergic-reactions-chemical-in-both-pfizer-and-moderna-vaccines-could-be-a-culprit/,Boston Herald,Coronavirus vaccine allergic reactions: Chemical in both Pfizer and Moderna vaccines ‘could be a culprit’
3 weeks ago,2020-12-12 12:25:28.312566,"Moderna Confirms Supply Agreement with the Ministry of Health to Supply Singapore with mRNA Vaccine Against COVID-19 (mRNA-1273). December 14, 2020 ...","data:image/gif;base64,R0lGODlhAQABAIAAAP///////yH5BAEKAAEALAAAAAABAAEAAAICTAEAOw==",https://www.businesswire.com/news/home/20201214005514/en/Moderna-Confirms-Supply-Agreement-with-the-Ministry-of-Health-to-Supply-Singapore-with-mRNA-Vaccine-Against-COVID-19-mRNA-1273,,Moderna Confirms Supply Agreement with the Ministry of ...
1 week ago,2020-12-26 12:25:28.313566,"Orange County is preparing to receive its first round of the Moderna Covid-19 vaccine. The county will receive roughly 16,000 doses of the vaccine through the ...","data:image/gif;base64,R0lGODlhAQABAIAAAP///////yH5BAEKAAEALAAAAAABAAEAAAICTAEAOw==",https://www.bizjournals.com/orlando/news/2020/12/22/orange-county-covid-vaccine-mederna-florida.html,Orlando Business Journal,Orange County to get first shipment of Moderna vaccine
2 weeks ago,2020-12-19 12:25:28.314560,An advisory panel will give the FDA its opinion on Moderna's COVID-19 vaccine. The Federal Reserve projects stronger economic growth next year. Plus ...,"data:image/gif;base64,R0lGODlhAQABAIAAAP///////yH5BAEKAAEALAAAAAABAAEAAAICTAEAOw==",https://www.npr.org/2020/12/17/947440017/morning-news-brief,,"News Brief: Moderna Vaccine, Pandemic Economy, Google ..."
1 week ago,2020-12-26 12:25:28.316555,"KNOXVILLE, Tennessee — The Knox County Health Department received its first shipment Tuesday morning of the Moderna vaccine, prompting an upbeat and ...","data:image/gif;base64,R0lGODlhAQABAIAAAP///////yH5BAEKAAEALAAAAAABAAEAAAICTAEAOw==",https://www.wbir.com/article/news/health/coronavirus/hope-and-light-kchd-gets-first-moderna-vaccine-shipment-a-promising-sign-in-fight-against-covid-19/51-08a7f76b-b8d7-4daf-930b-69db0c6c5137,WBIR.com,"'Hope and light': KCHD gets first Moderna vaccine shipment, a promising sign in fight against COVID-19"
4 days ago,2020-12-29 12:25:28.317552,"Though the FDA recently gave emergency use authorization (EUA) to Moderna's (NASDAQ:MRNA) mRNA-1273 coronavirus vaccine, the company's stock was ...","data:image/gif;base64,R0lGODlhAQABAIAAAP///////yH5BAEKAAEALAAAAAABAAEAAAICTAEAOw==",https://www.fool.com/investing/2020/12/28/why-moderna-stock-dove-by-nearly-10-on-monday/,Motley Fool,Why Moderna Stock Dove by Nearly 10% on Monday
2 weeks ago,2020-12-19 12:25:28.318557,"FDA says fatigue, headaches and muscle pain are most common side effects of Moderna's Covid vaccine. Published Tue, Dec 15 202011:47 AM EST Updated ...","data:image/gif;base64,R0lGODlhAQABAIAAAP///////yH5BAEKAAEALAAAAAABAAEAAAICTAEAOw==",https://www.cnbc.com/2020/12/15/moderna-covid-vaccine-fatigue-headaches-and-muscle-pain-are-the-most-common-side-effects.html,CNBC,"FDA says fatigue, headaches and muscle pain are most common side effects of Moderna's Covid vaccine"
1 week ago,2020-12-26 12:25:28.319547,IRVINE (CBSLA) — More than 100 firefighters and paramedics received the Moderna coronavirus vaccine Saturday morning. The Orange County Fire Authority ...,"data:image/gif;base64,R0lGODlhAQABAIAAAP///////yH5BAEKAAEALAAAAAABAAEAAAICTAEAOw==",https://losangeles.cbslocal.com/2020/12/26/orange-county-firefighters-paramedics-receive-moderna-vaccine/,CBS Los Angeles,"Orange County Firefighters, Paramedics Receive Moderna Vaccine"
1 week ago,2020-12-26 12:25:28.321544,"State health officials are expecting to receive 94,800 doses in its initial shipment of the Moderna vaccine this week, with most of it arriving on Wednesday. A ...","data:image/gif;base64,R0lGODlhAQABAIAAAP///////yH5BAEKAAEALAAAAAABAAEAAAICTAEAOw==",https://www.startribune.com/some-shipments-of-moderna-vaccine-to-minnesota-delayed/600003829/,,Some shipments of Moderna vaccine to Minnesota delayed
2 weeks ago,2020-12-19 12:25:28.322466,"The Bountiful hospital became one of the first to receive doses of the Moderna vaccine, which received emergency use authorization from the Food and Drug ...","data:image/gif;base64,R0lGODlhAQABAIAAAP///////yH5BAEKAAEALAAAAAABAAEAAAICTAEAOw==",https://www.deseret.com/utah/2020/12/21/22192230/coronavirus-new-cases-deaths-hospitalizations-moderna-pfizer-vaccines-health-care-workers,Deseret News,"Utah reports 1,891 new cases as hospitals receive Moderna vaccine"
3 days ago,2020-12-30 12:25:29.403574,"Unlike the Pfizer vaccine, the second dose of the Moderna vaccine is administered 28 days after the first dose.","data:image/gif;base64,R0lGODlhAQABAIAAAP///////yH5BAEKAAEALAAAAAABAAEAAAICTAEAOw==",https://www.ksnt.com/health/coronavirus/emporias-newman-regional-health-receives-moderna-covid-19-vaccine/,KSNT News,Emporia’s Newman Regional Health receives Moderna COVID-19 vaccine
2 weeks ago,2020-12-19 12:25:29.404571,"“The Moderna product is regular frozen temperature and works with the equipment we've been using, so it's very exciting to get the product that's easier for us to ...","data:image/gif;base64,R0lGODlhAQABAIAAAP///////yH5BAEKAAEALAAAAAABAAEAAAICTAEAOw==",https://dayton247now.com/newsletter/upper-valley-medical-center-receives-first-shipment-of-moderna-vaccine,Dayton 24/7 Now,Upper Valley Medical Center receives first shipment of Moderna vaccine
2 days ago,2020-12-31 12:25:29.405569,"The Windsor-Essex County Health Unit announced Wednesday morning it would, within hours, receive enough doses of the Moderna vaccine to immunize ...","data:image/gif;base64,R0lGODlhAQABAIAAAP///////yH5BAEKAAEALAAAAAABAAEAAAICTAEAOw==",https://windsorstar.com/news/local-news/health-unit-to-inoculate-long-term-care-residents-with-moderna-vaccine,Windsor Star,Health unit to inoculate long-term care residents with Moderna vaccine
1 week ago,2020-12-26 12:25:29.407529,"BOISE, Idaho (CBS2) — St. Luke's received its first shipment of Moderna's COVID-19 vaccine Wednesday and started vaccinating healthcare workers in Canyon ...","data:image/gif;base64,R0lGODlhAQABAIAAAP///////yH5BAEKAAEALAAAAAABAAEAAAICTAEAOw==",https://idahonews.com/news/coronavirus/st-lukes-receives-first-shipment-of-moderna-doses-starts-canyon-county-vaccinations,Idaho News,"St. Luke's, Saint Alphonsus receive first shipments of Moderna vaccine"
2 weeks ago,2020-12-19 12:25:29.408559,"Moderna Inc. had to discard 400,000 doses of its experimental Covid-19 shot after a filtration issue compromised the product during the final stages of ...","data:image/gif;base64,R0lGODlhAQABAIAAAP///////yH5BAEKAAEALAAAAAABAAEAAAICTAEAOw==",https://www.bloomberg.com/news/articles/2020-12-17/moderna-ditches-400-000-vaccine-doses-but-still-set-to-meet-goal,Bloomberg,"Moderna Ditches 400,000 Vaccine Doses But Still Set to Meet Goal"
1 week ago,2020-12-26 12:25:29.409559,"NEW HANOVER COUNTY — Panza Allen McNeill, a 19-year New Hanover County Public Health nurse, received the first dose of the Moderna Covid-19 ...","data:image/gif;base64,R0lGODlhAQABAIAAAP///////yH5BAEKAAEALAAAAAABAAEAAAICTAEAOw==",https://portcitydaily.com/local-news/2020/12/22/first-dose-of-moderna-vaccine-given-to-19-year-nurse-in-new-hanover-county-free/,Port City Daily,First dose of Moderna vaccine given to 19-year nurse in New Hanover County [Free]
1 week ago,2020-12-26 12:25:29.411552,"Dr. Atul Gawande told CNBC his second shot in the Moderna Covid vaccine trial “knocked me down.” “Then about 24 hours later, I was back on my feet and ...","data:image/gif;base64,R0lGODlhAQABAIAAAP///////yH5BAEKAAEALAAAAAABAAEAAAICTAEAOw==",https://www.cnbc.com/2020/12/23/covid-vaccine-biden-advisor-dr-atul-gawande-was-in-moderna-trial-.html,CNBC,Biden Covid advisor Dr. Atul Gawande details his experience in Moderna vaccine trial
2 weeks ago,2020-12-19 12:25:29.412550,Vietnam veteran Patricia Thomas became one of the first people in the U.S. to get the Moderna COVID-19 vaccine on Monday at the VA Boston Community Living ...,"data:image/gif;base64,R0lGODlhAQABAIAAAP///////yH5BAEKAAEALAAAAAABAAEAAAICTAEAOw==",https://www.nbcboston.com/news/coronavirus/first-doses-of-modernas-coronavirus-vaccine-arrive-monday/2262691/,NBC10 Boston,First Doses of Moderna's Coronavirus Vaccine Are Given in Mass.
2 days ago,2020-12-31 12:25:29.413547,"“It's very emotional,” CEO Cynthia Marinelli told CTV News Toronto Thursday morning as the first batches of the Moderna vaccine were dropped at their doorstep. “ ...","data:image/gif;base64,R0lGODlhAQABAIAAAP///////yH5BAEKAAEALAAAAAABAAEAAAICTAEAOw==",https://www.cp24.com/news/first-long-term-care-residents-in-ontario-receive-moderna-covid-19-vaccinations-1.5249691,CP24 Toronto's Breaking News,First long-term care residents in Ontario receive Moderna ...
1 week ago,2020-12-26 12:25:29.415543,"Something went wrong. Video: Seminole, Orange counties to receive thousands of Moderna's COVID-19 vaccine.","data:image/gif;base64,R0lGODlhAQABAIAAAP///////yH5BAEKAAEALAAAAAABAAEAAAICTAEAOw==",https://www.wftv.com/news/local/seminole-county/seminole-county-begins-administering-8100-moderna-covid-19-vaccines/QLG44IHYZVFHRC6KAT5LPBUS4Q/,WFTV Orlando,"Seminole County begins administering 8,100 Moderna COVID-19 vaccines"
1 week ago,2020-12-26 12:25:30.537243,"On Tuesday morning, 1,300 doses of Moderna's COVID-19 vaccine arrived. And staff at the St. Cloud VA planned to administer 140 vaccines that day, prioritizing ...","data:image/gif;base64,R0lGODlhAQABAIAAAP///////yH5BAEKAAEALAAAAAABAAEAAAICTAEAOw==",https://www.sctimes.com/story/news/2020/12/22/st-cloud-va-doles-out-first-1-300-moderna-vaccines/4008126001/,St. Cloud Times,"St. Cloud VA doles out first of 1,300 Moderna vaccines"
1 week ago,2020-12-26 12:25:30.538246,"Moderna's vaccine could be stored at temperatures typical for refrigerators. “Because we weren't able to bring on Pfizer, we are thrilled now that Moderna has ...","data:image/gif;base64,R0lGODlhAQABAIAAAP///////yH5BAEKAAEALAAAAAABAAEAAAICTAEAOw==",https://wwmt.com/news/local/branch-st-joseph-and-hillsdale-counties-receive-first-shipments-of-moderna-vaccine,WWMT-TV,"Branch, St. Joseph, and Hillsdale counties receive first shipments of Moderna vaccine"
2 days ago,2020-12-31 12:25:30.540162,"The first shipment of the Moderna COVID-19 vaccine arrived in Saskatchewan on Wednesday. The shipments include 4,900 doses that will be given out to the ...","data:image/gif;base64,R0lGODlhAQABAIAAAP///////yH5BAEKAAEALAAAAAABAAEAAAICTAEAOw==",https://www.discovermoosejaw.com/local/moderna-vaccine-arrives-in-saskatchewan,DiscoverMooseJaw.com,Moderna Vaccine Arrives in Saskatchewan ...
1 week ago,2020-12-26 12:25:30.541234,"Officials at hospitals in Skowhegan, Augusta and Pittsfield reported receiving shipments Tuesday of the Moderna vaccine and planned to begin inoculating ...","data:image/gif;base64,R0lGODlhAQABAIAAAP///////yH5BAEKAAEALAAAAAABAAEAAAICTAEAOw==",https://www.centralmaine.com/2020/12/22/central-maine-hospitals-receive-hundreds-of-doses-of-moderna-vaccine-against-covid-19/,Kennebec Journal & Morning Sentinel,Central Maine hospitals receive hundreds of doses of ...
1 week ago,2020-12-26 12:25:30.542229,Dr. Hildreth mentioned in a tweet that he received the recently-approved Moderna COVID-19 vaccine. “I am very excited to witness and benefit from triumph of ...,"data:image/gif;base64,R0lGODlhAQABAIAAAP///////yH5BAEKAAEALAAAAAABAAEAAAICTAEAOw==",https://www.wkrn.com/community/health/coronavirus/meharry-president-dr-james-hildreth-receives-moderna-covid-19-vaccine/,WKRN News 2,Meharry President Dr. James Hildreth receives Moderna COVID-19 vaccine
1 week ago,2020-12-26 12:25:30.544224,"Bergen County Executive Jim Tedesco, Bergen New Bridge Medical Center CEO Deborah Visconi and staff posing with shipment of the Moderna COVID Vaccine.","data:image/gif;base64,R0lGODlhAQABAIAAAP///////yH5BAEKAAEALAAAAAABAAEAAAICTAEAOw==",https://www.insidernj.com/press-release/distribution-moderna-vaccine-bergen-county-healthcare-workers-begins-monday/,InsiderNJ,DISTRIBUTION OF MODERNA VACCINE TO BERGEN COUNTY HEALTHCARE WORKERS BEGINS MONDAY
2 weeks ago,2020-12-19 12:25:30.545221,Americans are increasingly concerned about vaccine safety after four people in Pfizer-BioNTech trials and three people in the Moderna trials developed Bell's ...,"data:image/gif;base64,R0lGODlhAQABAIAAAP///////yH5BAEKAAEALAAAAAABAAEAAAICTAEAOw==",https://www.usatoday.com/story/news/health/2020/12/15/pfizer-moderna-covid-vaccine-trials-and-bells-palsy-what-it/3904994001/,USA TODAY,COVID-19 vaccine trials report cases of brief facial paralysis. That's not as scary as it sounds.
2 weeks ago,2020-12-19 12:25:30.546219,PITTSBURGH (KDKA) – Seeing the Moderna Vaccine move closer to the arms of the American public is a particular point of pride for many in our area who ...,"data:image/gif;base64,R0lGODlhAQABAIAAAP///////yH5BAEKAAEALAAAAAABAAEAAAICTAEAOw==",https://pittsburgh.cbslocal.com/2020/12/18/rich-fitzgerald-covid-19-moderna-vaccine-trials/,CBS Pittsburgh,COVID-19 In Pittsburgh: County Executive Rich Fitzgerald Opens Up About Moderna Vaccine Trial
1 week ago,2020-12-26 12:25:30.548214,"... that produced them — Pfizer, BioNTech and Moderna — have total immunity against lawsuits related to injuries resulting from the vaccine until 2024.","data:image/gif;base64,R0lGODlhAQABAIAAAP///////yH5BAEKAAEALAAAAAABAAEAAAICTAEAOw==",https://www.cnbc.com/2020/12/23/pfizer-biontech-moderna-covid-19-vaccine-will-the-us-trust-it.html,CNBC,Nearly 4 in 10 Americans do not want to take the Covid vaccine. HHS is planning to spend $250 million to convince the U.S. it is safe
1 week ago,2020-12-26 12:25:30.549211,Key Takeaways · It will be months before demand for Moderna's vaccine can be accurately gauged. · The stock has sold off 15% this week and more than 30% ...,"data:image/gif;base64,R0lGODlhAQABAIAAAP///////yH5BAEKAAEALAAAAAABAAEAAAICTAEAOw==",https://www.investopedia.com/moderna-mrna-down-30-after-posting-all-time-high-5093543,Investopedia,Moderna (MRNA) Down 30% After Posting All-Time High
2 weeks ago,2020-12-19 12:25:32.635949,"The Moderna vaccine could be approved for 'emergency use authorization' by the FDA as early as Thursday, according to U.S. top infectious disease expert Dr.","data:image/gif;base64,R0lGODlhAQABAIAAAP///////yH5BAEKAAEALAAAAAABAAEAAAICTAEAOw==",https://cbsaustin.com/news/local/modernas-vaccine-could-mean-quicker-rollout-to-rural-texas-frontline-workers-if-approved,KEYE TV CBS Austin,"Moderna's vaccine could mean quicker rollout to rural Texas frontline workers, if approved"
1 week ago,2020-12-26 12:25:32.636947,Gov. Phil Murphy and state health officials were in Toms River Wednesday at the Ocean Health Initiative Center where doses of Moderna's COVID-19 vaccine ...,"data:image/gif;base64,R0lGODlhAQABAIAAAP///////yH5BAEKAAEALAAAAAABAAEAAAICTAEAOw==",https://www.njspotlight.com/video/toms-river-health-care-workers-receive-moderna-vaccine-at-drive-through-clinic/,NJ Spotlight,Toms River health care workers receive Moderna vaccine at drive-through clinic | Video
1 week ago,2020-12-26 12:25:32.637943,"EL PASO, Texas (KTSM) — The City of El Paso has received 2,400 Moderna vaccinations to help fight the spread of COVID-19; 900 doses will be given to ...","data:image/gif;base64,R0lGODlhAQABAIAAAP///////yH5BAEKAAEALAAAAAABAAEAAAICTAEAOw==",https://www.ktsm.com/local/el-paso-news/moderna-covid-19-vaccine-arrives-in-el-paso/,KTSM 9 News,Moderna COVID-19 vaccine arrives in El Paso
4 days ago,2020-12-29 12:25:32.638941,"The shipment of Moderna vaccines, a total of about 700 doses, arrived at Miami Jewish Health on Dec. 23. The first group of residents and employees received the ...","data:image/gif;base64,R0lGODlhAQABAIAAAP///////yH5BAEKAAEALAAAAAABAAEAAAICTAEAOw==",https://www.miamiherald.com/news/coronavirus/article248119300.html,Miami Herald,"At Florida’s largest nursing home, excitement marks first shipments of Moderna vaccine"
1 week ago,2020-12-26 12:25:32.640901,"Dr. Jose Santana, a 47-year-old physician at CRMC, received his first of two Moderna vaccinations. The second will be administered in 28 days. ""It was easier ...","data:image/gif;base64,R0lGODlhAQABAIAAAP///////yH5BAEKAAEALAAAAAABAAEAAAICTAEAOw==",https://www.tallahassee.com/story/news/2020/12/23/moderna-vaccine-arrives-tallahassee/4025844001/,Tallahassee.com,'Monumental day': First wave of vaccines arrive in Tallahassee
1 week ago,2020-12-26 12:25:32.641898,"ABILENE, Texas — The Abilene-Taylor County Public Health District received 600 doses of the Moderna vaccine. A FedEx driver dropped off the vaccine ...","data:image/gif;base64,R0lGODlhAQABAIAAAP///////yH5BAEKAAEALAAAAAABAAEAAAICTAEAOw==",https://ktxs.com/news/local/moderna-vaccine-arrives-in-abilene-mayor-calls-for-compliance-end-to-divisiveness,KTXS,"Moderna vaccine arrives in Abilene, Mayor calls for compliance, end to 'divisiveness'"
1 week ago,2020-12-26 12:25:32.643928,"YOUNGSTOWN — Mercy Health Youngstown received its first batch of the Moderna coronavirus vaccine, according to a release from the hospital system today.","data:image/gif;base64,R0lGODlhAQABAIAAAP///////yH5BAEKAAEALAAAAAABAAEAAAICTAEAOw==",https://www.mahoningmatters.com/local-news/mercy-health-receives-first-batch-of-moderna-vaccines-3205881,MahoningMatters.com,Mercy Health receives first batch of Moderna vaccines
2 weeks ago,2020-12-19 12:25:32.644926,"This week, Moderna's vaccine becomes available. President-elect Joe Biden is scheduled to be vaccinated Monday. The vaccines are considered crucial to ...","data:image/gif;base64,R0lGODlhAQABAIAAAP///////yH5BAEKAAEALAAAAAABAAEAAAICTAEAOw==",https://www.usatoday.com/story/news/health/2020/12/20/covid-19-new-virus-strain-impact-coronavirus-vaccines/3982016001/,USA TODAY,Fast-moving new coronavirus strain in England raises alarms
2 weeks ago,2020-12-19 12:25:32.645922,"Pharmaceutical company Moderna enrolled 30,000 people for its coronavirus vaccine trial. Among them was Nicki Minear of Roseville. ""I raised my hand because ...","data:image/gif;base64,R0lGODlhAQABAIAAAP///////yH5BAEKAAEALAAAAAABAAEAAAICTAEAOw==",https://www.abc10.com/article/news/health/coronavirus/vaccine/moderna-vaccine-trial-participant-shares-experience-ahead-fda-approval/103-e743c682-fae7-4631-bf90-1f0cd62ff3e1,ABC10.com KXTV,Moderna vaccine trial participant shares her experience ahead of possible FDA approval
2 weeks ago,2020-12-19 12:25:32.646920,There was good news with Moderna (NASDAQ:MRNA) on Tuesday regarding its closely followed mRNA-1273 coronavirus vaccine candidate. However ...,"data:image/gif;base64,R0lGODlhAQABAIAAAP///////yH5BAEKAAEALAAAAAABAAEAAAICTAEAOw==",https://www.fool.com/investing/2020/12/15/why-moderna-got-slammed-on-tuesday/,Motley Fool,Why Moderna Got Slammed on Tuesday
3 days ago,2020-12-30 12:25:33.948123,The Wichita Falls – Wichita County Public Health District reported Tuesday that they have received 500 doses of the Moderna COVID-19 vaccine. These doses ...,"data:image/gif;base64,R0lGODlhAQABAIAAAP///////yH5BAEKAAEALAAAAAABAAEAAAICTAEAOw==",https://www.timesrecordnews.com/story/news/local/2020/12/29/health-district-receives-first-doses-moderna-vaccine/4080394001/,Times Record News,Health district receives first doses of Moderna COVID-19 vaccine
6 days ago,2020-12-27 12:25:33.950118,"AMERICAN biotechnology company Moderna is “accelerating” the shipment of Covid-19 vaccine to the Philippines, Foreign Affairs Secretary Teodoro Locsin Jr.","data:image/gif;base64,R0lGODlhAQABAIAAAP///////yH5BAEKAAEALAAAAAABAAEAAAICTAEAOw==",https://www.manilatimes.net/2020/12/27/news/latest-stories/moderna-accelerating-vaccine-shipment-to-ph-locsin/818544/,The Manila Times,Moderna accelerating vaccine shipment to PH - Locsin – The Manila Times
3 days ago,2020-12-30 12:25:33.953144,"The Moderna vaccine has been allocated for long-term care facilities, causing the St. Joseph Health Department to rearrange plans, as staff originally expected to ...","data:image/gif;base64,R0lGODlhAQABAIAAAP///////yH5BAEKAAEALAAAAAABAAEAAAICTAEAOw==",https://www.newspressnow.com/news/local_news/coronavirus/smaller-pharmacies-health-department-not-receiving-moderna-vaccine/article_4abedc20-4a1d-11eb-9ecf-ef83659b996f.html,News-Press Now,"Smaller pharmacies, health department not receiving ..."
1 month ago,2020-12-02 12:25:33.955140,"""Moderna has started submitting initial data and will continue to roll in data as soon as they become available as agreed with HSA,"" said the HSA spokesman. This ...","data:image/gif;base64,R0lGODlhAQABAIAAAP///////yH5BAEKAAEALAAAAAABAAEAAAICTAEAOw==",https://www.straitstimes.com/singapore/health/singapores-hsa-reviewing-covid-19-vaccine-data-from-moderna,The Straits Times,Singapore's HSA reviewing Covid-19 vaccine data from ...
1 week ago,2020-12-26 12:25:33.956136,"The first round of a Moderna's COVID-19 vaccine is being given out in Massachusetts. The newly authorized vaccine was given Monday to older, at-risk ...","data:image/gif;base64,R0lGODlhAQABAIAAAP///////yH5BAEKAAEALAAAAAABAAEAAAICTAEAOw==",https://www.wcvb.com/article/huge-step-forward-first-moderna-covid-19-vaccines-given-out/35042697,WCVB Boston,'Huge step forward': First Moderna COVID-19 vaccines given out
2 weeks ago,2020-12-19 12:25:33.958099,"TOLEDO, Ohio (WTVG) - Now that area hospitals are getting their first round of COVID Vaccines from Pfizer, the second delivery of Moderna vaccines are being ...","data:image/gif;base64,R0lGODlhAQABAIAAAP///////yH5BAEKAAEALAAAAAABAAEAAAICTAEAOw==",https://www.13abc.com/2020/12/18/lucas-co-receives-moderna-vaccine-for-first-responders-next-week/,13abc Action News,Lucas Co. receives Moderna vaccine for first responders next ...
2 weeks ago,2020-12-19 12:25:33.959094,"MELBOURNE, Fla. – Brevard County's largest hospital group said it received its first doses of the Moderna coronavirus vaccine Monday for frontline workers and ...","data:image/gif;base64,R0lGODlhAQABAIAAAP///////yH5BAEKAAEALAAAAAABAAEAAAICTAEAOw==",https://www.clickorlando.com/news/local/2020/12/21/covid-19-nurse-first-to-receive-moderna-vaccine-at-brevard-county-hospital/,WKMG News 6 & ClickOrlando,COVID-19 nurse first to receive Moderna vaccine at Brevard County hospital
