date,datetime,desc,img,link,media,title
3 days ago,2020-12-30 12:25:33.960127,"Doses of Moderna's coronavirus vaccine arrived at the hospital on Monday, Dec. 28 and vaccinations began the same day, according to a press release from the ...","data:image/gif;base64,R0lGODlhAQABAIAAAP///////yH5BAEKAAEALAAAAAABAAEAAAICTAEAOw==",https://www.krem.com/article/news/health/coronavirus/eastern-state-hospital-workers-get-moderna-covid-vaccine/293-f2af8b38-ae80-415b-9592-bf0aa65a81ed,KREM.com,Eastern State Hospital workers get Moderna COVID-19 vaccine after dozens of infections
1 week ago,2020-12-26 12:25:33.962122,Moderna developed mRNA that instructs cells to produce proteins that are copies of two CMV antigens. The body's immune system then mounts a defense against ...,"data:image/gif;base64,R0lGODlhAQABAIAAAP///////yH5BAEKAAEALAAAAAABAAEAAAICTAEAOw==",https://www.fool.com/investing/2020/12/24/meet-modernas-most-likely-blockbusters-after-its-c/,Motley Fool,Meet Moderna's Most Likely Blockbusters After Its COVID Vaccine
2 days ago,2020-12-31 12:25:33.963119,"(LCG)- Lafayette Fire Department firefighters received the Moderna COVID-19 vaccine Tuesday, which was administered through the Louisiana Department of ...","data:image/gif;base64,R0lGODlhAQABAIAAAP///////yH5BAEKAAEALAAAAAABAAEAAAICTAEAOw==",https://www.klfy.com/community/lafayette-fire-department-firefighters-received-the-moderna-covid-19-vaccine/,KLFY,Lafayette Fire Department firefighters received the Moderna COVID-19 vaccine
1 week ago,2020-12-26 12:25:35.102237,"Munson Healthcare receives second shipment of Pfizer vaccine, Moderna coming Wednesday. by Natalie Spala. Tuesday, December 22nd 2020. AA.","data:image/gif;base64,R0lGODlhAQABAIAAAP///////yH5BAEKAAEALAAAAAABAAEAAAICTAEAOw==",https://upnorthlive.com/news/local/munson-healthcare-receives-second-shipment-of-pfizer-vaccine-moderna-coming-wednesday,UpNorthLive.com,"Munson Healthcare receives second shipment of Pfizer vaccine, Moderna coming Wednesday"
2 weeks ago,2020-12-19 12:25:35.103234,"The cybersecurity team at Moderna located the spoofed website and contacted federal authorities, who then started an investigation, according to the Justice ...","data:image/gif;base64,R0lGODlhAQABAIAAAP///////yH5BAEKAAEALAAAAAABAAEAAAICTAEAOw==",https://www.bankinfosecurity.com/doj-seizes-fake-domains-impersonating-moderna-regeneron-a-15638,BankInfoSecurity.com,"DOJ Seizes Fake Domains Impersonating Moderna, Regeneron"
3 weeks ago,2020-12-12 12:25:35.105229,Expect Moderna's stock price to balloon if the project nears completion -- the revenue it could make with this drug might surpass its coronavirus vaccine sales in ...,"data:image/gif;base64,R0lGODlhAQABAIAAAP///////yH5BAEKAAEALAAAAAABAAEAAAICTAEAOw==",https://www.fool.com/investing/2020/12/13/where-will-moderna-be-in-5-years/,Motley Fool,Where Will Moderna Be in 5 Years?
1 month ago,2020-12-02 12:25:35.107224,"Pfizer, Moderna apply for EMA authorization; Janssen's candidate begins rolling review. Posted 01 December 2020 | By Kari Oakes. Pfizer, Moderna apply for ...","data:image/gif;base64,R0lGODlhAQABAIAAAP///////yH5BAEKAAEALAAAAAABAAEAAAICTAEAOw==",https://www.raps.org/news-and-articles/news-articles/2020/12/pfizer-moderna-apply-for-ema-authorization-janssen,Regulatory Focus,"Pfizer, Moderna apply for EMA authorization; Janssen's ..."
1 week ago,2020-12-26 12:25:35.109219,Veteran and health care provider Dr. Evan Kelley was among the first to receive the Moderna vaccine at the VA Healthcare campus in Manchester. “My first ...,"data:image/gif;base64,R0lGODlhAQABAIAAAP///////yH5BAEKAAEALAAAAAABAAEAAAICTAEAOw==",https://www.wmur.com/article/moderna-vaccinations-start-in-va-health-care-system-veterans-asked-to-wait-for-guidance/35049378,WMUR Manchester,Moderna vaccinations start in VA health care system; veterans asked to wait for guidance
1 week ago,2020-12-26 12:25:35.110216,"On Wednesday, the New River Health District received its first shipment of the Moderna vaccine. While plans are still being made for public distribution, New ...","data:image/gif;base64,R0lGODlhAQABAIAAAP///////yH5BAEKAAEALAAAAAABAAEAAAICTAEAOw==",https://www.wsls.com/news/local/2020/12/23/covid-19-vaccination-efforts-continue-in-new-river-valley-as-moderna-vaccine-arrives/,WSLS 10,COVID-19 vaccination efforts continue in New River Valley as Moderna vaccine arrives
1 week ago,2020-12-26 12:25:35.112210,"BROWNWOOD, Texas — Hendrick Medical Center Brownwood received 600 doses of Moderna COVID vaccine on Wednesday. ""This is a welcomed first step in ...","data:image/gif;base64,R0lGODlhAQABAIAAAP///////yH5BAEKAAEALAAAAAABAAEAAAICTAEAOw==",https://ktxs.com/news/local/hendrick-medical-center-brownwood-receives-600-moderna-vaccines,KTXS,Hendrick Medical Center Brownwood receives 600 doses of Moderna COVID vaccine
2 weeks ago,2020-12-19 12:25:35.114205,"“The state's allocated Moderna to us,” said Greg Gardiner, chief clinical officer at Ashley Regional Hospital in Vernal. “The Pfizer (vaccine) has to be stored .","data:image/gif;base64,R0lGODlhAQABAIAAAP///////yH5BAEKAAEALAAAAAABAAEAAAICTAEAOw==",https://www.fox13now.com/news/coronavirus/local-coronavirus-news/smaller-utah-hospitals-await-vaccine-as-moderna-awaits-fda-approval,fox13now.com,Smaller Utah Hospitals await vaccine as Moderna awaits FDA ...
1 week ago,2020-12-26 12:25:35.115202,She volunteered herself to be a participant in the Moderna trials for the COVID-19 vaccine. The Atlanta woman said she did it for her grandchildren. Content ...,"data:image/gif;base64,R0lGODlhAQABAIAAAP///////yH5BAEKAAEALAAAAAABAAEAAAICTAEAOw==",https://www.wsbtv.com/news/local/great-grandmother-who-participated-moderna-trial-waits-learn-if-she-received-vaccine/F32MO3HDYZCZ5AI2Z77QSGIPNI/,WSB Atlanta,Great grandmother who participated in Moderna trial waits to learn if she received vaccine
2 weeks ago,2020-12-19 12:25:35.116199,"A year ago, Moderna was not on anyone's “Most Likely to Succeed” list. As the Cambridge biotech approached its 10th year, the company had yet to get a single ...","data:image/gif;base64,R0lGODlhAQABAIAAAP///////yH5BAEKAAEALAAAAAABAAEAAAICTAEAOw==",https://www.bostonglobe.com/2020/12/18/business/not-long-ago-moderna-had-plenty-doubters/,BetaBoston,"‘When the spotlight found Moderna, they were ready’: How the Cambridge biotech company became a world renowned success story"
1 week ago,2020-12-26 12:25:36.891751,"... Roanoke City and Alleghany Health Districts have all already received doses of the newly-approved Moderna vaccine, as have health districts across Virginia.","data:image/gif;base64,R0lGODlhAQABAIAAAP///////yH5BAEKAAEALAAAAAABAAEAAAICTAEAOw==",https://www.wdbj7.com/2020/12/22/distribution-of-pfizer-and-moderna-covid-vaccines-underway-in-roanokealleghany-health-districts/,WDBJ7,Distribution of Pfizer and Moderna COVID vaccines underway ...
2 days ago,2020-12-31 12:25:36.892711,Alberta has just given our 1st long-term care resident the Moderna COVID-19 vaccine. Sheila is a resident at Riverview Care Centre in Medicine Hat. She was ...,"data:image/gif;base64,R0lGODlhAQABAIAAAP///////yH5BAEKAAEALAAAAAABAAEAAAICTAEAOw==",https://globalnews.ca/news/7547710/coronavirus-alberta-first-moderna-vaccine-long-term-care-resident/,Globalnews.ca,COVID-19: Alberta’s 1st Moderna vaccine dose given to Medicine Hat long-term care resident
1 week ago,2020-12-26 12:25:36.894740,"ROANOKE, Va. (WDBJ) - Carilion Clinic is now administering both the Pfizer and Moderna vaccinations for COVID-19. So far, Carilion officials report they've ...","data:image/gif;base64,R0lGODlhAQABAIAAAP///////yH5BAEKAAEALAAAAAABAAEAAAICTAEAOw==",https://www.wdbj7.com/2020/12/23/carilion-clinic-vaccination-rollout-now-includes-moderna-vaccine/,WDBJ7,Carilion Clinic vaccination rollout now includes Moderna ...
1 week ago,2020-12-26 12:25:36.895738,"The COVID-19 vaccine distribution is becoming clearer with the Moderna vaccine now on the market, according to Dr. Doug Griffin of Sanford Health. Written By: ...","data:image/gif;base64,R0lGODlhAQABAIAAAP///////yH5BAEKAAEALAAAAAABAAEAAAICTAEAOw==",https://www.inforum.com/newsmd/coronavirus/6814160-Sanfords-chief-medical-officer-talks-Moderna-vaccine-side-effects,INFORUM,"Sanford's chief medical officer talks Moderna vaccine, side ..."
4 weeks ago,2020-12-05 12:25:36.896734,"Pfizer, partnering with BioNTech, and Moderna have created promising vaccines that scientists hope will lead to more medical breakthroughs using mRNA.","data:image/gif;base64,R0lGODlhAQABAIAAAP///////yH5BAEKAAEALAAAAAABAAEAAAICTAEAOw==",https://www.washingtonpost.com/health/2020/12/06/covid-vaccine-messenger-rna/,Washington Post,A gamble pays off in ‘spectacular success’: How the leading coronavirus vaccines made it to the finish line
1 week ago,2020-12-26 12:25:36.897735,"Tens of thousands of Moderna's COVID-19 vaccines were expected to arrive Tuesday in Santa Clara County, according to a plan that has been months in the ...","data:image/gif;base64,R0lGODlhAQABAIAAAP///////yH5BAEKAAEALAAAAAABAAEAAAICTAEAOw==",https://www.nbcbayarea.com/news/local/race-for-a-vaccine/santa-clara-county-expected-to-receive-39000-moderna-vaccines/2429635/,NBC Bay Area,Bay Area Counties Expected to Receive Moderna Vaccines
2 weeks ago,2020-12-19 12:25:36.899730,This innovative and monumental partnership has enabled NIH and Moderna to develop a safe and effective COVID-19 vaccine within the span of a year that will ...,"data:image/gif;base64,R0lGODlhAQABAIAAAP///////yH5BAEKAAEALAAAAAABAAEAAAICTAEAOw==",https://www.nih.gov/news-events/news-releases/statement-nih-barda-fda-emergency-use-authorization-moderna-covid-19-vaccine,,Statement from NIH and BARDA on the FDA Emergency Use ...
1 week ago,2020-12-26 12:25:36.900724,"(WLFI) - The recently approved Moderna COVID-19 vaccine is expected to arrive within the next week. ""It will take more than one or two vaccines to vaccinate ...","data:image/gif;base64,R0lGODlhAQABAIAAAP///////yH5BAEKAAEALAAAAAABAAEAAAICTAEAOw==",https://www.wlfi.com/content/news/Moderna-vaccine-expected-to-arrive-soon-in-Tippecanoe-County-573467851.html,wlfi.com,Moderna vaccine expected to arrive soon in Tippecanoe County
2 weeks ago,2020-12-19 12:25:36.901735,Doses of Moderna's COVID-19 vaccine arrived at 15 East Tennessee county health departments Monday morning. Pfizer vaccines arrived the week prior to aid ...,"data:image/gif;base64,R0lGODlhAQABAIAAAP///////yH5BAEKAAEALAAAAAABAAEAAAICTAEAOw==",https://www.wbir.com/article/news/health/coronavirus/christmas-came-early-15-east-tennessee-counties-receive-moderna-vaccine/51-3191c713-69f3-4da1-bb8f-30523f14be70,WBIR.com,'Christmas came early' | 15 East Tennessee counties receive Moderna vaccine
1 week ago,2020-12-26 12:25:36.903716,"Yukon is ""well-prepared"" for the arrival of the Moderna vaccine which could be approved by Health Canada this month, said Premier Sandy Silver on Tuesday.","data:image/gif;base64,R0lGODlhAQABAIAAAP///////yH5BAEKAAEALAAAAAABAAEAAAICTAEAOw==",https://www.cbc.ca/news/canada/north/officials-yukon-covid-19-update-1.5850814,CBC.ca,"Yukon is 'well-prepared' for Moderna vaccine, could be approved this month says premier"
3 days ago,2020-12-30 12:25:38.698659,"The Florida Department of Health in Collier County said it received 3,500 doses of the Moderna vaccine this week, but appointments for vaccinations filled up ...","data:image/gif;base64,R0lGODlhAQABAIAAAP///////yH5BAEKAAEALAAAAAABAAEAAAICTAEAOw==",https://www.naplesnews.com/story/news/coronavirus/2020/12/30/collier-county-start-vaccinations-appointment-sunday-after-moderna-shipment/4085486001/,Naples Daily News,"Collier County to start vaccinations by appointment Sunday after shipment of 3,500 Moderna vaccines"
1 week ago,2020-12-26 12:25:38.699657,"The Moderna medicine, the second vaccine in use to fight COVID-19, was given federal approval late last week. By Monday, doses were being distributed ...","data:image/gif;base64,R0lGODlhAQABAIAAAP///////yH5BAEKAAEALAAAAAABAAEAAAICTAEAOw==",https://greensboro.com/finally-here-guilford-county-receives-first-shipment-of-moderna-vaccine/article_d49514ba-4580-11eb-a40e-d39dc8bfa9c5.html,Greensboro News & Record,'Finally here': Guilford County receives first shipment of Moderna vaccine
2 weeks ago,2020-12-19 12:25:38.700654,One of Moderna's vaccine trials is taking place right here in Central Florida. New Smyrna Beach resident Doug Ritter is among those who participated in the trial in ...,"data:image/gif;base64,R0lGODlhAQABAIAAAP///////yH5BAEKAAEALAAAAAABAAEAAAICTAEAOw==",https://www.mynews13.com/fl/orlando/news/2020/12/17/deland-trial-participant-glad-to-see-moderna-covid-19-vaccine-nearing-approval,News 13 Orlando,Trial Volunteer Glad to See Moderna Vaccine Nearing Approval
2 weeks ago,2020-12-19 12:25:38.701652,"SACRAMENTO, Calif. (KTXL) — Now that Moderna's COVID-19 vaccine has received approval from the U.S. Food and Drug Administration, California is one ...","data:image/gif;base64,R0lGODlhAQABAIAAAP///////yH5BAEKAAEALAAAAAABAAEAAAICTAEAOw==",https://fox40.com/news/california-connection/california-expects-to-receive-672000-doses-of-moderna-covid-19-vaccine/,FOX40,"California expects to receive 672,000 doses of Moderna COVID-19 vaccine"
2 weeks ago,2020-12-19 12:25:38.703646,"Moderna could be a classic ""sell the fact"" story once the FDA approves its coronavirus vaccine, but others suggest its broader drug pipeline may justify its ...","data:image/gif;base64,R0lGODlhAQABAIAAAP///////yH5BAEKAAEALAAAAAABAAEAAAICTAEAOw==",https://www.thestreet.com/investing/moderna-up-600-this-year-limps-into-fda-vaccine-decision,TheStreet,"Moderna Shares, Up 600% This Year, Limp Into FDA Vaccine Decision"
2 days ago,2020-12-31 12:25:38.704644,SCHD and GraceMed Health Clinic have received their first doses of the Moderna COVID-19 vaccine. The vaccinations for community health care workers in ...,"data:image/gif;base64,R0lGODlhAQABAIAAAP///////yH5BAEKAAEALAAAAAABAAEAAAICTAEAOw==",https://www.ksnt.com/health/coronavirus/shawnee-county-receives-moderna-vaccine-community-health-care-workers-next-on-list/,KSNT News,"Shawnee County receives Moderna vaccine, community health care workers next on list"
1 week ago,2020-12-26 12:25:38.705645,"... Fairfax County Health Department on Wednesday baring gifts--- 5,000 Moderna COVID-19 vaccines. “This was a huge step towards the next phase of fighting ...","data:image/gif;base64,R0lGODlhAQABAIAAAP///////yH5BAEKAAEALAAAAAABAAEAAAICTAEAOw==",https://wjla.com/news/local/fairfax-county-received-5000-moderna-vaccines-here-is-what-comes-next,WJLA,"'A huge step towards fighting pandemic:' Fairfax County receives 5,000 Moderna vaccines"
4 days ago,2020-12-29 12:25:38.707636,"... on Monday, Loudoun County's government started administering shots of the Moderna vaccine to additional health care staff at a vaccination site in Sterling.","data:image/gif;base64,R0lGODlhAQABAIAAAP///////yH5BAEKAAEALAAAAAABAAEAAAICTAEAOw==",https://wtop.com/loudoun-county/2020/12/loudoun-county-begins-giving-moderna-vaccine-to-health-care-workers/,WTOP,Loudoun County begins giving Moderna vaccine to health care workers
1 week ago,2020-12-26 12:25:38.708634,"(KRDO) -- Starting Tuesday, Evans Army Community Hospital at Fort Carson will begin offering the Moderna COVID-19 vaccine to healthcare workers. A statement ...","data:image/gif;base64,R0lGODlhAQABAIAAAP///////yH5BAEKAAEALAAAAAABAAEAAAICTAEAOw==",https://krdo.com/health/2020/12/21/fort-carson-to-distribute-the-moderna-covid-19-vaccine-starting-tuesday/,KRDO,Fort Carson to distribute the Moderna COVID-19 vaccine ...
2 weeks ago,2020-12-19 12:25:38.709595,"University of Iowa hospitals expects about 1,500 Moderna vaccine doses this week. More than 1,100 UIHC employees have received the Pfizer COVID vaccine.","data:image/gif;base64,R0lGODlhAQABAIAAAP///////yH5BAEKAAEALAAAAAABAAEAAAICTAEAOw==",https://www.thegazette.com/subject/news/health/university-of-iowa-hospitals-expects-about-1500-moderna-vaccine-doses-this-week-20201221,The Gazette: Eastern Iowa Breaking News and Headlines,"University of Iowa hospitals expects about 1,500 Moderna vaccine doses this week"
1 week ago,2020-12-26 12:25:40.661372,"NBC Universal, Inc. The newly approved Moderna vaccine arrived at UCSF earlier this week, and on Wednesday staff began to receive shots. With two vaccines ...","data:image/gif;base64,R0lGODlhAQABAIAAAP///////yH5BAEKAAEALAAAAAABAAEAAAICTAEAOw==",https://www.nbcbayarea.com/news/coronavirus/ucsf-runs-out-of-pfizer-vaccine-starts-using-moderna/2430886/,NBC Bay Area,"UCSF Runs Out of Pfizer Vaccine, Starts Using Moderna"
6 days ago,2020-12-27 12:25:40.662441,"EL PASO, Texas (KFOX14) — The weekend after Christmas, an El Paso clinic is vaccinating its healthcare workers with dose one of the Moderna vaccine.","data:image/gif;base64,R0lGODlhAQABAIAAAP///////yH5BAEKAAEALAAAAAABAAEAAAICTAEAOw==",https://kfoxtv.com/news/local/el-paso-clinic-gives-first-doses-of-moderna-vaccine-to-healthcare-workers,KFOX El Paso,El Paso clinic gives first doses of Moderna vaccine to healthcare workers
6 days ago,2020-12-27 12:25:40.663441,"Essex County health care workers receive 1st doses of Moderna's coronavirus vaccine. News 12 Staff. Dec 26, 2020, 7:36pm EST. Updated on:Dec 26, ...","data:image/gif;base64,R0lGODlhAQABAIAAAP///////yH5BAEKAAEALAAAAAABAAEAAAICTAEAOw==",https://longisland.news12.com/essex-county-health-care-workers-receive-1st-doses-of-modernas-coronavirus-vaccine,News 12 Bronx,Essex County health care workers receive 1st doses of ...
1 week ago,2020-12-26 12:25:40.664437,"El Pasoans turned out by the dozen on Christmas Eve for the arrival of the Moderna vaccine, with the city opening a drive-thru clinic at the El Paso Zoo for Phase ...","data:image/gif;base64,R0lGODlhAQABAIAAAP///////yH5BAEKAAEALAAAAAABAAEAAAICTAEAOw==",https://kfoxtv.com/news/local/city-holds-vaccine-distribution-at-el-paso-zoo-some-not-in-priority-group-get-vaccinated,KFOX El Paso,"City begins Moderna vaccine distribution, giving shots to some who shouldn't be vaccinated"
1 month ago,2020-12-02 12:25:40.666433,"Moderna, a Massachusetts-based vaccine developer, partnered with the National Institutes of Health to develop and test a vaccine known as mRNA-1273. A ...","data:image/gif;base64,R0lGODlhAQABAIAAAP///////yH5BAEKAAEALAAAAAABAAEAAAICTAEAOw==",https://www.ky3.com/2020/12/06/coxhealth-expecting-modernas-covid-19-vaccine-possibly-around-dec-21/,KY3,"CoxHealth expecting Moderna's COVID-19 vaccine for employees, possibly around Dec. 21"
1 day ago,2021-01-01 12:25:40.668350,UPDATE: University Health tells us they have already filled up all their appointments for the the Moderna vaccine. We'll tell you when more appointments ...,"data:image/gif;base64,R0lGODlhAQABAIAAAP///////yH5BAEKAAEALAAAAAABAAEAAAICTAEAOw==",https://news4sanantonio.com/news/local/university-health-to-start-giving-moderna-vaccine-to-seniors-those-with-chronic-illnesses,WOAI,"University Health to start giving Moderna vaccine to seniors, those with chronic illnesses"
1 week ago,2020-12-26 12:25:40.669347,"“The Colmery-O'Neil VA is eager to offer the Moderna COVID-19 vaccine to health care personnel and our Veteran community living center residents,” said Mr.","data:image/gif;base64,R0lGODlhAQABAIAAAP///////yH5BAEKAAEALAAAAAABAAEAAAICTAEAOw==",https://www.wibw.com/2020/12/21/colmery-oneil-va-medical-center-to-begin-distribution-of-moderna-covid-vaccine/,WIBW,Colmery-O'Neil VA Medical Center to begin distribution of ...
1 week ago,2020-12-26 12:25:40.670345,What You Need To Know. Citrus Memorial nurses and doctors are the first to get the Moderna vaccine; Vaccine distribution is still yet to be determined in Florida,"data:image/gif;base64,R0lGODlhAQABAIAAAP///////yH5BAEKAAEALAAAAAABAAEAAAICTAEAOw==",https://www.baynews9.com/fl/tampa/news/2020/12/24/citrus-county-nurses--doctors-receive-first-moderna-vaccine,Bay News 9,"Citrus County Nurses, Doctors Receive First Moderna Vaccine"
1 day ago,2021-01-01 12:25:40.672376,Thousands of residents and staff in nursing homes across L.A. County have received Moderna vaccines for COVID-19 in the last week. But that doesn't mean ...,"data:image/gif;base64,R0lGODlhAQABAIAAAP///////yH5BAEKAAEALAAAAAABAAEAAAICTAEAOw==",https://laist.com/latest/post/20201231/COVID-19-vaccine-nursing-homes-LA-county-what%27s-next,LAist,Thousands Of Moderna Vaccines Being Distributed In LA ...
1 week ago,2020-12-26 12:25:40.673372,"Army veteran Patricia Thompson, 76, is the first patient to volunteer and be given the Moderna COVID-19 vaccine by VA pharmacist Kelly Chia at the Brockton ...","data:image/gif;base64,R0lGODlhAQABAIAAAP///////yH5BAEKAAEALAAAAAABAAEAAAICTAEAOw==",https://www.enterprisenews.com/picture-gallery/news/healthcare/2020/12/21/brockton-va-medical-center-moderna-covid-vaccine-staff-health-care-workers-patients/3995967001/,Enterprise News,Brockton VA Medical Center patients and staff receive ...
2 days ago,2020-12-31 12:25:41.892334,"Moderna vaccine delivered Wednesday, vaccinations to start in early January. Beth Brown · CBC News · Posted: Dec 30, 2020 11:44 AM CT | Last Updated ...","data:image/gif;base64,R0lGODlhAQABAIAAAP///////yH5BAEKAAEALAAAAAABAAEAAAICTAEAOw==",https://www.cbc.ca/news/canada/north/vaccine-arrives-nunavut-1.5856653,CBC.ca,First doses of Moderna COVID-19 vaccine arrive in Nunavut
1 month ago,2020-12-02 12:25:41.895291,"Enthusiasm has surged in recent weeks as Moderna, Pfizer and AstraZeneca all announced initial results from Phase III trials in human patients that showed ...","data:image/gif;base64,R0lGODlhAQABAIAAAP///////yH5BAEKAAEALAAAAAABAAEAAAICTAEAOw==",https://www.zdnet.com/article/mit-machine-learning-models-find-gaps-in-coverage-by-moderna-pfizer-other-warp-speed-covid-19-vaccines/,ZDNet,"MIT machine learning models find gaps in coverage by Moderna, Pfizer, other Warp Speed COVID-19 vaccines"
1 week ago,2020-12-26 12:25:41.896324,Oakes said they are anticipating getting another shipment of the Moderna vaccine next week because they do not have the capability to store the Pfizer vaccine ...,"data:image/gif;base64,R0lGODlhAQABAIAAAP///////yH5BAEKAAEALAAAAAABAAEAAAICTAEAOw==",https://www.wxii12.com/article/rockingham-county-division-of-public-health-gets-modernas-covid-19-vaccine/35059614,WXII The Triad,Rockingham County Division of Public Health gets Moderna's COVID-19 vaccine
3 days ago,2020-12-30 12:25:41.897325,The university announced in a Tuesday news release they are administering the Moderna COVID-19 vaccine– the second vaccine granted emergency ...,"data:image/gif;base64,R0lGODlhAQABAIAAAP///////yH5BAEKAAEALAAAAAABAAEAAAICTAEAOw==",https://www.progresstimes.net/2020/12/30/utrgv-begins-moderna-covid-19-vaccine-rollout/,Progresstimes,UTRGV begins Moderna COVID-19 vaccine rollout – Progress ...
3 weeks ago,2020-12-12 12:25:41.899321,"Pfizer and Moderna Extend Their Leads. ... better and better for the front-running vaccines from Pfizer (PFE) and BioNTech) BNTX) and from Moderna (MRNA), ...","data:image/gif;base64,R0lGODlhAQABAIAAAP///////yH5BAEKAAEALAAAAAABAAEAAAICTAEAOw==",https://www.barrons.com/articles/sanofi-and-glaxo-delay-their-covid-vaccine-pfizer-and-moderna-extend-their-leads-51607701067,Barron's,Sanofi and Glaxo Delay Their Covid Vaccine. Pfizer and Moderna Extend Their Leads.
3 weeks ago,2020-12-12 12:25:41.900314,"Moderna CEO Stephane Bancel has gained $4.8 billion in wealth this year, giving him a net worth of $5.3 billion. watch now. VIDEO2:5102:51. Stock surge of ...","data:image/gif;base64,R0lGODlhAQABAIAAAP///////yH5BAEKAAEALAAAAAABAAEAAAICTAEAOw==",https://www.cnbc.com/2020/12/09/new-vaccine-billionaires-gain-wealth-as-moderna-pfizer-shares-soar-.html,CNBC,New vaccine billionaires gain wealth as Moderna and BioNTech shares soar
3 days ago,2020-12-30 12:25:41.901311,... in the Dosher Wound Care Center and in the operating room — received his first dose of the Moderna vaccine; the second will be administered in 28 days.,"data:image/gif;base64,R0lGODlhAQABAIAAAP///////yH5BAEKAAEALAAAAAABAAEAAAICTAEAOw==",https://portcitydaily.com/live-briefs/2020/12/29/first-team-member-at-dosher-memorial-hospital-gets-moderna-vaccine/,Port City Daily,First team member at Dosher Memorial Hospital gets Moderna ...
1 week ago,2020-12-26 12:25:41.903308,"According to Nevada County Public Health, this week's allocation is likely to be the Moderna vaccine, which was authorized for emergency use Friday by the ...","data:image/gif;base64,R0lGODlhAQABAIAAAP///////yH5BAEKAAEALAAAAAABAAEAAAICTAEAOw==",https://www.theunion.com/news/nevada-county-expects-to-receive-moderna-vaccine-this-week/,The Union of Grass Valley,Nevada County expects to receive Moderna vaccine this week
5 days ago,2020-12-28 12:25:41.904307,"SAN DIEGO — Some recipients of Moderna's coronavirus vaccine have reported an unexpected side effect. “Of the 30,000 subject trials, there are three events ...","data:image/gif;base64,R0lGODlhAQABAIAAAP///////yH5BAEKAAEALAAAAAABAAEAAAICTAEAOw==",https://fox5sandiego.com/news/local-news/moderna-vaccine-may-cause-reaction-in-people-with-facial-fillers/,fox5sandiego.com,Moderna vaccine may cause reaction in people with facial fillers
4 days ago,2020-12-29 12:25:41.905304,"According to state health officials, 15,700 Moderna vaccines are in New Mexico as of Sunday.","data:image/gif;base64,R0lGODlhAQABAIAAAP///////yH5BAEKAAEALAAAAAABAAEAAAICTAEAOw==",https://www.koat.com/article/residents-and-staff-in-new-mexico-long-term-care-facilities-get-moderna-vaccine/35078506,KOAT Albuquerque,"Nearly 16K Moderna vaccine doses arrive for long term care residents, staff"
