date,datetime,desc,img,link,media,title
2 days ago,2020-12-31 12:25:43.884258,"Arnold Pipke, 92, was among the first seniors in Red Deer to receive the COVID-19 Moderna vaccine. (Photo courtesy of Alberta Health Services) ...","data:image/gif;base64,R0lGODlhAQABAIAAAP///////yH5BAEKAAEALAAAAAABAAEAAAICTAEAOw==",https://www.reddeeradvocate.com/news/two-red-deer-seniors-among-first-to-receive-moderna-covid-19-vaccine/,Red Deer Advocate,Two Red Deer seniors among first to receive Moderna COVID ...
1 day ago,2021-01-01 12:25:43.886247,The Moderna COVID-19 was the second vaccine to be approved for emergency use by the U.S. Food and Drug Administration (FDA) earlier this month. The ...,"data:image/gif;base64,R0lGODlhAQABAIAAAP///////yH5BAEKAAEALAAAAAABAAEAAAICTAEAOw==",https://www.alexcityoutlook.com/news/alex-citys-mainstreet-family-care-receives-900-plus-moderna-vaccines/article_baf1c3b6-4baa-11eb-9bd9-9f85f8346587.html,The Alexander City Outlook,Alex City's MainStreet Family Care receives 900-plus ...
2 weeks ago,2020-12-19 12:25:43.887246,"COVID-19 vaccine facts: Moderna approved, hidden costs, when you can get vaccinated. With two vaccines now granted emergency approval, where's your place ...","data:image/gif;base64,R0lGODlhAQABAIAAAP///////yH5BAEKAAEALAAAAAABAAEAAAICTAEAOw==",https://www.cnet.com/health/covid-19-vaccine-facts-moderna-approved-hidden-costs-when-you-can-get-vaccinated/,CNET,"COVID-19 vaccine facts: Moderna approved, hidden costs, when you can get vaccinated"
2 weeks ago,2020-12-19 12:25:43.888242,The Food and Drug Administration released a detailed analysis Tuesday morning of the COVID-19 vaccine from drugmaker Moderna that supports the ...,"data:image/gif;base64,R0lGODlhAQABAIAAAP///////yH5BAEKAAEALAAAAAABAAEAAAICTAEAOw==",https://www.npr.org/sections/health-shots/2020/12/15/946554638/fda-analysis-of-moderna-covid-19-vaccine-finds-it-effective-and-safe,NPR,FDA: Moderna COVID-19 Vaccine Is 94% Effective : Shots - Health News
5 days ago,2020-12-28 12:25:43.889240,A dose of the Moderna vaccine (File photo). SHARE. VANCOUVER -- B.C. provincial health officer Dr. Bonnie Henry says ...,"data:image/gif;base64,R0lGODlhAQABAIAAAP///////yH5BAEKAAEALAAAAAABAAEAAAICTAEAOw==",https://bc.ctvnews.ca/b-c-s-first-moderna-covid-19-vaccines-could-arrive-as-early-as-tuesday-1.5246240,CTV News Vancouver,B.C.'s first Moderna COVID-19 vaccines could arrive as early ...
1 month ago,2020-12-02 12:25:43.891236,(Reuters) - Moderna Inc's COVID-19 vaccine could be approved for emergency use within 24 to 72 hours after the U.S. health regulator's advisory committee ...,"data:image/gif;base64,R0lGODlhAQABAIAAAP///////yH5BAEKAAEALAAAAAABAAEAAAICTAEAOw==",https://www.reuters.com/article/us-health-coronavirus-moderna-vaccine-idUSKBN28C28U,Reuters,Moderna CEO expects emergency use nod for COVID-19 vaccine shortly after FDA's December 17 meet
1 month ago,2020-12-02 12:25:43.893232,"Moderna, Cambridge, MA. Mat Makowski, Ph.D. Jim Albert, M.S.. Kaitlyn Cross, M.S.. Emmes Company, Rockville, MD. Venkata-Viswanadh Edara, Ph.D.","data:image/gif;base64,R0lGODlhAQABAIAAAP///////yH5BAEKAAEALAAAAAABAAEAAAICTAEAOw==",https://www.nejm.org/doi/full/10.1056/NEJMc2032195,nejm.org,Durability of Responses after SARS-CoV-2 mRNA-1273 ...
6 days ago,2020-12-27 12:25:43.895190,"DPHSS received a total of 1,300 doses, which will fully immunize 650 individuals. Moderna's vaccine requires two shots for each person. Vaccine policy meeting.","data:image/gif;base64,R0lGODlhAQABAIAAAP///////yH5BAEKAAEALAAAAAABAAEAAAICTAEAOw==",https://www.postguam.com/news/local/1-300-moderna-vaccine-doses-arrive-on-guam/article_437dacb4-4835-11eb-bbbf-83c6fb149a5d.html,The Guam Daily Post,"1,300 Moderna vaccine doses arrive on Guam | Guam News"
2 weeks ago,2020-12-19 12:25:43.896187,NASHVILLE – The Tennessee Department of Health today announced the state expects to receive its first shipment of the Moderna COVID-19 vaccine on or ...,"data:image/gif;base64,R0lGODlhAQABAIAAAP///////yH5BAEKAAEALAAAAAABAAEAAAICTAEAOw==",https://www.tn.gov/health/news/2020/12/17/moderna-covid-19-vaccine-arriving-in-tennessee--next-steps-announced.html,,"Moderna COVID-19 Vaccine Arriving in Tennessee, Next ..."
3 days ago,2020-12-30 12:25:43.898217,CAMBRIDGE (CBS) — Moderna is making its coronavirus vaccine available to its employees. The Cambridge-based biotech company says its workers are ...,"data:image/gif;base64,R0lGODlhAQABAIAAAP///////yH5BAEKAAEALAAAAAABAAEAAAICTAEAOw==",https://boston.cbslocal.com/2020/12/30/moderna-employees-coronavirus-vaccine/,CBS Boston,Moderna Makes Coronavirus Vaccine Available To Its Employees
1 month ago,2020-12-02 12:25:45.786101,(Reuters) - Moderna Inc said on Thursday it expects to have between 100 million and 125 million doses of its experimental COVID-19 vaccine available globally ...,"data:image/gif;base64,R0lGODlhAQABAIAAAP///////yH5BAEKAAEALAAAAAABAAEAAAICTAEAOw==",https://www.reuters.com/article/health-coronavirus-moderna/moderna-to-supply-up-to-125-million-covid-19-vaccine-doses-globally-in-first-quarter-idINKBN28E09C?edition-redirect=ca,Reuters,Moderna to supply up to 125 million COVID-19 vaccine doses globally in first quarter
2 days ago,2020-12-31 12:25:45.787097,"Moderna has said it expects to provide about 20 million doses for use in the U.S. by the end of this month, and a total of about 200 million by the middle of 2021.","data:image/gif;base64,R0lGODlhAQABAIAAAP///////yH5BAEKAAEALAAAAAABAAEAAAICTAEAOw==",https://www.wsj.com/articles/moderna-to-offering-its-covid-19-vaccine-to-workers-contractors-board-11609281794,The Wall Street Journal,"Moderna to Offer Its Covid-19 Vaccine to Workers, Contractors and Board"
2 days ago,2020-12-31 12:25:45.789092,"Moderna announced on Tuesday that many of its 1,200 employees, contractors, and board members could be prioritized for its vaccine. The company clarified ...","data:image/gif;base64,R0lGODlhAQABAIAAAP///////yH5BAEKAAEALAAAAAABAAEAAAICTAEAOw==",https://www.businessinsider.com/moderna-includes-board-members-executives-as-initial-vaccine-recipients-2020-12,Business Insider,"Moderna to vaccinate its board members, executives. Pfizer won't. - Business Insider"
3 days ago,2020-12-30 12:25:45.790090,Moderna Inc (NASDAQ: MRNA) announced a worker vaccination plan as an extra layer of COVID-19 protection for its employees in the United States on ...,"data:image/gif;base64,R0lGODlhAQABAIAAAP///////yH5BAEKAAEALAAAAAABAAEAAAICTAEAOw==",https://finance.yahoo.com/news/moderna-makes-covid-19-vaccine-045143678.html,Yahoo Finance,"Moderna Makes COVID-19 Vaccine Available To Board, Staff, And Contractors On Priority"
1 week ago,2020-12-26 12:25:45.792084,"BOISE, Idaho (CBS2) — Southwest District Health received 2,900 doses Thursday of Moderna's COVID-19 vaccine. The shipment was welcomed after SWDH ...","data:image/gif;base64,R0lGODlhAQABAIAAAP///////yH5BAEKAAEALAAAAAABAAEAAAICTAEAOw==",https://idahonews.com/news/coronavirus/southwest-district-health-receives-2900-doses-of-moderna-covid-19-vaccine,Idaho News,"Southwest District Health receives 2,900 doses of Moderna COVID-19 vaccine"
2 weeks ago,2020-12-19 12:25:45.793081,Will Moderna Stock Hit $200 in 2021? Investors can expect billions of dollars in vaccine sales to drive the biotech company's share-price growth.,"data:image/gif;base64,R0lGODlhAQABAIAAAP///////yH5BAEKAAEALAAAAAABAAEAAAICTAEAOw==",https://www.fool.com/investing/2020/12/18/will-moderna-stock-hit-200-in-2021/,Motley Fool,Will Moderna Stock Hit $200 in 2021?
6 days ago,2020-12-27 12:25:45.794080,"So far, though, Moderna has been the only one to benefit from a share-price perspective. The company's shares soared more than 600% this year. Pfizer's stock is ...","data:image/gif;base64,R0lGODlhAQABAIAAAP///////yH5BAEKAAEALAAAAAABAAEAAAICTAEAOw==",https://www.fool.com/investing/2020/12/27/moderna-or-pfizer-which-company-stands-to-gain-the/,Motley Fool,Moderna or Pfizer? Which Company Stands to Gain the Most From Vaccine Rollout
1 week ago,2020-12-26 12:25:45.796074,Charts describing the duration of neutralizing antibodies from the Moderna vaccine. New England Journal of Medicine. A significant determinant of vaccines' ...,"data:image/gif;base64,R0lGODlhAQABAIAAAP///////yH5BAEKAAEALAAAAAABAAEAAAICTAEAOw==",https://www.forbes.com/sites/williamhaseltine/2020/12/22/the-moderna-vaccines-antibodies-may-not-last-as-long-as-we-hoped/,Forbes,The Moderna Vaccine’s Antibodies May Not Last As Long As We Hoped
3 weeks ago,2020-12-12 12:25:45.797072,"Moderna is developing therapeutics and vaccines for infectious diseases, immuno-oncology, rare diseases, cardiovascular diseases, and autoimmune and ...","data:image/gif;base64,R0lGODlhAQABAIAAAP///////yH5BAEKAAEALAAAAAABAAEAAAICTAEAOw==",https://www.businesswire.com/news/home/20201210005249/en/Moderna-Announces-First-Participants-Dosed-in-Phase-23-Study-of-COVID-19-Vaccine-Candidate-in-Adolescents,,Moderna Announces First Participants Dosed in Phase 2/3 ...
1 week ago,2020-12-26 12:25:45.798069,"""Moderna expects that the immunity induced by its COVID-19 vaccine would be protective against coronavirus variants reported in the United Kingdom (UK),"" read ...","data:image/gif;base64,R0lGODlhAQABAIAAAP///////yH5BAEKAAEALAAAAAABAAEAAAICTAEAOw==",https://www.livemint.com/companies/news/moderna-anticipates-its-vaccine-to-safeguard-against-new-mutated-coronavirus-11608784364743.html,Livemint,Moderna anticipates its vaccine to safeguard against new mutated coronavirus
2 weeks ago,2020-12-19 12:25:48.217928,... Administration said its preliminary analysis confirmed the effectiveness and safety of the vaccine developed by Moderna and the National Institutes of Health.,"data:image/gif;base64,R0lGODlhAQABAIAAAP///////yH5BAEKAAEALAAAAAABAAEAAAICTAEAOw==",https://ktla.com/news/nationworld/fda-review-says-modernas-covid-19-vaccine-is-effectiveness-safe/,KTLA,"FDA review says Modernaâ€™s COVID-19 vaccine is effective, safe"
1 day ago,2021-01-01 12:25:48.219924,"Moderna vaccines account for 12,054 of the doses administered, the health authority said. At 529 doses administered per 100,000 people, Oregon has one of the ...","data:image/gif;base64,R0lGODlhAQABAIAAAP///////yH5BAEKAAEALAAAAAABAAEAAAICTAEAOw==",https://www.oregonlive.com/coronavirus/2020/12/moderna-coronavirus-vaccine-triggers-severe-allergic-reaction-in-wallowa-county-health-care-worker-officials-say.html,oregonlive.com,Oregon health care worker hospitalized after severe reaction to Moderna coronavirus vaccine
1 week ago,2020-12-26 12:25:48.220922,"Heartland Community Health Center received its anticipated 1,000 doses of the Moderna COVID-19 vaccine at 9 a.m. Tuesday and began vaccinating Tier 1 ...","data:image/gif;base64,R0lGODlhAQABAIAAAP///////yH5BAEKAAEALAAAAAABAAEAAAICTAEAOw==",https://www2.ljworld.com/news/general-news/2020/dec/22/heartland-receives-moderna-vaccine-begins-distribution-lmh-health-waiting-for-more-vaccines-to-arrive/,Lawrence Journal-World,"Heartland receives Moderna vaccine, begins distribution; LMH ..."
3 weeks ago,2020-12-12 12:25:48.221918,"Remarkably, not only did BioNTech's and Moderna's vaccines move through testing faster than any others previously, but both were shown to be about 95% ...","data:image/gif;base64,R0lGODlhAQABAIAAAP///////yH5BAEKAAEALAAAAAABAAEAAAICTAEAOw==",https://www.biopharmadive.com/news/vaccine-developers-of-year-biontech-moderna-2020/589675/,,Vaccine Developers of the Year: BioNTech and Moderna
3 weeks ago,2020-12-12 12:25:48.222915,"Moderna said that of the first 100 million doses that the government has bought, 20 million will be delivered by the end of December, with the balance delivered in ...","data:image/gif;base64,R0lGODlhAQABAIAAAP///////yH5BAEKAAEALAAAAAABAAEAAAICTAEAOw==",https://www.marketwatch.com/story/us-buys-another-100-million-covid-19-vaccine-candidate-doses-moderna-2020-12-11,MarketWatch,U.S. buys another 100 million COVID-19 vaccine candidate doses: Moderna
2 weeks ago,2020-12-19 12:25:48.224910,"With the Moderna vaccine making its way around the state this week, ABC11 spoke to a Cape Fear Valley Health employee who partook in the clinical trials earlier ...","data:image/gif;base64,R0lGODlhAQABAIAAAP///////yH5BAEKAAEALAAAAAABAAEAAAICTAEAOw==",https://abc11.com/moderna-vaccine-north-carolina-covid-19-fayetteville/8961509,WTVD-TV,Moderna COVID 19 vaccine: Cape Fear Valley Health attorney shares experience in Moderna COVID 19 vaccine trial
2 weeks ago,2020-12-19 12:25:48.225907,Moderna shares rose 5.1% Thursday when an advisory panel cleared the way for Friday night's authorization.,"data:image/gif;base64,R0lGODlhAQABAIAAAP///////yH5BAEKAAEALAAAAAABAAEAAAICTAEAOw==",https://www.wsj.com/articles/moderna-stock-exxon-alphabet-amazon-boeing-general-mills-astrazeneca-shares-that-defined-the-week-11608340562,The Wall Street Journal,"Moderna, Exxon, Alphabet, Amazon: Stocks That Defined the Week"
2 weeks ago,2020-12-19 12:25:48.226904,"Dr. Andrew Jameson, division chief of infectious diseases at Mercy Health Saint Mary's, says they do not know if it will receive any Moderna doses. He says Mercy ...","data:image/gif;base64,R0lGODlhAQABAIAAAP///////yH5BAEKAAEALAAAAAABAAEAAAICTAEAOw==",https://www.fox17online.com/news/local-news/kent/michigan-to-receive-nearly-174-000-doses-of-moderna-vaccine-next-week,Fox17,"Michigan to receive nearly 174,000 doses of Moderna vaccine ..."
1 month ago,2020-12-02 12:25:48.228901,"Biotech's biggest short bet, vaccine developer Moderna Inc., broke another intraday record for a fourth straight session Tuesday, with one Wall Street strategist ...","data:image/gif;base64,R0lGODlhAQABAIAAAP///////yH5BAEKAAEALAAAAAABAAEAAAICTAEAOw==",https://www.bloomberg.com/news/articles/2020-12-01/moderna-mania-draws-comparisons-to-bitcoin-while-shorts-bleed,Bloomberg,Moderna Mania Draws Bitcoin Comparisons While Shorts Bleed
3 weeks ago,2020-12-12 12:25:48.231893,Shares of Moderna gained as much as 7% on Tuesday as Morgan Stanley said that the biotech company may provide the vast majority of COVID-19 vaccine ...,"data:image/gif;base64,R0lGODlhAQABAIAAAP///////yH5BAEKAAEALAAAAAABAAEAAAICTAEAOw==",https://www.businessinsider.com/moderna-stock-price-morgan-stanley-covid-vaccine-demand-pfizer-us-2020-12,Business Insider,Moderna climbs 7% as Morgan Stanley says it could fill a ...
1 week ago,2020-12-26 12:25:50.076589,"Moderna is using a Roche antibody test in clinical trials of its Covid-19 vaccine. The test can measure the antibodies created through vaccination, offering a ...","data:image/gif;base64,R0lGODlhAQABAIAAAP///////yH5BAEKAAEALAAAAAABAAEAAAICTAEAOw==",https://medcitynews.com/2020/12/moderna-roche-team-up-to-track-duration-of-covid-19-protection-after-vaccination/,MedCity News,"Moderna, Roche team up to track duration of Covid-19 ..."
2 days ago,2020-12-31 12:25:50.078584,"Moderna's vaccine has received emergency use authorization in the U.S. and U.K. where it is already being deployed. Shares have gained 468% in 2020, while ...","data:image/gif;base64,R0lGODlhAQABAIAAAP///////yH5BAEKAAEALAAAAAABAAEAAAICTAEAOw==",https://www.marketwatch.com/story/moderna-to-provide-korea-with-40-million-doses-of-its-covid-vaccine-2020-12-31,MarketWatch,Moderna to provide Korea with 40 million doses of its COVID vaccine
1 month ago,2020-12-02 12:25:50.080543,"Moderna Inc. (Nasdaq: MRNA), one of the three leading biotechnology companies pioneering vaccines for the COVID-19 disease, said Monday that it would ...","data:image/gif;base64,R0lGODlhAQABAIAAAP///////yH5BAEKAAEALAAAAAABAAEAAAICTAEAOw==",https://www.dailycamera.com/2020/12/01/boulders-cordenpharma-begins-shipping-lipids-for-moderna-vaccine,The Daily Camera,Boulder’s CordenPharma begins shipping lipids for Moderna vaccine
1 week ago,2020-12-26 12:25:50.081591,Moderna delivers first-ever consumer ad campaign from TBWA\Chiat\Day. The effort is seemingly aimed at instilling confidence in its COVID-19 vaccine.,"data:image/gif;base64,R0lGODlhAQABAIAAAP///////yH5BAEKAAEALAAAAAABAAEAAAICTAEAOw==",https://adage.com/article/agency-news/moderna-delivers-first-ever-consumer-ad-campaign-tbwachiatday/2302806,AdAge.com,Moderna delivers first-ever consumer ad campaign from ...
3 days ago,2020-12-30 12:25:50.083574,Moderna Confirms Discussions With the Government of South Korea to Supply South Korea With 40 Million Doses of COVID-19 Vaccine. Potential distribution in ...,"data:image/gif;base64,R0lGODlhAQABAIAAAP///////yH5BAEKAAEALAAAAAABAAEAAAICTAEAOw==",https://www.businesswire.com/news/home/20201229005430/en/Moderna-Confirms-Discussions-With-the-Government-of-South-Korea-to-Supply-South-Korea-With-40-Million-Doses-of-COVID-19-Vaccine,,Moderna Confirms Discussions With the Government of South ...
2 weeks ago,2020-12-19 12:25:50.084568,"DHSS director authorizes medical professionals to give Moderna vaccine. JEFFERSON CITY, Mo. (KMIZ). Randall Williams, director of the Department of Health ...","data:image/gif;base64,R0lGODlhAQABAIAAAP///////yH5BAEKAAEALAAAAAABAAEAAAICTAEAOw==",https://abc17news.com/news/2020/12/20/dhss-director-authorizes-medical-professionals-to-give-moderna-vaccine/,ABC17News.com,DHSS director authorizes medical professionals to give ...
1 month ago,2020-12-02 12:25:50.086562,"Moderna has also partnered with contract manufacturer Lonza, which is producing the vaccine at a facility in Portsmouth, N.H.. When the pandemic hit, Afeyan said ...","data:image/gif;base64,R0lGODlhAQABAIAAAP///////yH5BAEKAAEALAAAAAABAAEAAAICTAEAOw==",https://www.wgbh.org/news/local-news/2020/12/01/from-idea-to-mass-production-modernas-covid-vaccine-will-come-from-massachusetts,wgbh.org,"From Idea To Mass Production, Moderna's COVID Vaccine ..."
2 weeks ago,2020-12-19 12:25:50.087564,Moderna officials say that about 20 million doses could be delivered by the end of December. Both vaccines use genetic material called “messenger RNA” to ...,"data:image/gif;base64,R0lGODlhAQABAIAAAP///////yH5BAEKAAEALAAAAAABAAEAAAICTAEAOw==",https://www.wm.edu/news/stories/2020/wm-alumna-leads-groundbreaking-vaccine-research-at-moderna.php,William & Mary News,W&M alumna leads groundbreaking research platform at ...
3 weeks ago,2020-12-12 12:25:50.088557,"Moderna's turn in front of an outside expert panel at the FDA comes next Thursday, and the rush to get Pfizer/BioNTech out on the market indicates a quick ...","data:image/gif;base64,R0lGODlhAQABAIAAAP///////yH5BAEKAAEALAAAAAABAAEAAAICTAEAOw==",https://endpts.com/trump-officials-double-up-on-moderna-vaccine-supply-eyeing-h1-mrna-campaign-as-big-pharmas-stumble/,,"Trump officials double up on Moderna vaccine supply, eyeing ..."
2 days ago,2020-12-31 12:25:50.090551,"The recent shipment of the Moderna vaccine, coupled with the existing doses of the Pfizer, will allow the remaining patient-facing staff in the agency's practices ...","data:image/gif;base64,R0lGODlhAQABAIAAAP///////yH5BAEKAAEALAAAAAABAAEAAAICTAEAOw==",https://www.pressherald.com/2020/12/30/midcoast-hospital-rolls-out-moderna-vaccine/,pressherald.com,Midcoast Hospital rolls out Moderna vaccine - Portland Press ...
3 days ago,2020-12-30 12:25:52.081777,"TALLAHASSEE, Fla. (WCJB) - On Tuesday Governor Ron DeSantis announced that all 67 Florida counties will receive doses of Moderna's COVID-19 vaccine ...","data:image/gif;base64,R0lGODlhAQABAIAAAP///////yH5BAEKAAEALAAAAAABAAEAAAICTAEAOw==",https://www.wcjb.com/2020/12/30/governor-desantis-announces-moderna-vaccine-distribution-to-all-florida-counties/,WCJB,Governor DeSantis announces Moderna vaccine distribution ...
2 days ago,2020-12-31 12:25:52.082774,"New data from Moderna's COVID-19 vaccine trial shows an efficacy rate of 94.1% and that the shot can prevent symptomatic infection, according to a paper ...","data:image/gif;base64,R0lGODlhAQABAIAAAP///////yH5BAEKAAEALAAAAAABAAEAAAICTAEAOw==",https://www.bostonherald.com/2020/12/30/how-effective-are-moderna-pfizer-astrazeneca-vaccines/,Boston Herald,"How effective are Moderna, Pfizer, AstraZeneca vaccines?"
2 days ago,2020-12-31 12:25:52.084768,The Moderna vaccine has not yet been used in Israel as part of its immunization program. The Health Ministry has not officially announced its approval for use in ...,"data:image/gif;base64,R0lGODlhAQABAIAAAP///////yH5BAEKAAEALAAAAAABAAEAAAICTAEAOw==",https://www.timesofisrael.com/moderna-said-set-to-send-1-million-vaccines-next-week-cover-israels-shortfall/,The Times of Israel,"Moderna said set to send 1 million vaccines next week, cover Israel’s shortfall"
4 days ago,2020-12-29 12:25:52.086763,"Moderna to Present at the Goldman Sachs 13th Annual Healthcare CEOs Unscripted Conference: A View from the Top. December 29, 2020 08:00 AM Eastern ...","data:image/gif;base64,R0lGODlhAQABAIAAAP///////yH5BAEKAAEALAAAAAABAAEAAAICTAEAOw==",https://www.businesswire.com/news/home/20201229005053/en/Moderna-to-Present-at-the-Goldman-Sachs-13th-Annual-Healthcare-CEOs-Unscripted-Conference-A-View-from-the-Top,,Moderna to Present at the Goldman Sachs 13th Annual ...
4 days ago,2020-12-29 12:25:52.087760,"Residents and staff members of the Cottages of Lake St. Louis received some of the first doses of the Moderna COVID-19 vaccine on Monday, Dec. 28, 2020.","data:image/gif;base64,R0lGODlhAQABAIAAAP///////yH5BAEKAAEALAAAAAABAAEAAAICTAEAOw==",https://www.stltoday.com/lifestyles/health-med-fit/coronavirus/photos-nursing-home-residents-receive-first-moderna-vaccines/collection_d7b40d10-ea08-5f76-ad42-f11754c373b6.html,STLtoday.com,Photos: Nursing home residents receive first Moderna vaccines
2 days ago,2020-12-31 12:25:52.089755,"Dr. Kizzmekia ""Kizzy"" Corbett, a Black virologist who helped develop Moderna's vaccine, received her first dose of the coronavirus shot today. Corbett told CNN ...","data:image/gif;base64,R0lGODlhAQABAIAAAP///////yH5BAEKAAEALAAAAAABAAEAAAICTAEAOw==",https://www.insider.com/black-doctor-who-developed-moderna-vaccine-got-coronavirus-vaccine-2020-12,INSIDER,The Black scientist who helped develop Moderna's COVID-19 vaccine just got her first shot - Insider
2 days ago,2020-12-31 12:25:52.090752,– Decatur Morgan Hospital opened a vaccination clinic Wednesday morning to administer the first doses they received of the Moderna COVID-19 vaccine. Kelli ...,"data:image/gif;base64,R0lGODlhAQABAIAAAP///////yH5BAEKAAEALAAAAAABAAEAAAICTAEAOw==",https://whnt.com/news/decatur-morgan-hospital-give-first-covid-19-moderna-shots/,whnt.com,Decatur Morgan Hospital gives first COVID-19 Moderna shots
2 days ago,2020-12-31 12:25:52.092747,"MARION COUNTY, OR (KPTV) - It was a big day in Oregon Wednesday, as many county health offices received the first doses of the Moderna vaccine.","data:image/gif;base64,R0lGODlhAQABAIAAAP///////yH5BAEKAAEALAAAAAABAAEAAAICTAEAOw==",https://www.kptv.com/news/marion-county-portland-fire-share-moderna-vaccine-distribution-plans/article_32ce9f38-4b26-11eb-becf-1b9a24cffc08.html,KPTV.com,"Marion County, Portland Fire share Moderna vaccine distribution plans"
1 day ago,2021-01-01 12:25:52.093744,"Results good after Moderna's COVID-19 vaccine given at Little Rock senior living facility. by Desmond Nugent. Thursday, December 31st 2020. AA.","data:image/gif;base64,R0lGODlhAQABAIAAAP///////yH5BAEKAAEALAAAAAABAAEAAAICTAEAOw==",https://katv.com/news/local/moderna-vaccine-administered-at-little-rock-senior-living-facility,KATV,Results good after Moderna's COVID-19 vaccine given at Little Rock senior living facility
2 days ago,2020-12-31 12:25:52.095739,"So this week what we're doing, we got the Moderna vaccine in and we are vaccinating the rest of the healthcare workers,"" Bargmann explained. She said 50 ...","data:image/gif;base64,R0lGODlhAQABAIAAAP///////yH5BAEKAAEALAAAAAABAAEAAAICTAEAOw==",https://wgem.com/2020/12/30/100-moderna-vaccines-arrive-in-pike-county/,WGEM,100 Moderna vaccines arrive in Pike County
2 days ago,2020-12-31 12:25:54.072701,"Coming into Tuesday, Moderna shares had fallen in five of the prior six sessions and in eight of the prior 10. 2. Facebook | Decreased -1.77%. Last week, ...","data:image/gif;base64,R0lGODlhAQABAIAAAP///////yH5BAEKAAEALAAAAAABAAEAAAICTAEAOw==",https://www.thestreet.com/investing/5-worst-stocks-in-the-nasdaq-on-wednesday-moderna-slides-again,TheStreet,5 Worst Stocks in the Nasdaq on Wednesday: Moderna Slides Again
2 days ago,2020-12-31 12:25:54.073698,"The delivery of 421 shipments containing 144,400 doses of the Moderna vaccine to Texas was delayed by several days due a small number of shipments with ...","data:image/gif;base64,R0lGODlhAQABAIAAAP///////yH5BAEKAAEALAAAAAABAAEAAAICTAEAOw==",https://www.beckershospitalreview.com/supply-chain/temperature-problems-delay-144-400-moderna-vaccine-doses-for-texas.html,Becker's Hospital Review,"Temperature problems delay 144,400 Moderna vaccine doses ..."
2 days ago,2020-12-31 12:25:54.074697,First responders receive Moderna COVID-19 vaccine in San Ramon. Vaccinations administered to approximately 240 personnel from throughout Contra Costa ...,"data:image/gif;base64,R0lGODlhAQABAIAAAP///////yH5BAEKAAEALAAAAAABAAEAAAICTAEAOw==",https://www.danvillesanramon.com/news/2020/12/30/first-responders-receive-moderna-covid-19-vaccine-in-san-ramon,danvillesanramon.com,First responders receive Moderna COVID-19 vaccine in San ...
3 days ago,2020-12-30 12:25:54.076690,Natchez Police Chief Joseph Daughtry rolls up his sleeve to show his bandage after recieving his first dose of the Moderna version of the new COVID-19 ...,"data:image/gif;base64,R0lGODlhAQABAIAAAP///////yH5BAEKAAEALAAAAAABAAEAAAICTAEAOw==",https://natchezdemocrat.com/2020/12/29/moderna-version-of-covid-19-vaccine-administered-to-first-responders/,Natchez Democrat,Moderna version of COVID-19 vaccine administered to first responders - Mississippi's Best Community Newspaper | Mississippi's Best Community Newspaper
